author,title,description,url,source,image,category,language,country,published_at,topic
Tempo Desk,"NBA mock draft: Frenchmen could go 1-2 in draft, following Wembanyama’s footsteps","By JOHN MARSHALL AP Sports Writer This year&#8217;s NBA draft may be one of the weakest in years, with no clear-cut choice at No. 1 and an overall lack of depth. What it will likely have again this year: a French connection at the top. A year after San Antonio selected Victor Wembanyama with the [&#8230;]",https://tempo.com.ph/2024/06/06/nba-mock-draft-frenchmen-could-go-1-2-in-draft-following-wembanyamas-footsteps/,tempo,,general,en,ph,2024-06-05T23:55:43+00:00,sports
Larry Brown,Shohei Ohtani gets revenge on Paul Skenes,"Shohei Ohtani got some sweet revenge against Paul Skenes on Wednesday. Skenes was starting for his Pittsburgh Pirates against Ohtani&#8217;s Dodgers during their game at PNC Park in Pittsburgh. The Pirates got out to a great start, with Skenes holding the Dodgers scoreless for the first two innings, and the team&#8217;s offense scoring seven runs...The post Shohei Ohtani gets revenge on Paul Skenes appeared first on Larry Brown Sports.",https://larrybrownsports.com/baseball/shohei-ohtani-revenge-home-run-paul-skenes/634140,larrybrownsports,,general,en,us,2024-06-05T23:52:09+00:00,sports
Mike Klan,"CIF-SS announces top honors for baseball, softball, lacrosse and boys volleyball","All-CIF Southern Section honors for several spring sports were announced.The post CIF-SS announces top honors for baseball, softball, lacrosse and boys volleyball appeared first on News Channel 3-12.",https://keyt.com/sports/high-school-sports/2024/06/05/cif-ss-announces-top-honors-for-baseball-softball-lacrosse-and-boys-volleyball/,keyt,,general,en,us,2024-06-05T23:45:26+00:00,sports
Reice Shipley,Dan Patrick on Angel Reese: ‘Her notoriety is based off of Caitlin Clark’,"Chicago Sky star Angel Reese recently claimed her stake in the boom in the popularity of the WNBA, saying that Caitlin Clark is not the lone factor in the boost in attention for the sport. But not everyone is buying this claim, including Dan Patrick who spoke on the matter on Tuesday. Reese&#8217;s claim was Read more...The post Dan Patrick on Angel Reese: &#8216;Her notoriety is based off of Caitlin Clark&#8217; appeared first on Awful Announcing.",https://awfulannouncing.com/wnba/dan-patrick-angel-reese-caitlin-clark-growth-sport.html,awfulannouncing,,general,en,us,2024-06-05T23:45:25+00:00,sports
Ansh Athani,"Pakistan vs USA T20 World Cup: Match Preview, Head-to-Head, Team News, Pitch & Weather Report","Get the latest insights on the Pakistan vs USA T20 World Cup clash: Discover head-to-head stats, team news, pitch, and weather conditions. Predicted XIs and key players to watch out for in today’s game.The post Pakistan vs USA T20 World Cup: Match Preview, Head-to-Head, Team News, Pitch & Weather Report appeared first on Inside Sport India.",https://www.insidesport.in/cricket/pakistan-vs-usa-t20-world-cup-match-preview-head-to-head-team-news-pitch-weather-report/,Insidesport,,sports,en,us,2024-06-05T23:45:00+00:00,sports
Anukul Chauhan,"Hardik Pandya knows his importance in ‘World Cups’, declares ‘We Indians rule the world’ after 3-fer vs Ireland","India's dominant bowling performance sets the stage for a strong start to their World Cup campaign.The post Hardik Pandya knows his importance in &#8216;World Cups&#8217;, declares &#8216;We Indians rule the world&#8217; after 3-fer vs Ireland appeared first on Inside Sport India.",https://www.insidesport.in/cricket/hardik-pandya-knows-his-importance-in-world-cups-declares-we-indians-rule-the-world-after-3-fer-vs-ireland/,Insidesport,,sports,en,us,2024-06-05T23:44:47+00:00,sports
Reice Shipley,"Tim Kurkjian stresses importance of accuracy in reporting: ‘When you lose your credibility, you’re in trouble’","In the age of social media, sports reporting is perhaps one of the more difficult jobs in all of sports media nowadays with how many figures we have covering sports. With every breaking story, it seems like it is a rush for the top reporters in the industry to get to the story first. But Read more...The post Tim Kurkjian stresses importance of accuracy in reporting: &#8216;When you lose your credibility, you&#8217;re in trouble&#8217; appeared first on Awful Announcing.",https://awfulannouncing.com/podcasts/tim-kurkjian-accurate-reporting-importance.html,awfulannouncing,,general,en,us,2024-06-05T23:15:01+00:00,sports
Nick Coit,Hendricken Walks Off With Game 1 Win Over South Kingstown In D-I Baseball Title Series,"RIIL BASEBALL &#8211; DIVISION I CHAMPIONSHIP SERIES &#8211; GAME 1 South Kingstown 3 Hendricken 4 Categories: High School Sports, Sports Tags: Hendricken Hawks, RIIL Sports, South Kingstown Rebels",https://www.abc6.com/hendricken-walks-off-with-game-1-win-over-south-kingstown-in-d-i-baseball-title-series/,abc6,,general,en,us,2024-06-05T23:12:17+00:00,sports
Edward Sutelan,"Texas vs. Oklahoma softball live score, updates, highlights from Game 1 of 2024 Women's College World Series",Sporting News will be tracking scores and highlights from the first game of the Women's College World Series finals. Follow for updates from Wednesday's game.,https://www.sportingnews.com/us/college/news/texas-oklahoma-softball-live-updates-highlights-game-1-2024/b0c48aebd325d60b82e4a289,Sporting News,https://library.sportingnews.com/styles/crop_style_16_9_desktop/s3/2024-06/Texas%20softball%20060524%20Getty%20FTR.jpeg?h=920929c4&amp;itok=7Ijl6m5h,sports,en,us,2024-06-05T23:10:47+00:00,sports
Sudeep Sinha,Deontay Wilder’s Mother: Did She Leave Her Son at Age 9?,"Deontay Wilder has yet to gracefully retire from professional boxing, but many expect the coming days to have news about him hanging up his gloves. Undoubtedly, it will be a challenging decision to step away from the sport that defined much of his identity. However, a decision will have to be made. After consecutive losses [&#8230;]The post Deontay Wilder’s Mother: Did She Leave Her Son at Age 9? appeared first on EssentiallySports.",https://www.essentiallysports.com/boxing-news-deontay-wilder-s-mother-did-she-leave-her-son-at-age-nine/,Essentially Sports,https://image-cdn.essentiallysports.com/wp-content/uploads/20200907210658/deontay-wilder-16_6-1-473x315.jpg,sports,en,us,2024-06-05T23:09:03+00:00,sports
AP News,Lawyer in NBA betting case won’t say whether his client knows now-banned player Jontay Porter,"A defense lawyer is declining to comment on the case against a New York man charged in a sports betting scandal that cost former NBA player Jontay Porter his career. Attorney Michael Soshnick also wouldn’t Wednesday say whether his client, Long Phi Pham, knows the former Toronto Raptors forward who was banned from the NBA in April. Pham is charged with placing wagers based on private information from an NBA athlete, identified in a court complaint only as “Player 1.” Dates and other details match those cited in the NBA’s investigation into Porter. Current contact information for him or...",https://www.mymotherlode.com/sports/basketball-general-news/3370403/lawyer-in-nba-betting-case-wont-say-whether-his-client-knows-now-banned-player-jontay-porter.html,mymotherlode,,general,en,us,2024-06-05T23:07:49+00:00,sports
Adeyinka Salami,Nigeria’s Responsible Online Gambling Efforts: Genuine Progress or Mere Posturing?,"Iyke Bede&#160;writes that the Nigerian sports betting sector has recorded tremendous shifts in&#160;tackling Individuals with Gambling Problems (IWGPs), curbing the menace. Nonetheless, its adoption of innovation seems to have plateaued,",https://www.thisdaylive.com/index.php/2024/06/06/nigerias-responsible-online-gambling-efforts-genuine-progress-or-mere-posturing/,thisdaylive,,general,en,us,2024-06-05T23:00:00+00:00,sports
Marin Independent Journal,"Sports in Marin: Thursday, Friday","Thursday Baseball San Rafael Pacifics at Vallejo, 6 p.m., Vallejo",https://www.marinij.com/2024/06/05/sports-in-marin-thursday-friday-158/,marinij,,general,en,us,2024-06-05T22:58:08+00:00,sports
Grey Papke,Keenan Allen makes big statement about his future with Bears,"After spending his entire career in California, wide receiver Keenan Allen was traded from the Los Angeles Chargers to the Chicago Bears during the offseason. Though it has only been a few months, Allen appears to like what he has seen so far. Allen has one year remaining on his contract, and on Tuesday, he...The post Keenan Allen makes big statement about his future with Bears appeared first on Larry Brown Sports.",https://larrybrownsports.com/football/keenan-allen-bears-contract-extension-interest/634139,larrybrownsports,,general,en,us,2024-06-05T22:57:19+00:00,sports
NBC Sports BayArea,"Draymond brutally torches Bayless, ‘Undisputed' ratings",Draymond Green did not hold back in roasting Skip Bayless after the sports commentator's latest comments about him.,https://www.yahoo.com/entertainment/draymond-brutally-torches-bayless-undisputed-215022045.html,sports,,general,en,us,2024-06-05T22:53:01+00:00,sports
paulmbanks,"Man United Transfer Talk: Milos Kerkez, Omari Forson","Manchester United have released their list, eight deep, of players leaving the club this summer. There are no real surprises, and the only big names on there you already know- Anthony Martial and Raphael Varane. Another player exiting stage left is Omari Forson, the young striker. More on him and Milos Kerkez, potentially the club&#8217;s [&#8230;]The post Man United Transfer Talk: Milos Kerkez, Omari Forson appeared first on The Sports Bank.",https://www.thesportsbank.net/football/manchester-united/kerkez-forson/,thesportsbank,,general,en,us,2024-06-05T22:50:21+00:00,sports
"Kyle Schnitzer, Ben Kochman",Judge sets $750K bail for Brooklyn “poker shark” in $1M gambling scheme with banned NBA player Jontay Porter,"A self-described &#8220;poker shark&#8221; was busted for his role in pushing former Toronto Raptors forward Jontay Porter — who is banned for life from the NBA — to leave games early with phony injuries as part of a $1 million sports betting scandal. A federal judge set bail at $750,000 for Long Phi Pham on...",https://nypost.com/2024/06/05/us-news/judge-sets-750k-bail-for-brooklyn-poker-whiz-in-1m-gambling-scheme-with-banned-nba-player-jontay-porter/,Post,https://nypost.com/wp-content%2Fuploads%2Fsites%2F2%2F2024%2F06%2F83304105.jpg?quality%3D90%26strip%3Dall,general,en,zm,2024-06-05T22:43:50+00:00,sports
Darryn Albert,Report: White Sox could trade former MVP candidate at deadline,"The Chicago White Sox may be putting another big fish up for sale. Jeff Passan of ESPN reported this week that Chicago is open to trading outfielder Luis Robert Jr. at the deadline. Passan notes that the White Sox are &#8220;open for business&#8221; and adds that Tommy Pham, Erick Fedde, and Garrett Crochet are among...The post Report: White Sox could trade former MVP candidate at deadline appeared first on Larry Brown Sports.",https://larrybrownsports.com/baseball/white-sox-trade-mvp-candidate-luis-robert/634137,larrybrownsports,,general,en,us,2024-06-05T22:43:26+00:00,sports
Grey Papke,Ex-Patriots star was ‘disappointed’ with Tom Brady roast,"One of Tom Brady&#8217;s former teammates was quite unimpressed with the recent roast of the quarterback. Longtime New England Patriots wide receiver Wes Welker was asked Wednesday if he had a favorite joke from the roast. The answer was no, and Welker even said he was &#8220;disappointed&#8221; in the event. &#8220;Not really. I was a...The post Ex-Patriots star was &#8216;disappointed&#8217; with Tom Brady roast appeared first on Larry Brown Sports.",https://larrybrownsports.com/football/tom-brady-wes-welker-reaction-roast/634136,larrybrownsports,,general,en,us,2024-06-05T22:37:55+00:00,sports
Misha Ghosh,India vs Kuwait: Last Dance for Sunil Chhetri as India dreams for Round 3 of FIFA World Cup Qualifiers,India vs Kuwait: India take on Kuwait aiming for a place in Round 3 of FIFA World Cup Qualifiers as Sunil Chhetri plays his last gameThe post India vs Kuwait: Last Dance for Sunil Chhetri as India dreams for Round 3 of FIFA World Cup Qualifiers appeared first on Inside Sport India.,https://www.insidesport.in/football/india-vs-kuwait-last-dance-for-sunil-chhetri-as-india-dreams-for-round-3-of-fifa-world-cup-qualifiers/,Insidesport,,sports,en,us,2024-06-05T22:30:00+00:00,sports
The Associated Press,Lawyer in NBA betting case won’t say whether his client knows now-banned player Jontay Porter,"NEW YORK (AP) &#8212; A defense lawyer declined to comment Wednesday on the case against a New York man charged in a sports betting scandal that cost former NBA player Jontay Porter his career. The attorney, Michael Soshnick, also wouldn&#8217;t say whether his client, Long Phi Pham, knows the former Toronto Raptors forward who was [&#8230;]",https://nationalpost.com/pmn/news-pmn/lawyer-in-nba-betting-case-wont-say-whether-his-client-knows-now-banned-player-jontay-porter,nationalpost,,general,en,us,2024-06-05T22:26:00+00:00,sports
,Lawyer in NBA betting case won't say whether his client knows now-banned player Jontay Porter,A defense lawyer is declining to comment on the case against a New York man charged in a sports betting scandal that cost former NBA player Jontay Porter his career,https://www.sandiegouniontribune.com/news/nation-world/story/2024-06-05/lawyer-in-nba-betting-case-wont-say-whether-his-client-knows-now-banned-player-jontay-porter,signonsandiego,,general,en,us,2024-06-05T22:22:46+00:00,sports
AP News,Colts player representative says he’s opposed to expanding NFL season to 18 games,"Indianapolis Colts center Ryan Kelly says he's opposed to expanding NFL seasons from 17 games to 18 games. The team's NFLPA player representative minced no words when he spoke after the team's second minicamp practice. Kelly, a four-time Pro Bowler who is entering his ninth NFL season, says it's “simply too many games.” The subject was first broached by league commissioner Robert Goodell on a sports talk show in April, and Kelly seemed to reluctantly acknowledge that the day might be coming when teams play 18 games — even if he doesn't like it.",https://www.mymotherlode.com/sports/nfl-general-news/3370366/colts-player-representative-says-hes-opposed-to-expanding-nfl-season-to-18-games.html,mymotherlode,,general,en,us,2024-06-05T22:12:00+00:00,sports
Darryn Albert,Bulls giving big new job to Billy Donovan’s son,"The Chicago Bulls can&#8217;t get enough of the Donovan clan. Shams Charania of The Athletic reported Wednesday that the Bulls are hiring Billy Donovan III as head coach of their G League team, the Windy City Bulls. Donovan III is the son of current Bulls head coach Billy Donovan. A former walk-on for his father...The post Bulls giving big new job to Billy Donovan&#8217;s son appeared first on Larry Brown Sports.",https://larrybrownsports.com/basketball/bulls-new-job-billy-donovan-son/634135,larrybrownsports,,general,en,us,2024-06-05T22:08:40+00:00,sports
Sajid Salamat,SHC summons DG Parks over entry fees in public parks case,"The Sindh High Court has taken a firm stance on the issue of entry fees in public parks and sports grounds, summoning the Director-General (DG) Parks for a hearing. In a written order addressing the collection of entry fees, the court questioned the Karachi Metropolitan Corporation (KMC) about the number of parks and sports fields [&#8230;]",https://dailytimes.com.pk/1198320/shc-summons-dg-parks-over-entry-fees-in-public-parks-case/,Daily Times,,general,en,pk,2024-06-05T22:07:45+00:00,sports
Larry Brown,Report: Manti Te’o being considered for interesting media job,"Manti Te&#8217;o last played in the NFL in 2020, but it seems like football fans may be able to see him back on their TVs soon. The Athletic&#8217;s Andrew Marchand published a column on Wednesday regarding the future of NFL Network show &#8220;Good Morning Football.&#8221; The morning talk show has been off the air since...The post Report: Manti Te&#8217;o being considered for interesting media job appeared first on Larry Brown Sports.",https://larrybrownsports.com/football/manti-teo-considered-media-job-gmfb/634132,larrybrownsports,,general,en,us,2024-06-05T22:06:09+00:00,sports
Darryn Albert,FX gets roasted for their choice of actor to play Steph Curry in TV show,FX has Steph Curry looking more like Steve Curry in their new TV show. The highly-anticipated new FX television miniseries &#8220;Clipped&#8221; premiered this week on Hulu. &#8220;Clipped&#8221; is a dramatized retelling of the 2014 scandal that led to LA Clippers owner Donald Sterling being banned from the NBA for life. The series is based on...The post FX gets roasted for their choice of actor to play Steph Curry in TV show appeared first on Larry Brown Sports.,https://larrybrownsports.com/basketball/fx-roasted-actor-steph-curry-clipped/634133,larrybrownsports,,general,en,us,2024-06-05T21:54:01+00:00,sports
Gordon Kass,"Sobrato team, Live Oak’s Christian Hauge sparkle in track and field","Both Sobrato and Live Oak had track and field standouts this spring. The most prominent accomplishment came from the Bulldogs, as their boys and girls teams both won league titles. Each went 5-0 in Blossom Valley Athletic League, Almaden Valley Division dual meets. Live Oak’s Christian Hauge led in individual accomplishments. The Acorns multi-sport star [&#8230;]",https://morganhilltimes.com/sobrato-team-live-oaks-christian-hauge-sparkle-in-track-and-field/,morganhilltimes,,general,en,us,2024-06-05T21:49:10+00:00,sports
Dylan McNeill,Prep sports | 2024 H-DNL baseball All-League teams announced,McKinleyville's Evan Fraser and Ferndale's Parker Prior take home H-DNL MVP awards with both the Panthers and Wildcats each having five players on the All-League teams.,https://www.times-standard.com/2024/06/05/prep-sports-2024-h-dnl-baseball-all-league-teams-announced/,times-standard,https://www.times-standard.com/wp-content/uploads/2024/05/ETS-L-MACKWIN-0511-01.jpg?w=1400px&strip=all,general,en,us,2024-06-05T21:44:07+00:00,sports
,"Inside NBC's Olympics bet on pop culture in Paris, with help from Snoop Dogg and Cardi B",NBC is inserting some pop culture flavor into the world’s biggest sports spectacle: From Megan Thee Stallion dancing with dressage horses at the Palace of Versailles to Peyton…,https://japantoday.com/category/paris-2024-olympics/inside-nbc%27s-olympics-bet-on-pop-culture-in-paris-with-help-from-snoop-dogg-and-cardi-b,japantoday,,general,en,us,2024-06-05T21:41:47+00:00,sports
Sloan Piva,"Who will win NBA Finals MVP? Odds, prediction, betting advice for championship series most valuable player","The Sporting News betting team dives into the 2024 NBA Finals MVP odds, making its official prediction and weighing out the betting value for each key Celtics or Mavericks player.",https://www.sportingnews.com/us/nba/news/nba-finals-mvp-odds-prediction-betting-advice-championship/1623802695ab607a6dc07229,Sporting News,https://library.sportingnews.com/styles/crop_style_16_9_desktop/s3/2024-06/GettyImages-1246023949%20%281%29.jpg?h=d6797f0b&amp;itok=r2hEYDMT,sports,en,us,2024-06-05T21:30:51+00:00,sports
,How I breached Wembley's £5m 'ring of steel' to get into the Champions League final WITHOUT a ticket: Mail Sport's shocking expose reveals just how easy it is - and raises serious security questions,"AADAM PATEL AT WEMBLEY: A scroll through Live Football Tickets in the hours before kick-off showed a going rate of around £4,000 and these were for upper-tier seats",https://www.dailymail.co.uk/sport/football/article-13497689/Wembleys-5m-ring-steel-Champions-League-final-WITHOUT-ticket.html?ns_mchannel=rss&ito=1490&ns_campaign=1490,dailymail,https://i.dailymail.co.uk/1s/2024/06/05/17/85755509-0-image-a-22_1717604629550.jpg,general,en,uk,2024-06-05T21:25:00+00:00,sports
NY Post Video,Key Rangers battled serious injuries during deep playoff run | The Injury Report,"Natasha Desai, MD, from the Center for Women’s Sports Medicine at NYU Langone Orthopedics joins New York Post Sports anchor Brandon London to explain how Rangers defenseman and captain Jacob Trouba and his fellow Blueshirts defenseman Ryan Lindgren played through serious injuries in New York&#8217;s Stanley Cup playoff run that ended in the Eastern Conference...",https://nypost.com/video/key-rangers-battled-serious-injuries-during-deep-playoff-run-the-injury-report/,Post,https://nypost.com/wp-content%2Fuploads%2Fsites%2F2%2F2024%2F06%2F060524INJURYREPORTNYP.jpg?quality%3D90%26strip%3Dall,general,en,zm,2024-06-05T21:20:30+00:00,sports
Brandon Lee Gowton,"Eagles Practice Notes: Cornerback competition continues, Will Shipley steps up",Bill Streicher-USA TODAY Sports Observations from Wednesday’s session. The Philadelphia Eagles held the second of three mandatory minicamp practices on Wednesday afternoon and I was at the NovaCare Complex to watch the action unfold. Here’s what I saw!INJURY UPDATES: James Bradberry watched practice from the sidelines after apparently getting banged up just minutes into Tuesday’s session. New injury: Trevor Keegan did not practice. Still not practicing: Sydney Brown and Jacob Harris. John Ross got stretched out by a trainer on the sideline after making a catch late in practice. DEPTH...,https://www.bleedinggreennation.com/2024/6/5/24172362/eagles-practice-notes-cornerback-competition-continues-will-shipley-steps-up-philadelphia-dejean,bleedinggreennation,,general,en,us,2024-06-05T21:18:02+00:00,sports
Tico Times,Keylor Navas Accused of Undeclared Employee Scandal as Former Assistant Speaks Out,"International sports media have reported that the Costa Rican goalkeeper Keylor Navas, has been denounced by a former employee on allegations of “undeclared labor.” The complaint was lodged with the Versailles prosecutor&#8217;s office, bringing forth serious accusations against the former Paris Saint-Germain (PSG) star. The EU defines undeclared labor as &#8220;any paid activities that are [&#8230;]The post Keylor Navas Accused of Undeclared Employee Scandal as Former Assistant Speaks Out appeared first on The Tico Times | Costa Rica News | Travel | Real Estate.",https://ticotimes.net/2024/06/05/keylor-navas-accused-of-undeclared-employee-scandal-as-former-assistant-speaks-out,ticotimes,,general,en,us,2024-06-05T21:16:18+00:00,sports
Darryn Albert,Kendrick Perkins had embarrassingly bad batting practice session at Fenway Park,"Kendrick Perkins clearly chose the right sport to play. The retired former Boston Celtics center Perkins, now an analyst for ESPN, is back in the area this week to cover the NBA Finals between the Celtics and the Dallas Mavericks. On Tuesday, Perkins decided to pay a visit to Fenway Park. Ahead of a Boston...The post Kendrick Perkins had embarrassingly bad batting practice session at Fenway Park appeared first on Larry Brown Sports.",https://larrybrownsports.com/baseball/kendrick-perkins-bad-batting-practice-video/634129,larrybrownsports,,general,en,us,2024-06-05T21:13:57+00:00,sports
Adam Mills,NBA 2K25 Release Date & Features: 9 Things to Know,"Here’s what you need to know right now about NBA 2K25 based on traditions, rumors, confirmed information, and what we expect. NBA 2K24 is still the flagship game, but that will change later this year when 2K Sports releases a new entry in the long-running series. We don’t have much in the way of official [&#8230;]NBA 2K25 Release Date & Features: 9 Things to Know is a post by Adam Mills from Gotta Be Mobile.",https://www.gottabemobile.com/nba-2k25-release-date-features-details/,gottabemobile,,general,en,us,2024-06-05T21:13:22+00:00,sports
Grey Papke,Joe Mazzulla has extremely confident take on NBA Finals pressure,Boston Celtics coach Joe Mazzulla certainly does not seem concerned about whether his team is ready for the added pressure of the NBA Finals. Mazzulla on Wednesday was asked how he would go about making sure the Celtics stick to fundamentals and do what they need to do on the bigger stage and under the...The post Joe Mazzulla has extremely confident take on NBA Finals pressure appeared first on Larry Brown Sports.,https://larrybrownsports.com/basketball/joe-mazzulla-nba-finals-pressure-quote/634130,larrybrownsports,,general,en,us,2024-06-05T21:09:00+00:00,sports
Saivion Mixson,Sporting News' worst off-season move for the Atlanta Falcons is no surprise,Sporting News' worst off-season move for the Atlanta Falcons is no surprise,https://www.sportingnews.com/us/nfl/atlanta-falcons/news/sporting-news-worst-season-move-atlanta-falcons-no-surprise/6c8f85cc566454f8cf9b7f74,Sporting News,https://ng-sportingnews.com/s3/files/styles/crop_style_16_9_desktop/s3/2024-06/GettyImages-2152983501.jpg?h=681ef276&amp;itok=6QMQlo07,sports,en,us,2024-06-05T20:43:26+00:00,sports
Allan Rose Hill,Man's incredible cough broke his body's strongest bone,"The thigh bone, or femur, is recognized as the longest, heaviest, and strongest bone in the human body. Usually, it takes a horrific car accident, sports injury, or brutal fall to break that bone. Recently though, a 35-year-old man fractured it with the force of his cough. &#8212; Read the rest The post Man&#039;s incredible cough broke his body&#039;s strongest bone appeared first on Boing Boing.",https://boingboing.net/2024/06/05/mans-incredible-cough-broke-the-bodys-strongest-bone.html,boingboing,,general,en,us,2024-06-05T20:18:38+00:00,sports
