author,title,description,url,source,image,category,language,country,published_at,topic
Jin Hui,Proposed cuts to impact patients: VHA,Monash Health could be forced to make proposed cuts of up to $200 million as part of budget savings imposed...The post Proposed cuts to impact patients: VHA appeared first on Dandenong Star Journal.,https://dandenong.starcommunity.com.au/news/2024-07-01/proposed-cuts-to-impact-patients-vha/,greaterdandenongweekly,,general,en,au,2024-06-30T23:22:52+00:00,health
Ryan McDougall,Nicola Benedetti warns of 'major identity shift' due to culture funding crisis,She said that arts and culture were key to the “wellbeing and health of the nation”.,https://www.scotsman.com/arts-and-culture/edinburgh-festivals/nicola-benedetti-warns-of-major-identity-shift-due-to-culture-funding-crisis-4684877,scotsman,https://www.scotsman.com/webimg/b25lY21zOmMwYmI3MzAzLWJjZDEtNDYwZi1hYTkwLTJjNTU5MzM3NTQxMTpiYTgxMGQyOS05NWMxLTQ3NGUtYmNhNi01YjczN2IyODUzZDk=.jpg?width=1200&auto=webp,general,en,us,2024-06-30T23:01:00+00:00,health
Jenifer Laeng,Miri’s breastfeeding support group welcomes new ambassador,"MIRI (July 1): Miri Health officer Dr P Raviwharmman Packierisamy has called upon the breastfeeding support group here to change the conventional method of relaying information on promoting breastfeeding culture to one that is more relevant and proactive. According to him, today&#8217;s mothers and especially the new ones, are very much different from those in [...]",https://www.theborneopost.com/2024/07/01/miris-breastfeeding-support-group-welcomes-new-ambassador/,theborneopost,https://www.theborneopost.com/newsimages/2024/07/Lead-05-myy-300624-jls-breastfeeding-p1.jpg,general,en,us,2024-06-30T23:00:28+00:00,health
Santa Cruz Sentinel,Guest Commentary | Insurance industry middlemen impede care access for underserved local communities,"""As a physician serving low-income and underserved communities like those in Watsonville and Salinas, I understand the unique health challenges they face,"" writes Donaldo M. Hernandez in a Guest Commentary. ""Many of my patients are farmworkers from Mexico, with a significant portion being indigenous people who speak Spanish as their second language.""",https://www.santacruzsentinel.com/2024/06/30/guest-commentary-insurance-industry-middlemen-impede-care-access-for-underserved-local-communities/,santacruzsentinel,,general,en,us,2024-06-30T22:32:08+00:00,health
Journal Online,6 Reasons Why CBD is the Ultimate Wellness Boost,"In recent years, CBD (cannabidiol) has gained significant attention for its potential health benefits. Derived from the hemp plant, CBD is a non-psychoactive compound that has been praised for its versatility in supporting overall wellness. As more people seek natural alternatives to enhance their health, CBD has become a popular choice for those looking to [&#8230;]",https://journal.com.ph/6-reasons-why-cbd-is-the-ultimate-wellness-boost/,journal,,general,en,ph,2024-06-30T22:17:22+00:00,health
peter,Health professionals crack down on beauty salons,"Raymond Jaravaza, raymondjaravaza@gmail.com THINKING of getting a vitamin drip or injectable treatment at your local salon? Think again, the short cuts that salons offer may prove to be a risky gamble with your health. The Health Professions Authority of Zimbabwe (HPA) has raised the red flag, cautioning that some beauty and wellness facilities could be [&#8230;]",https://www.chronicle.co.zw/health-professionals-crack-down-on-beauty-salons/,The Chronicle,,general,en,gh,2024-06-30T22:05:25+00:00,health
Sam Lemonick - Harpswell Anchor,Multiple efforts gather data about PFAS in Harpswell waters,"&#160; PFAS pollution is ubiquitous in the waters around Harpswell, as it is in most of the marine environment. Recent testing also has found it in seafood, but outside of certain areas, investigators have detected low levels. While the health effects of these long-lived chemicals are cause for concern, experts and local leaders seem confident [&#8230;]",https://www.pressherald.com/2024/06/30/multiple-efforts-gather-data-about-pfas-in-harpswell-waters/,timesrecord,https://w2pcms.com/wp-content/uploads/sites/10/2024/06/PFAS-overview-2-scaled-1.jpg,general,en,us,2024-06-30T21:39:50+00:00,health
,Israeli airstrike in northern West Bank kills Palestinian militant,"Israeli troops carried out an airstrike in the northern West Bank on Sunday, killing a Palestinian militant and wounding five other people, Palestinian health officials said.The strike…",https://japantoday.com/category/world/israeli-airstrike-in-the-northern-west-bank-kills-a-palestinian-militant-and-wounds-5-other-people,japantoday,,general,en,us,2024-06-30T21:38:02+00:00,health
,White House photographer blows whistle on Biden's cognitive health as he reveals aides knew for MONTHS he was not fit for office,"After Joe Biden's horrendous debate performance, current and former aides are saying the quiet part out loud and revealing what the President is like behind the scenes.",https://www.dailymail.co.uk/news/article-13585781/white-house-photographer-biden-cognitive-health-aides-revelation.html?ns_mchannel=rss&ito=1490&ns_campaign=1490,dailymail,https://i.dailymail.co.uk/1s/2024/06/30/21/86758969-0-image-m-2_1719779840631.jpg,general,en,uk,2024-06-30T21:29:07+00:00,health
,White House photographer blows whistle on Biden's cognitive health as he reveals aides knew for MONTHS he was not fit for office,"After Joe Biden's horrendous debate performance, current and former aides are saying the quiet part out loud and revealing what the President is like behind the scenes.",https://www.dailymail.co.uk/news/article-13585781/white-house-photographer-biden-cognitive-health-aides-revelation.html?ns_mchannel=rss&ns_campaign=1490&ito=1490,dailymail,https://i.dailymail.co.uk/1s/2024/06/30/21/86758969-0-image-m-2_1719779840631.jpg,general,en,uk,2024-06-30T21:29:07+00:00,health
Brian Rokos,Firecracker-hot forecast: Temperatures over 100 degrees this week in Southern California,The heat wave poses potential health and wildfire threats around the region.,https://www.ocregister.com/2024/06/30/firecracker-hot-forecast-temperatures-over-100-degrees-this-week-in-southern-california/,ocregister,https://www.ocregister.com/wp-content/uploads/2024/06/RPE-L-WEATHER-0701-01.jpg?w=1400px&strip=all,general,en,us,2024-06-30T21:20:16+00:00,health
Brian Rokos,Firecracker-hot forecast: Temperatures over 100 degrees this week in Southern California,The heat wave poses potential health and wildfire threats around the region.,https://www.pasadenastarnews.com/2024/06/30/firecracker-hot-forecast-temperatures-over-100-degrees-this-week-in-southern-california/,pasadenastarnews,https://www.pasadenastarnews.com/wp-content/uploads/2024/06/RPE-L-WEATHER-0701-01.jpg?w=1400px&strip=all,general,en,us,2024-06-30T21:20:16+00:00,health
Brian Rokos,Firecracker-hot forecast: Temperatures over 100 degrees this week in Southern California,The heat wave poses potential health and wildfire threats around the region.,https://www.dailybreeze.com/2024/06/30/firecracker-hot-forecast-temperatures-over-100-degrees-this-week-in-southern-california/,dailybreeze,https://www.dailybreeze.com/wp-content/uploads/2024/06/RPE-L-WEATHER-0701-01.jpg?w=1400px&strip=all,general,en,us,2024-06-30T21:20:16+00:00,health
Brian Rokos,Firecracker-hot forecast: Temperatures over 100 degrees this week in Southern California,The heat wave poses potential health and wildfire threats around the region.,https://www.sbsun.com/2024/06/30/firecracker-hot-forecast-temperatures-over-100-degrees-this-week-in-southern-california/,sbsun,https://www.sbsun.com/wp-content/uploads/2024/06/RPE-L-WEATHER-0701-01.jpg?w=1400px&strip=all,general,en,us,2024-06-30T21:20:16+00:00,health
Brian Rokos,Firecracker-hot forecast: Temperatures over 100 degrees this week in Southern California,The heat wave poses potential health and wildfire threats around the region.,https://www.dailybulletin.com/2024/06/30/firecracker-hot-forecast-temperatures-over-100-degrees-this-week-in-southern-california/,dailybulletin,https://www.dailybulletin.com/wp-content/uploads/2024/06/RPE-L-WEATHER-0701-01.jpg?w=1400px&strip=all,general,en,us,2024-06-30T21:20:16+00:00,health
Brian Rokos,Firecracker-hot forecast: Temperatures over 100 degrees this week in Southern California,The heat wave poses potential health and wildfire threats around the region.,https://www.sgvtribune.com/2024/06/30/firecracker-hot-forecast-temperatures-over-100-degrees-this-week-in-southern-california/,sgvtribune,https://www.sgvtribune.com/wp-content/uploads/2024/06/RPE-L-WEATHER-0701-01.jpg?w=1400px&strip=all,general,en,us,2024-06-30T21:20:16+00:00,health
Brian Rokos,Firecracker-hot forecast: Temperatures over 100 degrees this week in Southern California,The heat wave poses potential health and wildfire threats around the region.,https://www.redlandsdailyfacts.com/2024/06/30/firecracker-hot-forecast-temperatures-over-100-degrees-this-week-in-southern-california/,redlandsdailyfacts,https://www.redlandsdailyfacts.com/wp-content/uploads/2024/06/RPE-L-WEATHER-0701-01.jpg?w=1400px&strip=all,general,en,us,2024-06-30T21:20:16+00:00,health
Brian Rokos,Firecracker-hot forecast: Temperatures over 100 degrees this week in Southern California,The heat wave poses potential health and wildfire threats around the region.,https://www.presstelegram.com/2024/06/30/firecracker-hot-forecast-temperatures-over-100-degrees-this-week-in-southern-california/,presstelegram,https://www.presstelegram.com/wp-content/uploads/2024/06/RPE-L-WEATHER-0701-01.jpg?w=1400px&strip=all,general,en,us,2024-06-30T21:20:16+00:00,health
Brian Rokos,Firecracker-hot forecast: Temperatures over 100 degrees this week in Southern California,The heat wave poses potential health and wildfire threats around the region.,https://www.dailynews.com/2024/06/30/firecracker-hot-forecast-temperatures-over-100-degrees-this-week-in-southern-california/,dailynews,https://www.dailynews.com/wp-content/uploads/2024/06/RPE-L-WEATHER-0701-01.jpg?w=1400px&strip=all,general,en,us,2024-06-30T21:20:16+00:00,health
Brian Rokos,Firecracker-hot forecast: Temperatures over 100 degrees this week in Southern California,The heat wave poses potential health and wildfire threats around the region.,https://www.whittierdailynews.com/2024/06/30/firecracker-hot-forecast-temperatures-over-100-degrees-this-week-in-southern-california/,whittierdailynews,https://www.whittierdailynews.com/wp-content/uploads/2024/06/RPE-L-WEATHER-0701-01.jpg?w=1400px&strip=all,general,en,us,2024-06-30T21:20:16+00:00,health
Associated Press,"Israeli airstrike in West Bank kills Palestinian militant, injures 5 other people","NUR SHAMS REFUGEE CAMP, West Bank &#8212; Israeli troops carried out an airstrike in the northern West Bank on Sunday, killing a Palestinian militant and wounding five other people, Palestinian health officials said. The strike took place in Nur Shams, an urban refugee camp that has been a frequent target of the Israeli military and [&#8230;]",https://torontosun.com/news/world/israeli-airstrike-in-west-bank-kills-palestinian-militant-injures-5-other-people,torontosun,,general,en,us,2024-06-30T20:38:45+00:00,health
DC Correspondent,"Health Is Individual Responsibility, Says Dr. Mannam at Ortho360 Walkathon","Health Is Individual Responsibility, Says Dr. Mannam at Ortho360 Walkathon",https://www.deccanchronicle.com/news/health-is-individual-responsibility-says-dr-mannam-at-ortho360-walkathon-1308882,deccanchronicle,https://www.deccanchronicle.com/h-upload/2024/06/30/1100747-img-20240630-wa0028.webp,general,en,us,2024-06-30T20:18:33+00:00,health
Breanna Reeves,U.S. Supreme Court Allows Idaho Hospitals to Provide Emergency Abortions — For Now,"The U.S. Supreme Court ruled on June 27 that Idaho hospitals are allowed to provide emergency abortions when a patient's health is at risk, but did not directly address the issue of the state's restrictive abortion ban and federal law.The post U.S. Supreme Court Allows Idaho Hospitals to Provide Emergency Abortions — For Now appeared first on Black Voice News.",https://blackvoicenews.com/2024/06/30/supreme-court-allows-emergency-abortions/,blackvoicenews,,general,en,us,2024-06-30T19:40:45+00:00,health
Simone Pinto,"Battling Depression, Lindsey Vonn Opened Up About Fears of Sharing Mental Health Struggles with Fans: ‘It Became Too Much’","Over a span of 19 years, Lindsey Vonn established herself as a force to reckon with. The 4-time Olympian has garnered 3 Olympics medals and 82 world cup wins, a women&#8217;s record that stood strong up until 2023. Her illustrious journey has been nothing short of a slippery slope. She officially stepped away from the [&#8230;]The post Battling Depression, Lindsey Vonn Opened Up About Fears of Sharing Mental Health Struggles with Fans: &#8216;It Became Too Much&#8217; appeared first on EssentiallySports.",https://www.essentiallysports.com/us-sports-news-olympics-news-alpine-skiing-news-battling-depression-lindsey-vonn-opened-up-about-fears-of-sharing-mental-health-struggles-with-fans-it-became-too-much/,Essentially Sports,https://image-cdn.essentiallysports.com/wp-content/uploads/Lindsey-Vonn-Source_-Instagram-1-352x315.jpg,sports,en,us,2024-06-30T19:00:56+00:00,health
Matt Caputo,"Podcast renews interest in nearly 50-year cold case of teen Judith Brown, who disappeared with her fugitive fiancé","The mysterious case of Judith Brown was recently resurrected by ""The Vanished Podcast,"" drawing new attention to the little-known story of the city teen who vanished in 1977 with her murderous fiancé Richard Riesenberg — all while battling mental health issues. ",https://nypost.com/2024/06/30/us-news/podcast-renews-interest-in-cold-case-disappearance-of-judith-brown/,Post,https://nypost.com/wp-content%2Fuploads%2Fsites%2F2%2F2024%2F06%2Fnewspress-collage-qv10mkuxq-1719771422690.jpg?quality%3D90%26strip%3Dall%261719757058,general,en,zm,2024-06-30T18:24:36+00:00,health
TooFab Staff,Woman Charged with Murder of Adopted Children Not Seen for Years After Another Calls Police,"A woman has been arrested and charged with the murders of two of her adopted children not seen for years. Authorities in Fayetteville, North Carolina became aware of the situation after one of Avantae Deven's surviving foster children made a mental health call to police. According to local ABC affiliate WTVD, officers responded to the call of a child who told them he hadn't seen his brother Blake in years. Blake had last been seen in 2022, when he was approximately 15 years old. When officers questioned Deven, she initially said that Blake ""was possibly at a Buddhist retreat in the mountains...",https://www.toofab.com/2024/06/30/woman-charged-murder-adopted-children-not-seen-for-years-another-calls-police/,toofab,https://images.toofab.com/image/92/o/2024/06/30/927fe086588745aa90b8e9fc60db40e0_md.jpg,general,en,us,2024-06-30T18:21:57+00:00,health
AP News,Israeli airstrike in the northern West Bank kills a Palestinian militant and wounds 5 other people,"Palestinian health officials say Israeli troops have carried out an airstrike in the northern West Bank, killing a Palestinian militant and wounding five other people. The strike took place in Nur Shams, an urban refugee camp that has been a frequent target of the Israeli military. It is known as a stronghold of Palestinian militants. The state-run Palestinian news agency Wafa says an Israeli drone fired three missiles and struck a house. Islamic Jihad identified the dead man as one of its local commanders. The occupied West Bank has experienced a surge in violence since the war in Gaza erupted...",https://www.mymotherlode.com/news/middle-east/3384112/israeli-airstrike-in-the-northern-west-bank-kills-a-palestinian-militant-and-wounds-5-other-people.html,mymotherlode,,general,en,us,2024-06-30T18:09:00+00:00,health
Associated Press,Israeli airstrike in the northern West Bank kills a Palestinian militant and wounds 5 other people,"Associated Press NUR SHAMS REFUGEE CAMP, West Bank (AP) — Palestinian health officials say Israeli troops have carried out an airstrike in the northern West Bank, killing a Palestinian militant and wounding five other people. The strike took place in Nur Shams, an urban refugee camp that has been a frequent target of the Israeli",https://localnews8.com/news/2024/06/30/israeli-airstrike-in-the-northern-west-bank-kills-a-palestinian-militant-and-wounds-5-other-people/,localnews8,,general,en,us,2024-06-30T17:23:13+00:00,health
Associated Press,Israeli airstrike in the northern West Bank kills a Palestinian militant and wounds 5 other people,"Associated Press NUR SHAMS REFUGEE CAMP, West Bank (AP) — Palestinian health officials say Israeli troops have carried out an airstrike in the northern West Bank, killing a Palestinian militant and wounding five other people. The strike took place in Nur Shams, an urban refugee camp that has been a frequent target of the IsraeliThe post Israeli airstrike in the northern West Bank kills a Palestinian militant and wounds 5 other people appeared first on KVIA.",https://kvia.com/news/2024/06/30/israeli-airstrike-in-the-northern-west-bank-kills-a-palestinian-militant-and-wounds-5-other-people/,kvia,,general,en,us,2024-06-30T17:23:13+00:00,health
Chintan Devgania,75-YO NHRA Champ’s First Words After Surviving Near Fatal Crash Sends NASCAR Community in Meltdown,"NHRA drag racing legend, John Force, survived a life-threatening crash a week ago at Virginia Nationals. However, despite making it out of his wrecked car after the brutal crash, there was no update regarding his health or recovery. Fortunately, for the first time since the crash, the 75-year-old has shown signs of improvement. A statement [&#8230;]The post 75-YO NHRA Champ’s First Words After Surviving Near Fatal Crash Sends NASCAR Community in Meltdown appeared first on EssentiallySports.",https://www.essentiallysports.com/nascar-news-seventy-five-yo-nhra-champs-first-words-after-surviving-near-fatal-crash-sends-nascar-community-in-meltdown-john-force/,Essentially Sports,https://image-cdn.essentiallysports.com/wp-content/uploads/nhra-560x315.jpg,sports,en,us,2024-06-30T17:11:02+00:00,health
Paul Schuhmacher,Four Strategies Medicare Advantage Plans Can Implement to Mitigate Financial Pressures,"Health plans must take a consistent, thoughtful approach to sustaining their business by managing costs without compromising member access to quality healthcare.The post Four Strategies Medicare Advantage Plans Can Implement to Mitigate Financial Pressures appeared first on MedCity News.",https://medcitynews.com/2024/06/four-strategies-medicare-advantage-plans-can-implement-to-mitigate-financial-pressures/,medcitynews,,general,en,us,2024-06-30T17:09:00+00:00,health
Shreya Nag,Randy Orton Delivers Uplifting Mental Health Talk to Fan Amid Heel Turn Tease,"Mental health issues have been a salient point of talk in the WWE Universe for ages. A strenuous schedule, continuous cosplaying, and competitive pressure often land the wrestlers on opposite sides of all the glamor and fame that the industry has to offer. From Dwayne &#8216;The Rock&#8217; Johnson to Brock Lesnar, many veterans in the [&#8230;]The post Randy Orton Delivers Uplifting Mental Health Talk to Fan Amid Heel Turn Tease appeared first on EssentiallySports.",https://www.essentiallysports.com/wwe-news-randy-orton-delivers-uplifting-mental-health-talk-to-fan-amid-heel-turn-tease/,Essentially Sports,https://image-cdn.essentiallysports.com/wp-content/uploads/Randy-orton-8-487x315.jpg,sports,en,us,2024-06-30T16:15:59+00:00,health
Stephanie Mencimer,Polls Show Nearly Half of Democrats Believe Biden Should Drop Out,"Over the past year, voters have consistently said that they believe 81-year-old President Joe Biden is too old to serve as president. When CBS News asked registered voters in early June whether they thought Biden had the mental and cognitive health necessary to serve as president, 65 percent of them said no. And that was [&#8230;]",https://www.motherjones.com/politics/2024/06/polls-show-nearly-half-of-democrats-believe-biden-should-drop-out/,motherjones,,general,en,us,2024-06-30T15:35:05+00:00,health
Zack Power,Looking for a family doctor in N.S.? You may need to ‘stretch’: Health Minister,"Health and Wellness Minister Michelle Thompson told reporters that recent population growth, coupled with retirements, have caused a long wait list for a family doctor.",https://globalnews.ca/news/10596389/doctor-shortage-stretch-ns/,globalwinnipeg,https://globalnews.ca/wp-content/uploads/2024/06/ZP-WEB-IMAGE-62924-B.jpg?quality=85&strip=all&w=720&h=480&crop=1,general,en,us,2024-06-30T15:26:41+00:00,health
AP News,Mask-wearing shot put standout Raven Saunders earns spot to Paris Olympics with 2nd place finish,"Raven Saunders is the shot put standout who wears a mask at competitions and identifies with the pronouns they and them. They're chasing an Olympic gold medal at the Paris Games after earning silver in Tokyo. Saunders took a step toward that goal by finishing second at the U.S. Olympic track and field trials to earn a place on the team.  To be here, Saunders has overcome mental-health hurdles, dealing with the death of her mom and being suspended. Two-time world champion Chase Jackson won the competition with a throw of 20.10 meters.",https://www.mymotherlode.com/sports/olympics/3384057/mask-wearing-shot-put-standout-raven-saunders-earns-spot-to-paris-olympics-with-2nd-place-finish.html,mymotherlode,,general,en,us,2024-06-30T15:07:44+00:00,health
Jason Goselin,KNOW THE WARRIOR: FROM DOWN UNDER TO ON TOP,"Team Australia athlete Lt. Kirby Watts celebrates during a medal ceremony for the 2024 Department of Defense Warrior Games swimming event at the Orlando Health National Training Center in Clermont, Florida, June 29, 2024. This event is one of many adaptive sports that comprises the DoD Warrior Games. The Warrior Games are designed to enhance the recovery journeys of wounded, ill, injured service members and veterans outside of traditional therapy settings, bringing the community together for recovery in real time. The 10-day event is composed of more than 200 wounded, ill and injured service...",https://www.dvidshub.net/image/8507491/know-warrior-down-under-top,dvidshub,https://d1ldvf68ux039x.cloudfront.net/thumbs/photos/2406/8507491/250w_q95.jpg,general,en,us,2024-06-30T15:07:33+00:00,health
Chronicle Editor,Scores benefit from Nkulumane health and feeding expo,"Trish Mukwazo, Trishmukwazo515@gmail.com SCORES of people received free health consultation, medication and grocery hampers during the health and feeding expo that was held at Mncumbatha Primary School in Bulawayo’s Nkulumane suburb on Saturday. The programme was organised by Van-Beek Foundation in partnership with Ward 20 councillor, Cde Sandra Ndebele, and Pusheka Girl. The organizers also [&#8230;]",https://www.chronicle.co.zw/scores-benefit-from-nkulumane-health-and-feeding-expo/,The Chronicle,,general,en,gh,2024-06-30T14:59:04+00:00,health
Joel Harley,X Factor winner confirms she overcame crippling health condition and has now changed career,She's moving on to pastures new.,https://metro.co.uk/2024/06/30/x-factor-winner-confirms-overcame-crippling-health-condition-21131950/,Metro,,general,en,gb,2024-06-30T14:27:51+00:00,health
NyasaAuthor1,Include ‘Blessers’ in Fight Against Teen Pregnancies – MP,"Member of Parliament for Nsanje South West Eurita Valeta has called for the involvement of &#8220;blessers&#8221; in the fight against teenage pregnancies.  Valeta, who is also Deputy Chairperson of the Parliamentary Committee on Health, made the call at a panel discussion on sexual and reproductive health for youth which was organised by Centre for Solutions [&#8230;]The post Include ‘Blessers’ in Fight Against Teen Pregnancies – MP appeared first on Malawi Nyasa Times - News from Malawi about Malawi.",https://www.nyasatimes.com/include-blessers-in-fight-against-teen-pregnancies-mp/,Nyasa Times,,general,en,mw,2024-06-30T13:43:28+00:00,health
ABMN Staff,Vicus Capital Boosts Stock Holdings in Fidelity MSCI Health Care Index ETF (NYSEARCA:FHLC),"Vicus Capital grew its position in shares of Fidelity MSCI Health Care Index ETF (NYSEARCA:FHLC &#8211; Free Report) by 4.8% during the first quarter, according to its most recent filing with the Securities and Exchange Commission (SEC). The fund owned 149,758 shares of the company&#8217;s stock after acquiring an additional 6,921 shares during the quarter. [&#8230;]",https://www.americanbankingnews.com/2024/06/30/vicus-capital-boosts-stock-holdings-in-fidelity-msci-health-care-index-etf-nysearcafhlc.html,americanbankingnews,,general,en,us,2024-06-30T13:34:50+00:00,health
MarketBeat News,Vicus Capital Boosts Stock Holdings in Fidelity MSCI Health Care Index ETF (NYSEARCA:FHLC),"Vicus Capital grew its position in shares of Fidelity MSCI Health Care Index ETF (NYSEARCA:FHLC &#8211; Free Report) by 4.8% during the first quarter, according to its most recent filing with the Securities and Exchange Commission (SEC). The fund owned 149,758 shares of the company&#8217;s stock after acquiring an additional 6,921 shares during the quarter. [&#8230;]",https://www.etfdailynews.com/2024/06/30/vicus-capital-boosts-stock-holdings-in-fidelity-msci-health-care-index-etf-nysearcafhlc/,etfdailynews,,general,en,us,2024-06-30T13:34:48+00:00,health
