author,title,description,url,source,image,category,language,country,published_at,topic
Bill DiFilippo,Kendrick Perkins Called For Men In Sports Media Like Stephen A. Smith And Pat McAfee To Be ‘Responsible To Do Their Homework’ With WNBA Coverage,"ESPN Kendrick Perkins discussed the uptick in men who discuss the WNBA with Caitlin Clark in the league, and called on Pat McAfee to apologize.",https://uproxx.com/dimemag/kendrick-perkins-men-sports-media-responsible-talking-wnba-caitlin-clark-video/,hitfix,,general,en,us,2024-06-04T02:39:25+00:00,sports
Rick Telander,Bears appear ready to join the NFL's modern age with Caleb Williams,"Sometimes there’s a single statistic that defines a sports franchise.For the Bears, it’s this: They haven’t had a 4,000-yard passer in a season in their 104-year history.Let that sink in while pondering a key addendum: Every other NFL team has had at least one 4,000-yard passer.Thirty-one against one. That’s your Bears.And it’s not like most of the other clubs sneaked in. The Dolphins have had nine 4,000-yard passing seasons. The Patriots have had 13. The Colts, 16. And some did it long ago. The Jets’ Joe Namath passed for more than 4,000 yards in 1967.A bunch of quarterbacks even...",https://chicago.suntimes.com/bears/2024/06/03/bears-caleb-williams-quarterback-modern-nfl,suntimes,,general,en,us,2024-06-04T02:33:26+00:00,sports
Ansh Athani,"Fatal 4-way between Jaiswal, Rohit, Kohli & Samson for opener slots in IND vs IRE match","In the warm-up match against Bangladesh on June 1, Rohit Sharma and Sanju Samson opened the batting, while Virat Kohli and Yashasvi Jaiswal didn't play.The post Fatal 4-way between Jaiswal, Rohit, Kohli & Samson for opener slots in IND vs IRE match appeared first on Inside Sport India.",https://www.insidesport.in/cricket/t20-world-cup-yashasvi-jaiswal-rohit-sharma-virat-kohli-or-sanju-samson-who-will-be-india-openers-in-ind-vs-ire/,Insidesport,,sports,en,us,2024-06-04T02:30:00+00:00,sports
Darryn Albert,Paul O’Neill brutally butchered Elly De La Cruz’s name during broadcast,"Paul O&#8217;Neill struck out 1,166 times in his MLB career, and he added another one from the broadcast booth this week. The retired former All-Star O&#8217;Neill, who is now a television broadcaster for the New York Yankees on YES Network, was on the call for Sunday&#8217;s game between the Yankees and the San Francisco Giants....The post Paul O&#8217;Neill brutally butchered Elly De La Cruz&#8217;s name during broadcast appeared first on Larry Brown Sports.",https://larrybrownsports.com/baseball/paul-oneill-butchered-elly-de-la-cruz-name/634049,larrybrownsports,,general,en,us,2024-06-04T02:15:12+00:00,sports
Madhav Agarwal,IND unhappy with mediocre T20 World Cup arrangements? Rahul Dravid says practicing in ‘public park’,T20 World Cup: This not the first time that Team India has raised concerns about facilities provided to the team.The post IND unhappy with mediocre T20 World Cup arrangements? Rahul Dravid says practicing in &#8216;public park&#8217; appeared first on Inside Sport India.,https://www.insidesport.in/cricket/ind-unhappy-with-mediocre-t20-world-cup-arrangements-rahul-dravid-says-practicing-in-public-park/,Insidesport,,sports,en,us,2024-06-04T02:14:06+00:00,sports
Rob Namnoum,Coronado pitcher Trey Gregory-Alford named Colorado Gatorade Player of the year,"Trey Gregory-Alford, a senior at Coronado, has been named Colorado's Gatorade Player of the Year, it was announced on Monday. Gregory-Alford is the first Gatorade Colorado Baseball Player of the Year to be chosen from Coronado High School, the third honoree from Coronado in any sport, and the school's first since 2008-09. The award, whichThe post Coronado pitcher Trey Gregory-Alford named Colorado Gatorade Player of the year appeared first on KRDO.",https://krdo.com/news/colorado-springs/2024/06/03/colorado-gatorade-player-of-the-year-trey-gregory-alford-coronado-high-school/,krdo,,general,en,us,2024-06-04T02:13:12+00:00,sports
Renzo Pocholo Salao,Former NBA draft bust explains why he cried during viral interview,"Jabari Parker fought back tears during a recent interview while playing overseas. On Monday, the former NBA No. 2 overall pick explained his emotional reaction. Parker&#8217;s FC Barcelona squad on Sunday got swept 3-0 by their Spanish league rivals Real Madrid in the Liga ACB semifinal. Parker was interviewed by Jijantes reporter Marc Mundet after...The post Former NBA draft bust explains why he cried during viral interview appeared first on Larry Brown Sports.",https://larrybrownsports.com/basketball/jabari-parker-crying-interview-fc-barcelona/634048,larrybrownsports,,general,en,us,2024-06-04T02:08:53+00:00,sports
Souvik Mukherjee,"Hasaranga, Theekshana slam ICC for ‘unfair’ scheduling after Sri Lanka’s dismal loss to South Africa","Only two of the twenty participating teams—Sri Lanka and the Netherlands—will play their first-round matches at four different locations. The post Hasaranga, Theekshana slam ICC for &#8216;unfair&#8217; scheduling after Sri Lanka&#8217;s dismal loss to South Africa appeared first on Inside Sport India.",https://www.insidesport.in/cricket/hasaranga-theekshana-slam-icc-for-unfair-scheduling-after-dismal-loss-to-south-africa/,Insidesport,,sports,en,us,2024-06-04T01:51:15+00:00,sports
-,ID: Grand Prix appeal remains despite race change,"The allure of the Macau Grand Prix is still evident despite a change in racing categories, according to Macau’s sports bureau chief. “The international events organized by the Fédération Internationale de l’Automobile (FIA) hold significant authority,” said Pun Weng Kun, president of the Sports Bureau (ID), on the sidelines of an event yesterday. “For many [&#8230;]The post ID: Grand Prix appeal remains despite race change appeared first on MACAU DAILY TIMES 澳門每日時報.",https://macaudailytimes.com.mo/id-grand-prix-appeal-remains-despite-race-change.html,macaudailytimes,,general,en,mo,2024-06-04T01:02:11+00:00,sports
Madhav Agarwal,"IND vs IRE: Rahul Dravid unsure if Virat Kohli will open, plays down concerns over Nassau pitch","IND vs IRE: While the Indian management is still unsure if Virat Kohli will open, coach Rahul Dravid played down the concerns over Nassau County pitch.The post IND vs IRE: Rahul Dravid unsure if Virat Kohli will open, plays down concerns over Nassau pitch appeared first on Inside Sport India.",https://www.insidesport.in/cricket/ind-vs-ire-rahul-dravid-unsure-if-virat-kohli-will-open-plays-down-concerns-over-nassau-pitch/,Insidesport,,sports,en,us,2024-06-04T00:56:14+00:00,sports
Renzo Pocholo Salao,Rhys Hoskins gets awesome reception in return to Philadelphia,"Former Philadelphia Phillies slugger Rhys Hoskins clearly still has a ton of support from the Philly faithful. On Monday, the Milwaukee Brewers first baseman returned to Citizens Bank Park in Philadelphia, Pa. for the opener of a three-game series against his former team. Phillies fans instantly started cheering once they heard Hoskins&#8217; familiar walk-up song,...The post Rhys Hoskins gets awesome reception in return to Philadelphia appeared first on Larry Brown Sports.",https://larrybrownsports.com/baseball/rhys-hoskins-return-phillies-fans/634044,larrybrownsports,,general,en,us,2024-06-04T00:49:08+00:00,sports
-,Construction of secondary school in Hengqin in full swing,"The construction of the secondary school at the Macau New Neighbourhood (MNN) in Hengqin, is in full swing as of 27 May, the Macau Urban Renewal Limited announced in a press statement. The secondary school will feature an outdoor sports field, sports hall, canteen, multi-purpose classrooms, car parking area for teaching staff, among others. Project [&#8230;]The post Construction of secondary school in Hengqin in full swing appeared first on MACAU DAILY TIMES 澳門每日時報.",https://macaudailytimes.com.mo/construction-of-secondary-school-in-hengqin-in-full-swing.html,macaudailytimes,,general,en,mo,2024-06-04T00:48:06+00:00,sports
Edward Sutelan,"Women's College World Series scores: Daily TV schedule, bracket, results for 2024 NCAA softball tournament",Sporting News will be tracking scores for each game during the College World Series. Follow for updates throughout the entire tournament.,https://www.sportingnews.com/us/college/news/womens-college-world-series-scores-tv-schedule-results-2024/5179f79adaa9433f3fddd133,Sporting News,https://library.sportingnews.com/styles/crop_style_16_9_desktop/s3/2024-05/Women%27s-CWS-FTR-%283%29.jpg?itok=ZOMHsrOO,sports,en,us,2024-06-04T00:47:00+00:00,sports
Souvik Mukherjee,"Rashid Latif picks Pakistan playing XI for T20 World Cup opener against USA, Azam Khan gets boot","Pakistan wicketkeeper-batter Azam Khan, who had a dismal outing in the 4th T20I against England, did not find himself in Rashid's Playing XI. The post Rashid Latif picks Pakistan playing XI for T20 World Cup opener against USA, Azam Khan gets boot appeared first on Inside Sport India.",https://www.insidesport.in/cricket/rashid-latif-picks-pakistan-playing-xi-for-t20-world-cup-opener-against-usa-azam-khan-gets-boot/,Insidesport,,sports,en,us,2024-06-04T00:45:42+00:00,sports
Rohan Bhaunt,Stephen A. Smith Breaks Silence With a 34 Minute Rant Against Monica McNutt in Caitlin Clark Row,"Being a sports debate show with various personalities trying to put forth their point, sometimes ESPN’s First Take can open a whole new can of worms discussing an unrelated topic. Something very similar happened recently when while discussing Chicago Sky star Chennedy Carter’s flagrant foul on WNBA rookie Caitlin Clark, Monica McNutt accused Stephen A. [&#8230;]The post Stephen A. Smith Breaks Silence With a 34 Minute Rant Against Monica McNutt in Caitlin Clark Row appeared first on EssentiallySports.",https://www.essentiallysports.com/nba-active-basketball-news-wnba-news-stephen-a-smith-breaks-silence-with-a-thirty-four-minute-rant-against-monica-mcnutt-in-caitlin-clark-row/,Essentially Sports,https://image-cdn.essentiallysports.com/wp-content/uploads/Untitled-design-18-11-560x315.jpg,sports,en,us,2024-06-04T00:43:51+00:00,sports
Darryn Albert,Mariners signing ex-Nationals World Series champion,"The Seattle Mariners are adding a player from the other coastline. Mariners reporter Ty Dane Gonzalez reported on Monday that the team is signing former Washington Nationals outfielder Victor Robles. Seattle had recently opened up a spot on their active roster by sending fellow outfielder Jonatan Clase down to Triple-A Tacoma. The righty-hitting Robles, 27,...The post Mariners signing ex-Nationals World Series champion appeared first on Larry Brown Sports.",https://larrybrownsports.com/baseball/mariners-sign-ex-nationals-champion-victor-robles/634046,larrybrownsports,,general,en,us,2024-06-04T00:37:00+00:00,sports
Souvik Mukherjee,Norway chess tournament: Another giant bites dust as Praggnanandhaa downs world champion Ding Liren,Praggnanandhaa has been the talk of the town lately after the chess prodigy downed Magnus Carlsen and Fabiano Caruana in consecutive days.The post Norway chess tournament: Another giant bites dust as Praggnanandhaa downs world champion Ding Liren appeared first on Inside Sport India.,https://www.insidesport.in/chess/norway-chess-tournament-another-chess-giant-bites-dust-as-praggnanandhaa-downs-world-champion-ding-liren/,Insidesport,,sports,en,us,2024-06-04T00:35:38+00:00,sports
Arthur Weinstein,‘Around the Horn’ remembers late T.J. Simers,"T.J. Simers, who died Sunday at age 73, is best known for his work as a longtime Los Angeles Times sports columnist, but he played a prominent role in ESPN history. Simers appeared on the network&#8217;s popular Around the Horn show&#8217;s very first episode in 2002 and held that position for a year. ATH host Read more...The post &#8216;Around the Horn&#8217; remembers late T.J. Simers appeared first on Awful Announcing.",https://awfulannouncing.com/espn/around-horn-tony-reali-tribute-tj-simers.html,awfulannouncing,,general,en,us,2024-06-04T00:30:14+00:00,sports
-,SJM brings city’s best to ‘Experience Macao’ roadshow in Korea,"SJM Resorts, S.A., recently participated in the “Experience Macao roadshow in Korea,” themed “My favorite Macao“. The roadshow spanned four days, showcasing Macau’s unique offerings to Korean travelers, and showcasing the range of dining experiences, accommodation, activities, and sporting events available in Macau. Spanning four days, this event kicked off with an industry event on [&#8230;]The post SJM brings city’s best to ‘Experience Macao’ roadshow in Korea appeared first on MACAU DAILY TIMES 澳門每日時報.",https://macaudailytimes.com.mo/sjm-brings-citys-best-to-experience-macao-roadshow-in-korea.html,macaudailytimes,,general,en,mo,2024-06-04T00:28:13+00:00,sports
Darryn Albert,Ja Morant clarifies his curious social media post,"Ja Morant is providing more context about his recent online post. The Memphis Grizzlies star Morant raised eyebrows on Sunday night with a difficult-to-believe post to his X page. The post from Morant read, &#8220;trigger&#8221; along with a blue-heart emoji. Morant gave no further context at the time. trigger &#8212; Ja Morant (@JaMorant) June 3,...The post Ja Morant clarifies his curious social media post appeared first on Larry Brown Sports.",https://larrybrownsports.com/basketball/ja-morant-clarifies-social-media-post/634043,larrybrownsports,,general,en,us,2024-06-04T00:10:02+00:00,sports
Marin Independent Journal,"Sports in Marin: Tuesday, Wednesday","Tuesday's local events: Baseball: Novato Knicks at Walnut Creek, 4 p.m., Danville; Marysville at San Rafael Pacifics, 6 p.m., Albert Park",https://www.marinij.com/2024/06/03/sports-in-marin-tuesday-wednesday-143/,marinij,,general,en,us,2024-06-04T00:04:38+00:00,sports
Souvik Mukherjee,Trevor Bayliss signs one-year contract extension with Sydney Thunder despite dismal BBL outing last season,"With a competitive 10-game home-and-away schedule this upcoming season, Bayliss will be under pressure to produce better results right away. The post Trevor Bayliss signs one-year contract extension with Sydney Thunder despite dismal BBL outing last season appeared first on Inside Sport India.",https://www.insidesport.in/cricket/trevor-bayliss-signs-one-year-contract-extension-with-sydney-thunder-despite-dismal-bbl-outing-last-season/,Insidesport,,sports,en,us,2024-06-04T00:02:30+00:00,sports
-,"Tuesday, June 4, 2024 – edition no. 4496","* Struggling with the storm — Heavy rains and flooding prompt calls to improve drainage infrastructure as schools close * Sports Bureau &#124; Grand Prix appeal ‘remains despite race change’ * Gaming &#124; LVS, Genting to invest over USD7 billion in Singapore * Female student allegedly victim of sexual assault; suspected attacker has history of [&#8230;]The post Tuesday, June 4, 2024 – edition no. 4496 appeared first on MACAU DAILY TIMES 澳門每日時報.",https://macaudailytimes.com.mo/tuesday-june-4-2024-edition-no-4496.html,macaudailytimes,,general,en,mo,2024-06-04T00:01:35+00:00,sports
Naman Jain,"DRS June 4: Rahul Dravid bids adieu, Virat Kohli is in T20 World Cup mode & did Rohit Sharma get body-shamed?","Welcome to our special segment DRS or the Daily Review System. In this, InsideSport will provide you with the top cricket stories from a day before that you might have missed in the hustle and bustle of your busy life.The post DRS June 4: Rahul Dravid bids adieu, Virat Kohli is in T20 World Cup mode & did Rohit Sharma get body-shamed? appeared first on Inside Sport India.",https://www.insidesport.in/cricket/drs-june-4-rahul-dravid-bids-adieu-virat-kohli-is-in-t20-world-cup-2024-mode-rohit-sharma-get-body-shamed/,Insidesport,,sports,en,us,2024-06-04T00:00:00+00:00,sports
Darryn Albert,NBA implements big change with draft,"The NBA is taking a page out of the NFL&#8217;s playbook. On Monday, the NBA announced that this year&#8217;s draft will be spread across two days. The first round is set to take place on Wednesday, June 26, and the second round will follow on Thursday, June 27. 2024 NBA Draft on ESPN and ABC...The post NBA implements big change with draft appeared first on Larry Brown Sports.",https://larrybrownsports.com/basketball/nba-big-change-draft-2024/634042,larrybrownsports,,general,en,us,2024-06-03T23:52:25+00:00,sports
Sam Neumann,Chris Mannix: ‘Genuine concern’ if Jake Paul-Mike Tyson fight will happen,"The much-anticipated Mike Tyson vs. Jake Paul fight, intended to launch Netflix&#8217;s foray into live sports, was postponed. Once dubbed &#8220;the most watched boxing event in decades&#8221; by Sports Illustrated&#8217;s Chris Mannix, the Tyson-Paul fight now hangs in the balance. Tyson&#8217;s recent medical issue, reportedly related to ulcers, has led to a postponement. And in Read more...The post Chris Mannix: ‘Genuine concern’ if Jake Paul-Mike Tyson fight will happen appeared first on Awful Announcing.",https://awfulannouncing.com/boxing/chris-mannix-jake-paul-mike-tyson-genuine-concern.html,awfulannouncing,,general,en,us,2024-06-03T23:30:48+00:00,sports
Grey Papke,Carmelo Anthony to become owner of overseas basketball team,"Carmelo Anthony hopes to one day become part of an NBA ownership group. Until then, he is getting involved with ownership overseas. The National Basketball League, which plays in Australia and New Zealand, announced Monday that Anthony will become an owner of a planned expansion team. Anthony will also serve as a global ambassador for...The post Carmelo Anthony to become owner of overseas basketball team appeared first on Larry Brown Sports.",https://larrybrownsports.com/basketball/carmelo-anthony-australia-basketball-team-owner/634041,larrybrownsports,,general,en,us,2024-06-03T23:27:19+00:00,sports
Todd Harmonson,"Former OC Register, L.A. Times sports columnist T.J. Simers dies at 73",Longtime columnist relished his role asking tough questions and sparring with coaches and star athletes.,https://www.whittierdailynews.com/2024/06/03/former-oc-register-l-a-times-sports-columnist-t-j-simers-dies-at-73/,whittierdailynews,https://www.whittierdailynews.com/wp-content/uploads/2024/06/Simers.webp?w=1400px&strip=all,general,en,us,2024-06-03T23:15:13+00:00,sports
Todd Harmonson,"Former OC Register, L.A. Times sports columnist T.J. Simers dies at 73",Longtime columnist relished his role asking tough questions and sparring with coaches and star athletes.,https://www.sbsun.com/2024/06/03/former-oc-register-l-a-times-sports-columnist-t-j-simers-dies-at-73/,sbsun,https://www.sbsun.com/wp-content/uploads/2024/06/Simers.webp?w=1400px&strip=all,general,en,us,2024-06-03T23:15:13+00:00,sports
Todd Harmonson,"Former OC Register, L.A. Times sports columnist T.J. Simers dies at 73",Longtime columnist relished his role asking tough questions and sparring with coaches and star athletes.,https://www.presstelegram.com/2024/06/03/former-oc-register-l-a-times-sports-columnist-t-j-simers-dies-at-73/,presstelegram,https://www.presstelegram.com/wp-content/uploads/2024/06/Simers.webp?w=1400px&strip=all,general,en,us,2024-06-03T23:15:13+00:00,sports
Todd Harmonson,"Former OC Register, L.A. Times sports columnist T.J. Simers dies at 73",Longtime columnist relished his role asking tough questions and sparring with coaches and star athletes.,https://www.redlandsdailyfacts.com/2024/06/03/former-oc-register-l-a-times-sports-columnist-t-j-simers-dies-at-73/,redlandsdailyfacts,https://www.redlandsdailyfacts.com/wp-content/uploads/2024/06/Simers.webp?w=1400px&strip=all,general,en,us,2024-06-03T23:15:13+00:00,sports
Todd Harmonson,"Former OC Register, L.A. Times sports columnist T.J. Simers dies at 73",Longtime columnist relished his role asking tough questions and sparring with coaches and star athletes.,https://www.dailybreeze.com/2024/06/03/former-oc-register-l-a-times-sports-columnist-t-j-simers-dies-at-73/,dailybreeze,https://www.dailybreeze.com/wp-content/uploads/2024/06/Simers.webp?w=1400px&strip=all,general,en,us,2024-06-03T23:15:13+00:00,sports
Todd Harmonson,"Former OC Register, L.A. Times sports columnist T.J. Simers dies at 73",Longtime columnist relished his role asking tough questions and sparring with coaches and star athletes.,https://www.pasadenastarnews.com/2024/06/03/former-oc-register-l-a-times-sports-columnist-t-j-simers-dies-at-73/,pasadenastarnews,https://www.pasadenastarnews.com/wp-content/uploads/2024/06/Simers.webp?w=1400px&strip=all,general,en,us,2024-06-03T23:15:13+00:00,sports
Todd Harmonson,"Former OC Register, L.A. Times sports columnist T.J. Simers dies at 73",Longtime columnist relished his role asking tough questions and sparring with coaches and star athletes.,https://www.sgvtribune.com/2024/06/03/former-oc-register-l-a-times-sports-columnist-t-j-simers-dies-at-73/,sgvtribune,https://www.sgvtribune.com/wp-content/uploads/2024/06/Simers.webp?w=1400px&strip=all,general,en,us,2024-06-03T23:15:13+00:00,sports
Todd Harmonson,"Former OC Register, L.A. Times sports columnist T.J. Simers dies at 73",Longtime columnist relished his role asking tough questions and sparring with coaches and star athletes.,https://www.ocregister.com/2024/06/03/former-oc-register-l-a-times-sports-columnist-t-j-simers-dies-at-73/,ocregister,https://www.ocregister.com/wp-content/uploads/2024/06/Simers.webp?w=1400px&strip=all,general,en,us,2024-06-03T23:15:13+00:00,sports
Todd Harmonson,"Former OC Register, L.A. Times sports columnist T.J. Simers dies at 73",Longtime columnist relished his role asking tough questions and sparring with coaches and star athletes.,https://www.dailybulletin.com/2024/06/03/former-oc-register-l-a-times-sports-columnist-t-j-simers-dies-at-73/,dailybulletin,https://www.dailybulletin.com/wp-content/uploads/2024/06/Simers.webp?w=1400px&strip=all,general,en,us,2024-06-03T23:15:13+00:00,sports
Todd Harmonson,"Former OC Register, L.A. Times sports columnist T.J. Simers dies at 73",Longtime columnist relished his role asking tough questions and sparring with coaches and star athletes.,https://www.dailynews.com/2024/06/03/former-oc-register-l-a-times-sports-columnist-t-j-simers-dies-at-73/,dailynews,https://www.dailynews.com/wp-content/uploads/2024/06/Simers.webp?w=1400px&strip=all,general,en,us,2024-06-03T23:15:13+00:00,sports
Grey Papke,Dodgers All-Star shut down after rehab setback,"The Los Angeles Dodgers are coming out of a cold stretch, but they might have a much bigger issue on their hands. Muncy has not played since May 15 due to an oblique injury, and appears to have suffered a significant setback in his rehab efforts. The infielder felt a &#8220;twinge&#8221; in his rib cage...The post Dodgers All-Star shut down after rehab setback appeared first on Larry Brown Sports.",https://larrybrownsports.com/baseball/dodgers-max-muncy-shut-down-rehab/634039,larrybrownsports,,general,en,us,2024-06-03T23:08:30+00:00,sports
Dan Treacy,"Stanford vs. Texas softball live score, updates, highlights from 2024 Women's College World Series",The Sporting News is tracking live updates and highlights from Monday's Women's College World Series game between Stanford and Texas.,https://www.sportingnews.com/us/college/news/stanford-texas-softball-live-score-updates-highlights/84daa7df35d707002e5d8b7d,Sporting News,https://library.sportingnews.com/styles/crop_style_16_9_desktop/s3/2024-06/sporting-news-2022-sn-live-0343e8d6-75ba-4ffb-9531-cace310a61ed.png?h=920929c4&amp;itok=mGoc2nQk,sports,en,us,2024-06-03T22:51:21+00:00,sports
Lucas Manfredi,"Disney, WBD and Fox Brace for More Congressional Scrutiny After Friday Talks Fail to ‘Satisfy Concerns’ Over Venu Sports Bundle | Exclusive","Congressmen Jerry Nadler and Joaquin Castro are sending a follow-up letter with additional questions as early as this week, TheWrap has learnedThe post Disney, WBD and Fox Brace for More Congressional Scrutiny After Friday Talks Fail to ‘Satisfy Concerns’ Over Venu Sports Bundle | Exclusive appeared first on TheWrap.",https://www.thewrap.com/venu-sports-streaming-bundle-congress-letter-disney-wbd-fox/,thewrap,,general,en,us,2024-06-03T22:49:34+00:00,sports
Larry Brown,49ers adding former Commanders tight end,"The San Francisco 49ers are addressing one of their team needs. The Niners are signing former Washington Commanders tight end Logan Thomas, NFL Media&#8217;s Mike Garafolo reported on Monday. The #49ers are working to finalize a deal with veteran TE Logan Thomas, source says. After a 55-catch season with the #Commanders in 2023, Thomas returns...The post 49ers adding former Commanders tight end appeared first on Larry Brown Sports.",https://larrybrownsports.com/football/49ers-adding-logan-thomas-commanders-tight-end/634038,larrybrownsports,,general,en,us,2024-06-03T22:42:42+00:00,sports
Grey Papke,Tank Dell opens up about his involvement in shooting,"Houston Texans wide receiver Tank Dell opened up about the circumstances that led to his involvement in a shooting in Florida. Dell was shot in the leg during the April incident at a Florida nightclub, and is already progressing toward a full recovery. In an appearance on the &#8220;MILLION DOLLAZ WORTH OF GAME&#8221; podcast, he...The post Tank Dell opens up about his involvement in shooting appeared first on Larry Brown Sports.",https://larrybrownsports.com/football/tank-dell-shooting-incident-details/634037,larrybrownsports,,general,en,us,2024-06-03T22:34:51+00:00,sports
