author,title,description,url,source,image,category,language,country,published_at,topic
Jason W. Edwards,959th Medical Wing Change of Command [Image 1 of 5],"Maj. Gen. Thomas Harrell, director, Defense Health Network Central; commander, 59th Medical Wing, and director, San Antonio Military Health System, presents Col. John Davis, outgoing 959th Medical Group commander, with the Legion of Merit medal during the 959th MDG change of command ceremony at Brooke Army Medical Center, Joint Base San Antonio – Fort Sam Houston, Texas, June 28, 2024. Davis relinquished command after serving as commander of the third largest medical group in the Air Force for two years. (DoD photo by Jason W. Edwards)",https://www.dvidshub.net/image/8506011/959th-medical-wing-change-command,dvidshub,https://d1ldvf68ux039x.cloudfront.net/thumbs/photos/2406/8506011/250w_q95.jpg,general,en,us,2024-06-28T19:57:00+00:00,health
Jason W. Edwards,959th Medical Wing Change of Command [Image 4 of 5],"Col. John Davis, outgoing 959th Medical Group commander, passes the guidon to Maj. Gen. Thomas Harrell, director, Defense Health Network Central; commander, 59th Medical Wing, and director, San Antonio Military Health System, during the 959th MDG change of command ceremony at Brooke Army Medical Center, Joint Base San Antonio – Fort Sam Houston, Texas, June 28, 2024. Davis is succeeded by incoming commander, Col. Sandra Nestor. (DoD photo by Jason W. Edwards)",https://www.dvidshub.net/image/8506015/959th-medical-wing-change-command,dvidshub,https://d1ldvf68ux039x.cloudfront.net/thumbs/photos/2406/8506015/250w_q95.jpg,general,en,us,2024-06-28T19:57:00+00:00,health
,US professor charged with manipulating data for Alzheimer's drug trial,"(marketscreener.com) A U.S. medical professor has beencharged with fraud for allegedly submitting false data to getmillions of dollars in public funds for research into a drug totreat Alzheimers disease. Federal prosecutors said on Friday that Hoau-Yan Wang, 67,fabricated data included in grant applications to the NationalInstitutes of Health on...https://www.marketscreener.com/quote/stock/CASSAVA-SCIENCES-INC-56537199/news/US-professor-charged-with-manipulating-data-for-Alzheimer-s-drug-trial-47269163/?utm_medium=RSS&utm_content=20240628",https://www.marketscreener.com/quote/stock/CASSAVA-SCIENCES-INC-56537199/news/US-professor-charged-with-manipulating-data-for-Alzheimer-s-drug-trial-47269163/?utm_medium=RSS&utm_content=20240628,4-traders,,general,en,us,2024-06-28T19:48:27+00:00,health
Fox News,Childhood medical myths debunked as experts weigh in on 5 common warnings,A new report from University of California San Francisco (UCSF) Health has broken down several common wellness myths that children often hear while growing up.,https://nypost.com/2024/06/28/lifestyle/childhood-medical-myths-debunked-as-experts-weigh-in-on-5-common-warnings/,Post,https://nypost.com/wp-content%2Fuploads%2Fsites%2F2%2F2024%2F06%2Fnewspress-collage-zr4r4n3cp-1719599773784.jpg?quality%3D90%26strip%3Dall%261719585517,general,en,zm,2024-06-28T19:47:32+00:00,health
Sidney Hinds,NMRC Pride Month Highlight: MMN1 Vivian Jaquith,"Naval Medical Research Command (NMRC) boasts a diversity of dedicated Sailors, scientists and support staff who advance Navy Medicine’s ability to care for service member health through research, development and research support. Machinist’s Mate (Nuclear) 1st Class Vivian Jaquith is one such Sailor. A member of the command since 2023, and a member of the U.S. Navy for 16 years, Jaquith has had a noteworthy career as a service member, submariner, engineer, and as a transgender woman.",https://www.dvidshub.net/news/475186/nmrc-pride-month-highlight-mmn1-vivian-jaquith,dvidshub,https://d1ldvf68ux039x.cloudfront.net/thumbs/photos/2406/8505978/250w_q95.jpg,general,en,us,2024-06-28T19:45:21+00:00,health
Rashida Banks,Savannah District advances safety initiatives with CE-SOHMS progress,"The U.S. Army Corps of Engineers, Savannah District has reached a major milestone with the completion of phase two of the Corps of Engineers Safety and Occupational Health Management System (CE-SOHMS).",https://www.dvidshub.net/image/8505977/savannah-district-advances-safety-initiatives-with-ce-sohms-progress,dvidshub,https://d1ldvf68ux039x.cloudfront.net/thumbs/photos/2406/8505977/250w_q95.jpg,general,en,us,2024-06-28T19:41:00+00:00,health
Rashida Banks,Savannah District advances safety initiatives with CE-SOHMS progress,"The U.S. Army Corps of Engineers, Savannah District has reached a major milestone with the completion of phase two of the Corps of Engineers Safety and Occupational Health Management System (CE-SOHMS).",https://www.dvidshub.net/news/475187/savannah-district-advances-safety-initiatives-with-ce-sohms-progress,dvidshub,,general,en,us,2024-06-28T19:41:00+00:00,health
"Meghan Keen-Boehm, Managing Editor",Two local mental health organizations to merge,"The new organization will integrate the leadership, staff, programming, services and facilities of both organizations.",https://neworleanscitybusiness.com/blog/2024/06/28/two-local-mental-health-organizations-to-merge/,neworleanscitybusiness,,general,en,us,2024-06-28T19:31:21+00:00,health
Berkeley Lovelace Jr.,Biden and Trump’s back-and-forth on insulin fails to address the sky-high cost of health care,"During Thursday night’s debate, President Joe Biden and former President Donald Trump spent a considerable amount of time trying to claim credit for lowering the high cost of insulin.",https://www.nbcnews.com/health/health-news/presidential-debate-2024-biden-trump-insulin-cost-debate-doesnt-addres-rcna159442,NBC,https://media-cldnry.s-nbcnews.com/image/upload/t_fit_1500w/rockcms/2024-06/240628-insulin-eli-lilly-se-1121a-3136e0.jpg,general,en,na,2024-06-28T19:27:18+00:00,health
Investing.com,"Dyadic, Proliant Health form protein production partnership","Dyadic, Proliant Health form protein production partnership",https://www.investing.com/news/company-news/dyadic-proliant-health-form-protein-production-partnership-93CH-3501868,Investing.com | Stock Market Quotes &amp; Financial News,https://i-invdn-com.investing.com/news/World_News_9_M_1440052127.jpg,business,en,us,2024-06-28T19:26:19+00:00,health
The Canadian Press,B.C. finishes merging health-profession colleges in plan for better oversight (BC),"British Columbia&#39;s government has amalgamated 11 health-professional colleges into two, setting the foundation for what it says is stronger oversight. Health Minister Adrian Dix says merging the colleges is part of the government&#39;s plan to ensure health professionals are regulated more consi...",https://www.castanet.net/news/BC/494754/B-C-finishes-merging-health-profession-colleges-in-plan-for-better-oversight,Castanet,https://www.castanet.net/content/2024/6/98cfb07a-b9c3-49fa-9522-a42f778773f0_p3833821.jpg,general,en,us,2024-06-28T19:07:00+00:00,health
Matthew Norman,"13-Year-old Girl Killed by Lightning Strike in Halkidiki, Greece",A 13-year-old girl who was hit by a lightning strike on a beach in Possidi on the Halkidiki peninsula in the northern part of the country was pronounced dead after being transferred to a health center in Kassandra. The girl was reportedly taking a walk with her mother along the beach at the well-frequented summer [&#8230;],https://greekreporter.com/2024/06/28/13-year-old-girl-killed-lightning-strike-halkidiki-greece/,greece,,general,en,us,2024-06-28T19:01:27+00:00,health
temp,Consultation On Pesticides Regulations Launched,"Minister of Health Kim Wilson announced the launch of a public consultation on pesticides regulations, saying this &#8220;marks a significant step towards ensuring the safe and responsible use of pesticides in Bermuda.&#8221; Speaking in the House of Assembly today [June 28], the Minister said, &#8220;While pesticides offer undeniable benefits in various sectors, their misuse poses potential [&#8230;]",https://bernews.com/2024/06/consultation-on-pesticides-regulations-launched/,bernews,,general,en,us,2024-06-28T18:53:11+00:00,health
ggrado,Will AZ congressman increase health care costs?,"Eliminating PBMs would cost Arizona seniors and consumers thousands of dollars, making accessing critical life-saving drugs even more challenging to come by, no matter what some wolf in sheep’s clothing Big Pharma “opponents” may say.",https://azcapitoltimes.com/news/2024/06/28/will-az-congressman-increase-health-care-costs/,azcapitoltimes,,general,en,us,2024-06-28T18:46:05+00:00,health
AP News,"After Tokyo setback and knee surgery, Nyjah Huston is growing up as he skates toward Paris Olympics","Nyjah Huston is partying less and stretching more these days. He's also being more careful about his skating as he prepares for the opportunity to overcome his Olympic disappointment three years ago. When he spies a tantalizing new spot, or when a risky old trick calls out from his memory, Huston tries mightily to resist doing anything that could overtly jeopardize his health for nothing more than a thrill or a video part. In other words, the 29-year-old Huston is growing up. It’s an Olympic year, and that now means something to him.",https://www.mymotherlode.com/sports/olympics/3383262/after-tokyo-setback-and-knee-surgery-nyjah-huston-is-growing-up-as-he-skates-toward-paris-olympics.html,mymotherlode,,general,en,us,2024-06-28T18:18:02+00:00,health
Bella Rothman,New University of Colorado Boulder study shows high-fat diet can cause anxiety,"A new University of Colorado Boulder study has found that anxiety, as well as other mental health disorders, could be linked to the food we eat.",https://www.dailycamera.com/2024/06/28/new-university-of-colorado-boulder-study-shows-high-fat-diet-can-cause-anxiety/,dailycamera,https://www.dailycamera.com/wp-content/uploads/migration/2013/0903/20130903_09DCFDNE-2.jpg?w=1400px&strip=all,general,en,us,2024-06-28T18:17:06+00:00,health
Gazi Abbas Shahid,"‘Brain-Eating Amoeba’: 12-Yr-Old Kozhikode Boy Found Positive, 3rd Case In Kerala","The Kerala Health Department has asked people to exercise caution against amoebic meningoencephalitis and avoid bathing in pools of stagnant water, which is where the 'brain-eating amoeba' reside.",https://www.india.com/kerala/brain-eating-amoeba-12-yr-old-kozhikode-boy-found-positive-3rd-case-in-kerala-amoebic-meningoencephalitis-7047414/,India.com,,general,en,in,2024-06-28T18:00:16+00:00,health
Shaehmus Sawyer,Major changes to Quantico pharmacy underway,"MARINE CORPS BASE QUANTICO, VA – Major changes to Naval Health Clinic Quantico’s pharmacy are underway. Pharmacy customers will experience suspension of its services and discover a new approach to fill their medications as the pharmacy transitions to a new location by July 22nd.",https://www.dvidshub.net/news/475158/major-changes-quantico-pharmacy-underway,dvidshub,,general,en,us,2024-06-28T17:50:12+00:00,health
,Marketplace health insurance may get more expensive — unless Congress extends this tax break,"The premium tax credit, which makes marketplace health insurance premiums more affordable, could become less generous after 2025. Here&#039;s what to know.",https://www.cnbc.com/2024/06/28/marketplace-health-insurance-more-expensive.html,Cnbc | World Business News Leader,,business,en,us,2024-06-28T17:48:00+00:00,health
Poppy Burton,Ozzy Osbourne forced out of convention appearance over health concerns,"""All I can do is apologise that we won’t be there""The post Ozzy Osbourne forced out of convention appearance over health concerns appeared first on NME.",https://www.nme.com/news/music/ozzy-osbourne-forced-out-of-convention-appearance-over-health-concerns-3769766?utm_source=rss&utm_medium=rss&utm_campaign=ozzy-osbourne-forced-out-of-convention-appearance-over-health-concerns,nme,,general,en,us,2024-06-28T17:46:01+00:00,health
,TRICARE Authorizes Temporary Prescription Refill Waivers for Missouri due to Flooding,"FALLS CHURCH, Virginia – The Defense Health Agency announced that TRICARE beneficiaries in Missouri may receive emergency prescription refills now through July 6, 2024, due to flooding.",https://www.dvidshub.net/news/475156/tricare-authorizes-temporary-prescription-refill-waivers-missouri-due-flooding,dvidshub,https://d1ldvf68ux039x.cloudfront.net/thumbs/photos/2306/7855365/250w_q95.jpg,general,en,us,2024-06-28T17:44:02+00:00,health
,TRICARE Extends Temporary Prescription Refill Waivers for 2 New Mexico Counties due to Wildfires,"FALLS CHURCH, Virginia – The Defense Health Agency announced that TRICARE has extended the date to receive emergency prescription refills in two New Mexico counties due to the Salt and South Fork Wildfires.",https://www.dvidshub.net/news/475154/tricare-extends-temporary-prescription-refill-waivers-2-new-mexico-counties-due-wildfires,dvidshub,https://d1ldvf68ux039x.cloudfront.net/thumbs/photos/2306/7855365/250w_q95.jpg,general,en,us,2024-06-28T17:43:01+00:00,health
,TRICARE Extends and Expands Temporary Prescription Refill Waivers for Iowa due to Severe Storms and Flooding,"FALLS CHURCH, Virginia – The Defense Health Agency announced that temporary prescription refill waivers have been extended and expanded for Iowa due to severe storms and flooding.",https://www.dvidshub.net/news/475153/tricare-extends-and-expands-temporary-prescription-refill-waivers-iowa-due-severe-storms-and-flooding,dvidshub,https://d1ldvf68ux039x.cloudfront.net/thumbs/photos/2306/7855365/250w_q95.jpg,general,en,us,2024-06-28T17:41:55+00:00,health
,"Fresh Fruits, Vegetables Are Vital for Supporting Service Member Health, Performance",Did you know that June is Fresh Fruits and Vegetables Month? It’s the perfect time to start focusing on the many benefits they bring when added to your diet.,https://www.dvidshub.net/news/475140/fresh-fruits-vegetables-vital-supporting-service-member-health-performance,dvidshub,https://d1ldvf68ux039x.cloudfront.net/thumbs/photos/2406/8505324/250w_q95.jpg,general,en,us,2024-06-28T17:40:57+00:00,health
Daniel Trucios,Grand Jury Rips Sonoma County Health Services Over Fiasco with DEMA,"The Sonoma County Civil Grand Jury is criticizing the Department of Health Services&#8217; response to revelations about the county&#8217;s for-profit homeless services provider, DEMA. The grand jury published a report on Wednesday called &#8220;DEMA: Let&#8217;s All Play",https://www.ksro.com/2024/06/28/grand-jury-rips-sonoma-county-health-services-over-fiasco-with-dema/,ksro,https://dehayf5mhw1h7.cloudfront.net/wp-content/uploads/sites/726/2024/01/25174529/GETTYRF_72122_JuryCourtroom281629936347.jpg,general,en,us,2024-06-28T17:29:03+00:00,health
Lindsay Schreiber,NMRTC Beaufort Spotlight Employee,"Navy Medicine Readiness and Training Command Beaufort recognizes Ms. Sonya Schunior, an Audiologist Technician, for her outstanding demonstration of the Hearing Conservation Program at the Marine Corps Branch Health Clinic aboard Marine Corps Air Station Beaufort, South Carolina.",https://www.dvidshub.net/image/8505493/nmrtc-beaufort-spotlight-employee,dvidshub,https://d1ldvf68ux039x.cloudfront.net/thumbs/photos/2406/8505493/250w_q95.jpg,general,en,us,2024-06-28T17:26:29+00:00,health
Lindsay Schreiber,NMRTC Beaufort Spotlight Employee,"Navy Medicine Readiness and Training Command Beaufort recognizes Ms. Sonya Schunior, an audiologist technician, for her outstanding demonstration of the Hearing Conservation Program at the Marine Corps Branch Health Clinic aboard Marine Corps Air Station Beaufort, South Carolina.",https://www.dvidshub.net/news/475152/nmrtc-beaufort-spotlight-employee,dvidshub,,general,en,us,2024-06-28T17:26:28+00:00,health
,Championship coach and longtime Aflac partner Dawn Staley swaps gamecocks for My Special Aflac Duck®,"(marketscreener.com) Free-of-charge robotic companion brings joy to 16 sickle cell patients at Prisma Health Children's Hospital-MidlandsCOLUMBUS, Ga., June 28, 2024 /PRNewswire/ -- Three-time women's national championship-winning University of South Carolina Head Basketball Coach and Olympic legend Dawn Staley joined Aflac, a leading provider of health...https://www.marketscreener.com/quote/stock/AFLAC-INCORPORATED-11556/news/Championship-coach-and-longtime-Aflac-partner-Dawn-Staley-swaps-gamecocks-for-My-Special-Aflac-Duck-47268592/?utm_medium=RSS&utm_content=20240628",https://www.marketscreener.com/quote/stock/AFLAC-INCORPORATED-11556/news/Championship-coach-and-longtime-Aflac-partner-Dawn-Staley-swaps-gamecocks-for-My-Special-Aflac-Duck-47268592/?utm_medium=RSS&utm_content=20240628,4-traders,,general,en,us,2024-06-28T17:03:08+00:00,health
Matthew Ho,How NFL running back Alexander Mattison’s mental health journey led to his youth football camp,Raiders RB share a message that emphasizes that it's OK to ask for help for young players at his football camp.,https://www.sbsun.com/2024/06/28/how-nfl-running-back-alexander-mattisons-mental-health-journey-led-to-his-youth-football-camp/,sbsun,https://www.sbsun.com/wp-content/uploads/2024/06/SBS-L-JERSEY-0627-23TP-1.jpg?w=1400px&strip=all,general,en,us,2024-06-28T16:54:44+00:00,health
gqlshare,How NFL running back Alexander Mattison’s mental health journey led to his youth football camp,Raiders RB share a message that emphasizes that it's OK to ask for help for young players at his football camp.,https://www.dailybulletin.com/2024/06/28/how-nfl-running-back-alexander-mattisons-mental-health-journey-led-to-his-youth-football-camp/,dailybulletin,https://www.dailybulletin.com/wp-content/uploads/2024/06/SBS-L-JERSEY-0627-23TP-1.jpg?w=1400px&strip=all,general,en,us,2024-06-28T16:54:44+00:00,health
gqlshare,How NFL running back Alexander Mattison’s mental health journey led to his youth football camp,Raiders RB share a message that emphasizes that it's OK to ask for help for young players at his football camp.,https://www.redlandsdailyfacts.com/2024/06/28/how-nfl-running-back-alexander-mattisons-mental-health-journey-led-to-his-youth-football-camp/,redlandsdailyfacts,https://www.redlandsdailyfacts.com/wp-content/uploads/2024/06/SBS-L-JERSEY-0627-23TP-1.jpg?w=1400px&strip=all,general,en,us,2024-06-28T16:54:44+00:00,health
Jim Flynn,"Kelly’s Kids, school districts, YMCAs reap state grant funds","Kelly’s Kids, a nonprofit that uses animal therapy to help children with disabilities reach their potential, has received a $50,000 state grant toward its summer camp programs. The Prospect-based organization was among several grant recipients as part of a two-year, $2 million program to support the delivery of mental health programming for students during the [&#8230;]",https://www.rep-am.com/localnews/2024/06/28/kellys-kids-school-districts-ymcas-reap-state-grant-funds/,rep-am,https://cdn.rep-am.com/wp-content/uploads/2024/06/19_new_081822ay05-scaled.jpg,general,en,us,2024-06-28T16:48:16+00:00,health
,"The Supreme Court weakens federal regulators, overturning decades-old Chevron decision","WASHINGTON (AP) — The Supreme Court on Friday upended a 40-year-old decision that made it easier for the federal government to regulate the environment, public health, workplace safety and consumer protections, delivering a far-reaching and potentially lucrative victory to business interests.",https://www.wral.com/story/the-supreme-court-weakens-federal-regulators-overturning-decades-old-chevron-decision/21502323/,wral,//www.wral.com/,general,en,us,2024-06-28T16:46:22+00:00,health
Linda Hall,News Snippets from the European Press,"Finland: Berry safe THE Radiation and Nuclear Safety Authority (STUK) found that traces of radioactivity from 1950s and 1960s nuclear tests, as well as the 1986 Chernobyl disaster, remained in Finland’s environment but did not pose health risks. The country’s wild lingonberries, cloudberries and bilberries are safe to eat, STUK said. Denmark: Happy here THE [&#8230;]",https://euroweeklynews.com/2024/06/28/news-snippets-from-the-european-press-25/,euroweeklynews,https://euroweeklynews.com/wp-content/uploads/2024/06/2035-photo-STUK-for-Finland-EUROPEAN-PRESS-1024x683.jpg,general,en,us,2024-06-28T16:37:28+00:00,health
Adamu Amadu,Cholera: Jigawa intensifies environmental surveillance,"Tribune OnlineCholera: Jigawa intensifies environmental surveillanceJigawa State Commissioner for Health, Dr Abdullahi Kainuwa said the ministry dispatched its official on surveillance to report any sign of cholera outbreaks in the state. The commissioner made the disclosure while fielding questions to newsmen on the state&#8217;s government efforts on the recent report of the cholera outbreak in some states in the country. Dr [&#8230;]Cholera: Jigawa intensifies environmental surveillanceTribune Online",https://tribuneonlineng.com/cholera-jigawa-intensifies-environmental-surveillance/,tribune,,general,en,ng,2024-06-28T16:20:50+00:00,health
Matt Friedlander,‘Yield’: Pearl Jam Forced To Cancel London Concert Over Health Troubles,"Pearl Jam has announced that its scheduled concert in London this Saturday, June 29, at Tottenham Hotspur Stadium “has regrettably been canceled due to illness in the band.” A message posted on the grunge group’s official website and social media pages explained, “This decision was the last thing we wanted to have to make, especially [&#8230;]The post ‘Yield’: Pearl Jam Forced To Cancel London Concert Over Health Troubles appeared first on American Songwriter.",https://americansongwriter.com/yield-pearl-jam-forced-to-cancel-london-concert-over-health-troubles/,americansongwriter,https://www.youtube.com/embed/3FOhKWV0TBU,general,en,us,2024-06-28T16:09:39+00:00,health
Albert Stumm The Associated Press,Why seasonal eating is better for your health,Choosing whatever is most abundant in the market each month is a good way to start consuming a high variety of fruits and vegetables.,https://www.reviewjournal.com/livewell/why-seasonal-eating-is-better-for-your-health-3076977/,lvrj,,general,en,us,2024-06-28T16:08:44+00:00,health
AP News,"What it means for the Supreme Court to throw out Chevron decision, undercutting federal regulators","Executive branch agencies will likely have more difficulty regulating the environment, public health, workplace safety and other issues under a far-reaching decision Friday by the Supreme Court. The court’s ruling overturned a 1984 decision colloquially known as Chevron that has instructed lower courts to defer to federal agencies when laws passed by Congress are not crystal clear. The 40-year-old decision has been the basis for upholding thousands of regulations by dozens of federal agencies, but has long been a target of conservatives and business groups who argue that it grants too much...",https://www.mymotherlode.com/news/national/us-government/3383151/what-it-means-for-the-supreme-court-to-throw-out-chevron-decision-undercutting-federal-regulators.html,mymotherlode,,general,en,us,2024-06-28T16:06:27+00:00,health
Sara Odeen-Isbister,‘Caring’ mum suffering post-natal psychosis killed her baby during walk around the park,She had just left the mental health facility where she was an in-patient.,https://metro.co.uk/2024/06/28/caring-mum-suffering-post-natal-psychosis-killed-baby-walk-21125206/,Metro,,general,en,gb,2024-06-28T15:57:09+00:00,health
Associated Press,"What it means for the Supreme Court to throw out Chevron decision, undercutting federal regulators","Associated Press WASHINGTON (AP) — Executive branch agencies will likely have more difficulty regulating the environment, public health, workplace safety and other issues under a far-reaching decision Friday by the Supreme Court. The court’s ruling overturned a 1984 decision colloquially known as Chevron that has instructed lower courts to defer to federal agencies when lawsThe post What it means for the Supreme Court to throw out Chevron decision, undercutting federal regulators appeared first on KESQ.",https://kesq.com/news/2024/06/28/what-it-means-for-the-supreme-court-to-throw-out-chevron-decision-undercutting-federal-regulators/,kesq,,general,en,us,2024-06-28T15:42:56+00:00,health
Andrea Chaney,"DTRA Supports Global Health Security Conference, Sydney Australia [Image 2 of 5]","Members of The Defense Threat Reduction Agency (DTRA) attended the Global Health Security Conference (GHSC) from June 18th - June 21st, 2024 in Sydney, Australia to discuss with other international organizations on how to collectively address biosafety, biosecurity and biosurveillance measures to create a safer world for everyone.",https://www.dvidshub.net/image/8505290/dtra-supports-global-health-security-conference-sydney-australia,dvidshub,https://d1ldvf68ux039x.cloudfront.net/thumbs/photos/2406/8505290/250w_q95.jpg,general,en,us,2024-06-28T15:42:25+00:00,health
Andrea Chaney,"DTRA Supports Global Health Security Conference, Sydney Australia [Image 4 of 5]","Members of The Defense Threat Reduction Agency (DTRA) attended the Global Health Security Conference (GHSC) from June 18th - June 21st, 2024 in Sydney, Australia to discuss with other international organizations on how to collectively address biosafety, biosecurity and biosurveillance measures to create a safer world for everyone.",https://www.dvidshub.net/image/8505295/dtra-supports-global-health-security-conference-sydney-australia,dvidshub,https://d1ldvf68ux039x.cloudfront.net/thumbs/photos/2406/8505295/250w_q95.jpg,general,en,us,2024-06-28T15:42:25+00:00,health
