author,title,description,url,source,image,category,language,country,published_at,topic
Kff Health News,"Young gay Latinos see rising share of new HIV cases, leading to call for targeted funding","Overall, estimated new HIV infection rates declined 23% from 2012 to 2022. But a KFF Health News-Associated Press analysis found the rate has not fallen for Latinos as much as it has for other racial and ethnic groups.",https://www.thereporter.com/2024/06/27/young-gay-latinos-see-rising-share-of-new-hiv-cases-leading-to-call-for-targeted-funding/,thereporter,https://www.thereporter.com/wp-content/uploads/2024/06/US-NEWS-HEALTH-YOUNG-LATINOS-HIV-1-KHN.jpg?w=1400px&strip=all,general,en,us,2024-06-27T20:06:14+00:00,health
Kff Health News,"Young gay Latinos see rising share of new HIV cases, leading to call for targeted funding","Overall, estimated new HIV infection rates declined 23% from 2012 to 2022. But a KFF Health News-Associated Press analysis found the rate has not fallen for Latinos as much as it has for other racial and ethnic groups.",https://www.bostonherald.com/2024/06/27/young-gay-latinos-see-rising-share-of-new-hiv-cases-leading-to-call-for-targeted-funding/,bostonherald,https://www.bostonherald.com/wp-content/uploads/2024/06/US-NEWS-HEALTH-YOUNG-LATINOS-HIV-1-KHN.jpg?w=1400px&strip=all,general,en,us,2024-06-27T20:06:14+00:00,health
Kff Health News,"Young gay Latinos see rising share of new HIV cases, leading to call for targeted funding","Overall, estimated new HIV infection rates declined 23% from 2012 to 2022. But a KFF Health News-Associated Press analysis found the rate has not fallen for Latinos as much as it has for other racial and ethnic groups.",https://www.sbsun.com/2024/06/27/young-gay-latinos-see-rising-share-of-new-hiv-cases-leading-to-call-for-targeted-funding/,sbsun,https://www.sbsun.com/wp-content/uploads/2024/06/US-NEWS-HEALTH-YOUNG-LATINOS-HIV-1-KHN.jpg?w=1400px&strip=all,general,en,us,2024-06-27T20:06:14+00:00,health
Kff Health News,"Young gay Latinos see rising share of new HIV cases, leading to call for targeted funding","Overall, estimated new HIV infection rates declined 23% from 2012 to 2022. But a KFF Health News-Associated Press analysis found the rate has not fallen for Latinos as much as it has for other racial and ethnic groups.",https://www.mercurynews.com/2024/06/27/young-gay-latinos-see-rising-share-of-new-hiv-cases-leading-to-call-for-targeted-funding/,mercurynews,https://www.mercurynews.com/wp-content/uploads/2024/06/US-NEWS-HEALTH-YOUNG-LATINOS-HIV-1-KHN.jpg?w=1400px&strip=all,general,en,us,2024-06-27T20:06:14+00:00,health
Kff Health News,"Young gay Latinos see rising share of new HIV cases, leading to call for targeted funding","Overall, estimated new HIV infection rates declined 23% from 2012 to 2022. But a KFF Health News-Associated Press analysis found the rate has not fallen for Latinos as much as it has for other racial and ethnic groups.",https://www.twincities.com/2024/06/27/young-gay-latinos-see-rising-share-of-new-hiv-cases-leading-to-call-for-targeted-funding/,twincities,https://www.twincities.com/wp-content/uploads/2024/06/US-NEWS-HEALTH-YOUNG-LATINOS-HIV-1-KHN.jpg?w=1400px&strip=all,general,en,us,2024-06-27T20:06:14+00:00,health
Kff Health News,"Young gay Latinos see rising share of new HIV cases, leading to call for targeted funding","Overall, estimated new HIV infection rates declined 23% from 2012 to 2022. But a KFF Health News-Associated Press analysis found the rate has not fallen for Latinos as much as it has for other racial and ethnic groups.",https://www.timesheraldonline.com/2024/06/27/young-gay-latinos-see-rising-share-of-new-hiv-cases-leading-to-call-for-targeted-funding/,timesheraldonline,https://www.timesheraldonline.com/wp-content/uploads/2024/06/US-NEWS-HEALTH-YOUNG-LATINOS-HIV-1-KHN.jpg?w=1400px&strip=all,general,en,us,2024-06-27T20:06:14+00:00,health
Kff Health News,"Young gay Latinos see rising share of new HIV cases, leading to call for targeted funding","Overall, estimated new HIV infection rates declined 23% from 2012 to 2022. But a KFF Health News-Associated Press analysis found the rate has not fallen for Latinos as much as it has for other racial and ethnic groups.",https://www.journal-advocate.com/2024/06/27/young-gay-latinos-see-rising-share-of-new-hiv-cases-leading-to-call-for-targeted-funding/,journal-advocate,https://www.journal-advocate.com/wp-content/uploads/2024/06/US-NEWS-HEALTH-YOUNG-LATINOS-HIV-1-KHN.jpg?w=1400px&strip=all,general,en,us,2024-06-27T20:06:14+00:00,health
,Study reveals the microbes vital to a healthy Brisbane River,A unique method of monitoring river health has uncovered an army of tiny organisms fighting to protect the Brisbane River.,https://phys.org/news/2024-06-reveals-microbes-vital-healthy-brisbane.html,Phys.org - News And Articles On Science And Technology,https://scx1.b-cdn.net/csz/news/tmb/2024/study-reveals-the-micr.jpg,science,en,us,2024-06-27T20:03:34+00:00,health
Andrew Duffy,"Public health, police warn dangerous 'Pyro' found in city's drug supply","Ottawa Public Health and Ottawa police are warning about the danger of a new drug – known by the street name ‘Pyro’ – that has been detected in the city’s unregulated drug supply. In a joint public alert issued Thursday, the organizations, along with the city’s Overdose Prevention and Response Taskforce, said Health Canada has [&#8230;]",https://ottawacitizen.com/news/local-news/public-health-police-warn-dangerous-pyro-found-in-citys-drug-supply,ottawacitizen,,general,en,us,2024-06-27T19:53:36+00:00,health
Linda Qiu,Fact-Checking Biden’s and Trump’s Policy Claims Before the Debate,"We scrutinized the presidential candidates’ recent claims on abortion, health care, crime and climate change ahead of the debate.",https://www.nytimes.com/2024/06/27/us/politics/biden-trump-fact-check-debate.html,The New York Times,,general,en,us,2024-06-27T19:52:48+00:00,health
Regina Leader-Post,Demolition phase begins for Regina's new Breast Health Centre,"“There is certainly much more work to be done, but my optimism remains ever present,"" said a Regina surgeon of the new centre.",https://leaderpost.com/news/demolition-phase-begins-for-reginas-new-breast-health-centre,leaderpost,,general,en,us,2024-06-27T19:52:47+00:00,health
Daniel Dotson,Forsyth County commissioners to explore opening mental health facility: what it may include and where it may go,The Board of Commissioners has decided to explore options to create a mental health services facility in Forsyth County.,https://www.forsythnews.com/news/government/forsyth-county-commissioners-explore-opening-mental-health-facility-what-it-may-include-and-where-it-may-go/,forsythnews,https://forsythnews.cdn-anvilcms.net/media/images/2024/06/27/images/MH_PRESENTATION_5.max-540x540.jpg,general,en,us,2024-06-27T19:45:46+00:00,health
TooFab Staff,"Drew Carey Says 'Price Is Right' Contestants Often High or Drinking, Talks Mental Health, Longevity","Drew Carey loves what he does and has no plans to stop anytime soon. The longtime host of The Price Is Right, who took over in 2007 after Bob Barker's retirement, is now the longest-running current game show host. As he enjoys his 17th year behind the long-stemmed mic, Carey opened up about how much he loves his job, some of the things he's noticed about a lot of the contestants, and why he changed up Barker's classic sign-off. While chatting with TV Insider, he joked that a lot of the times when the contestants ""Come on down!"" they've already begun to celebrate. ""That happens here all the time...",https://www.toofab.com/2024/06/27/drew-carey-price-is-right-contestants-often-high-drinking-mental-health-longevity/,toofab,https://images.toofab.com/image/39/o/2024/06/27/39c4837a3d5349fda6b0d8f8d043bf7c_md.jpg,general,en,us,2024-06-27T19:45:18+00:00,health
,US charges 193 people in $2.75 billion health care fraud bust,"The U.S. Justice Department has charged 193 people, including 76 doctors, nurses and other medical professionals, with participating in health care fraud schemes worth $2.75 billion, the agency said on Thursday. The government seized more than $231 million in cash, luxury vehicles, gold and other assets in the law enforcement action that spanned 32 federal districts. Cases include unlawful [&#8230;]",https://cyprus-mail.com/2024/06/27/us-charges-193-people-in-2-75-billion-health-care-fraud-bust/,cyprus-mail,https://cyprus-mail.com/image/s640x/file/wp-content/uploads/2024/06/2024-06-24T220117Z_1169859287_RC2C48AT6GDL_RTRMADP_3_USA-HAITI-CRIME.jpg,general,en,us,2024-06-27T19:33:35+00:00,health
associatedpress,Justice Department charges nearly 200 people in $2.7 billion health care fraud schemes crackdown,"Associated Press WASHINGTON (AP) — Nearly 200 people have been charged in a sweeping nationwide crackdown on health care fraud schemes with false claims topping $2.7 billion, the Justice Department said on Thursday. Attorney General Merrick Garland announced the charges against doctors, nurse practitioners and others across the U.S. accused of a variety of scams,The post Justice Department charges nearly 200 people in $2.7 billion health care fraud schemes crackdown appeared first on News Channel 3-12.",https://keyt.com/news/2024/06/27/justice-department-charges-nearly-200-people-in-2-7-billion-health-care-fraud-schemes-crackdown/,keyt,,general,en,us,2024-06-27T19:31:36+00:00,health
Gino DeAngelis,"RIDOH recommends closing Barrington beach, reopening 2 others","PROVIDENCE, R.I. (WLNE) &#8212; The Rhode Island Department of Health updated the statuses of three beaches in the state Thursday afternoon. RIDOH said it is recommending closing Barrington Town Beach due to high bacteria counts. It added that Briar Point Beach in Coventry and Hope Community Service Pond in Scituate can be reopened for swimming due to bacteria counts returning to...",https://www.abc6.com/ridoh-recommends-closing-barrington-beach-reopening-2-others/,abc6,,general,en,us,2024-06-27T19:31:20+00:00,health
,DOJ charges nearly 200 people in $2.7 billion health care fraud schemes crackdown,The Justice Department has charged nearly 200 people in a sweeping crackdown on health care fraud schemes nationwide with false claims topping $2.7 billion,https://abcnews.go.com/US/wireStory/justice-department-charges-200-people-27-billion-health-111483851,ABC News,https://s.abcnews.com/images/US/wirestory_24948b951896d0f265c29ba3fcacf858_4x3_384.jpg,general,en,us,2024-06-27T19:18:17+00:00,health
AP News,"Despite Supreme Court ruling, the future of emergency abortions is still unclear for US women","The U.S. Supreme Court did not settle the debate over whether federal law requires hospitals to stabilize pregnant patients with emergency abortions on Wednesday, despite saying Idaho hospitals can provide abortions in medical emergencies even with the state’s restrictions.  The court delivered a 6-3 procedural ruling that left key questions still lingering about whether states can ban doctors from providing emergency abortions that save a woman from serious infection or organ loss. Health and legal experts say Thursday’s ruling by a deeply divided Supreme Court does nothing to protect...",https://www.mymotherlode.com/news/national/us-government/3382571/despite-supreme-court-ruling-the-future-of-emergency-abortions-is-still-unclear-for-us-women.html,mymotherlode,,general,en,us,2024-06-27T19:09:37+00:00,health
Rishma Dosani,Sharon Osbourne cancels appearance due to Ozzy’s health issues leaving him ‘unable to travel’,‘All I can do is apologise.',https://metro.co.uk/2024/06/27/sharon-osbourne-cancels-appearance-ozzys-health-issues-21119711/,Metro,,general,en,gb,2024-06-27T19:06:04+00:00,health
Jewel Topsfield and Broede Carmody,‘Turn the lights off’: Hospital staff offered cost-cutting tips in budget crackdown,"Workers at three major Melbourne hospitals have been told that simple things can save money, as Alfred Health reviews costs in a desperate bid to cut spending.",https://www.smh.com.au/national/victoria/turn-the-lights-off-hospital-staff-offered-cost-cutting-tips-in-budget-crackdown-20240627-p5jpdq.html?ref=rss&utm_medium=rss&utm_source=rss_feed,The Sydney Morning Herald,https://static.ffx.io/images/$zoom_0.5298%2C$multiply_0.7554%2C$ratio_1.777778%2C$width_1059%2C$x_0%2C$y_41/t_crop_custom/q_86%2Cf_jpg/81eebbb6a96d7799cf3d771b1a51be82f57e734f,general,en,au,2024-06-27T19:00:00+00:00,health
Jewel Topsfield and Broede Carmody,‘Turn the lights off’: Hospital staff offered cost-cutting tips in budget crackdown,"Workers at three major Melbourne hospitals have been told that simple things can save money, as Alfred Health reviews costs in a desperate bid to cut spending.",https://www.theage.com.au/national/victoria/turn-the-lights-off-hospital-staff-offered-cost-cutting-tips-in-budget-crackdown-20240627-p5jpdq.html?ref=rss&utm_medium=rss&utm_source=rss_national,The Age,https://static.ffx.io/images/$zoom_0.5298%2C$multiply_0.7554%2C$ratio_1.777778%2C$width_1059%2C$x_0%2C$y_41/t_crop_custom/q_86%2Cf_jpg/81eebbb6a96d7799cf3d771b1a51be82f57e734f,general,en,au,2024-06-27T19:00:00+00:00,health
Jewel Topsfield and Broede Carmody,‘Turn the lights off’: Hospital staff offered cost-cutting tips in budget crackdown,"Workers at three major Melbourne hospitals have been told that simple things can save money, as Alfred Health reviews costs in a desperate bid to cut spending.",https://www.theage.com.au/national/victoria/turn-the-lights-off-hospital-staff-offered-cost-cutting-tips-in-budget-crackdown-20240627-p5jpdq.html?ref=rss&utm_medium=rss&utm_source=rss_national_victoria,The Age,https://static.ffx.io/images/$zoom_0.5298%2C$multiply_0.7554%2C$ratio_1.777778%2C$width_1059%2C$x_0%2C$y_41/t_crop_custom/q_86%2Cf_jpg/81eebbb6a96d7799cf3d771b1a51be82f57e734f,general,en,au,2024-06-27T19:00:00+00:00,health
Jewel Topsfield and Broede Carmody,‘Turn the lights off’: Hospital staff offered cost-cutting tips in budget crackdown,"Workers at three major Melbourne hospitals have been told that simple things can save money, as Alfred Health reviews costs in a desperate bid to cut spending.",https://www.brisbanetimes.com.au/national/victoria/turn-the-lights-off-hospital-staff-offered-cost-cutting-tips-in-budget-crackdown-20240627-p5jpdq.html?ref=rss&utm_medium=rss&utm_source=rss_national,brisbanetimes,https://static.ffx.io/images/$zoom_0.5298%2C$multiply_0.7554%2C$ratio_1.777778%2C$width_1059%2C$x_0%2C$y_41/t_crop_custom/q_86%2Cf_jpg/81eebbb6a96d7799cf3d771b1a51be82f57e734f,general,en,au,2024-06-27T19:00:00+00:00,health
Jewel Topsfield and Broede Carmody,‘Turn the lights off’: Hospital staff offered cost-cutting tips in budget crackdown,"Workers at three major Melbourne hospitals have been told that simple things can save money, as Alfred Health reviews costs in a desperate bid to cut spending.",https://www.watoday.com.au/national/victoria/turn-the-lights-off-hospital-staff-offered-cost-cutting-tips-in-budget-crackdown-20240627-p5jpdq.html?ref=rss&utm_medium=rss&utm_source=rss_feed,watoday,https://static.ffx.io/images/$zoom_0.5298%2C$multiply_0.7554%2C$ratio_1.777778%2C$width_1059%2C$x_0%2C$y_41/t_crop_custom/q_86%2Cf_jpg/81eebbb6a96d7799cf3d771b1a51be82f57e734f,general,en,au,2024-06-27T19:00:00+00:00,health
Maria Christina Yager,Munson Soldiers celebrate diversity [Image 3 of 3],"U.S. Army Physical Therapy Specialist Staff Sgt. Alexander Hatchett, assigned to Munson Army Health Center, Fort Leavenworth, Kansas, shares information about the history of the Juneteenth Federal Holiday, to participants of the U.S. Army Combined Arms Center and Fort Leavenworth Army Heritage Month Observance on post June 25. According to the Defense Equal Opportunity Management Institute, Juneteenth honors the end to slavery in the United States and is considered the longest-running African American holiday.",https://www.dvidshub.net/image/8503050/munson-soldiers-celebrate-diversity,dvidshub,https://d1ldvf68ux039x.cloudfront.net/thumbs/photos/2406/8503050/250w_q95.jpg,general,en,us,2024-06-27T18:48:57+00:00,health
"Jason Meisner, Lisa Schencker",Former Outcome Health president Shradha Agarwal sentenced to 3 years in a halfway house,"Shradha Agarwal was the second of a trio of former top Outcome executives to be sentenced this week for their roles in a scheme that prosecutors said defrauded pharmaceutical companies, investors and financial institutions.",https://www.chicagotribune.com/2024/06/27/former-outcome-health-president-shradha-agarwal-sentenced/,Chicago Tribune,https://www.chicagotribune.com/wp-content/uploads/2024/06/CTC-L-PURDY-OUTCOME-SENTENCING-01_199363324.jpg?w=1400px&strip=all,general,en,us,2024-06-27T18:41:53+00:00,health
by Brianna Davis,Firearm violence declared a public health emergency in the U.S.,"Madison experienced three shootings in one weekend, breaking a five-week streak with no reported gunfire, according to a statement from Madison Mayor Satya Rhodes-Conway. Firearms are the leading cause of death by suicide and homicide among non-Hispanic Black men aged 15-34 in Dane County, according to Public Health Madison & Dane County and their Gun...",https://badgerherald.com/news/madison/2024/06/27/firearm-violence-declared-a-public-health-emergency-in-the-u-s/,badgerherald,,general,en,us,2024-06-27T18:38:41+00:00,health
Joe Ciccanti,Maryland Department of Health Announces Funding Opportunity to Address the Opioid Crisis,"The Maryland Department of Health is announcing a funding&nbsp;opportunity to address the opioid crisis. The department&nbsp;announced a request for applications (RFA) for Maryland’s Opioid Restitution Fund--the&nbsp;goal of which is to support programs that address the misuse of opioid products and to treat opioid use or related disorders. Over 2,500 fatal overdoses occurred in Maryland in 2023, according to preliminary data from the Vital Statistics Administration.&nbsp;Additional Information from the Maryland Department of Health:“As health leaders, we are responsible for ensuring that...",https://www.wgmd.com/maryland-department-of-health-announces-funding-opportunity-to-address-the-opioid-crisis/,wgmd,,general,en,us,2024-06-27T18:38:05+00:00,health
,"GoodRx : What Is Cozy Cardio? The Relaxing Workout Trend, Explained","(marketscreener.com) Key takeaways: Cozy cardio is a low-impact, low-intensity workout done in a relaxing environment. This accessible workout approach offers mental and physical benefits, such as stress relief and better heart health. ...https://www.marketscreener.com/quote/stock/GOODRX-HOLDINGS-INC-112833794/news/GoodRx-What-Is-Cozy-Cardio-The-Relaxing-Workout-Trend-Explained-47259674/?utm_medium=RSS&utm_content=20240627",https://www.marketscreener.com/quote/stock/GOODRX-HOLDINGS-INC-112833794/news/GoodRx-What-Is-Cozy-Cardio-The-Relaxing-Workout-Trend-Explained-47259674/?utm_medium=RSS&utm_content=20240627,4-traders,,general,en,us,2024-06-27T18:35:15+00:00,health
,GoodRx : Which Types of Cookware Should You Avoid? The Best and Worst Pots and Pans For Your Health,(marketscreener.com) Key takeaways: Nonstick surfaces are made using &quot;forever&quot; molecules that don't break down with time. There's some debate about whether or not the nonstick surfaces of cookware are a significant source of exposure to forever chemicals. ...https://www.marketscreener.com/quote/stock/GOODRX-HOLDINGS-INC-112833794/news/GoodRx-Which-Types-of-Cookware-Should-You-Avoid-The-Best-and-Worst-Pots-and-Pans-For-Your-Health-47259670/?utm_medium=RSS&utm_content=20240627,https://www.marketscreener.com/quote/stock/GOODRX-HOLDINGS-INC-112833794/news/GoodRx-Which-Types-of-Cookware-Should-You-Avoid-The-Best-and-Worst-Pots-and-Pans-For-Your-Health-47259670/?utm_medium=RSS&utm_content=20240627,4-traders,,general,en,us,2024-06-27T18:35:14+00:00,health
,GoodRx : A Third of Americans Aren't Filling Their Prescriptions Because of High Costs,"(marketscreener.com) Key takeaways: Our survey found that 33% of Americans leave prescriptions for medications unfilled due to cost, risking health and increasing long-term healthcare expenses. Nearly 30% of Americans encounter drug shortages, which...https://www.marketscreener.com/quote/stock/GOODRX-HOLDINGS-INC-112833794/news/GoodRx-A-Third-of-Americans-Aren-t-Filling-Their-Prescriptions-Because-of-High-Costs-47259668/?utm_medium=RSS&utm_content=20240627",https://www.marketscreener.com/quote/stock/GOODRX-HOLDINGS-INC-112833794/news/GoodRx-A-Third-of-Americans-Aren-t-Filling-Their-Prescriptions-Because-of-High-Costs-47259668/?utm_medium=RSS&utm_content=20240627,4-traders,,general,en,us,2024-06-27T18:35:14+00:00,health
Hank Campbell,FDA: America Has Created Health inequity In Men,"The National Center for Health Statistics shows that average life expectancy for American men in 2022 was down to 74.8 years, 5.4 years lower than American women.read more",https://www.science20.com/content/fda_america_has_created_health_inequity_in_men,science20,,general,en,us,2024-06-27T18:23:12+00:00,health
,A neutralizing antibody prevents postfusion transition of measles virus fusion protein | Science,"Measles virus (MeV) presents a public health threat that is escalating as vaccine coverage in the general population declines and as populations of immunocompromised individuals, who cannot be vaccinated, increase. There are no approved therapeutics for ...",https://www.science.org/doi/10.1126/science.adm8693,Science | Aaas,https://feeds.science.org/rss/images/science/3669f16343.jpg,science,en,us,2024-06-27T18:15:24+00:00,health
,US Justice Department charges 193 defendants in $2.75 billion health care fraud bust,"(marketscreener.com) The U.S. Justice Department has filed criminal charges against 193 defendants, including medical professionals, alleging they engaged in health care fraud schemes worth $2.75 billion, the agency said on Thursday. https://www.marketscreener.com/news/latest/US-Justice-Department-charges-193-defendants-in-2-75-billion-health-care-fraud-bust--47259610/?utm_medium=RSS&utm_content=20240627",https://www.marketscreener.com/news/latest/US-Justice-Department-charges-193-defendants-in-2-75-billion-health-care-fraud-bust--47259610/?utm_medium=RSS&utm_content=20240627,4-traders,,general,en,us,2024-06-27T18:14:22+00:00,health
Noble Brigham,Former mental health tech accused of misconduct with child patient,A mental health technician at Desert Winds Hospital has been arrested after authorities said he inappropriately touched a child patient.,https://www.reviewjournal.com/crime/sex-crimes/former-mental-health-tech-accused-of-misconduct-with-child-patient-3076197/,lvrj,,general,en,us,2024-06-27T18:09:58+00:00,health
AP News,Ohio teen accused of having school hit list pleads guilty to inducing panic,A teenager in Ohio accused of making a hit list and planning a mass killing at a high school near Cincinnati has pleaded guilty to reduced charges of inducing panic. Prosecutors on Thursday dropped a charge against the 14-year-old of conspiracy to commit aggravated murder. He had been charged in February. Prosecutors say the teen exchanged text messages with a Colorado man about gassing the school and killing students and staff. The county public defender’s office said shortly after the teen’s arrest that he had significant mental health challenges and that he was impressionable. The man...,https://www.mymotherlode.com/news/national/3382525/ohio-teen-accused-of-having-school-hit-list-pleads-guilty-to-inducing-panic.html,mymotherlode,,general,en,us,2024-06-27T18:09:58+00:00,health
The Associated Press,Justice Department charges nearly 200 people in $2.7 billion health care fraud schemes crackdown,"WASHINGTON (AP) &#8212; Nearly 200 people have been charged in a sweeping nationwide crackdown on health care fraud schemes with false claims topping $2.7 billion, the Justice Department said on Thursday. Attorney General Merrick Garland announced the charges against doctors, nurse practitioners and others across the U.S. accused of a variety of scams, including a [&#8230;]",https://nationalpost.com/pmn/health-pmn/justice-department-charges-nearly-200-people-in-2-7-billion-health-care-fraud-schemes-crackdown,nationalpost,,general,en,us,2024-06-27T18:08:28+00:00,health
AP News,Justice Department charges nearly 200 people in $2.7 billion health care fraud schemes crackdown,"The Justice Department has charged nearly 200 people in a sweeping crackdown on health care fraud schemes nationwide with false claims topping $2.7 billion. Attorney General Merrick Garland announced charges against doctors, nurse practitioners and others across the U.S. on Thursday. The people are accused of a variety of scams, including a $900 million scheme in Arizona targeting dying patients. Prosecutors accuse two owners of Arizona wound care companies of accepting $330 million in kickbacks in a scheme to fraudulently bill Medicare for wound dressings. Another case alleges a scheme in...",https://www.mymotherlode.com/news/national/3382519/justice-department-charges-nearly-200-people-in-2-7-billion-health-care-fraud-schemes-crackdown.html,mymotherlode,,general,en,us,2024-06-27T18:07:49+00:00,health
Shay Lawson,Eisenhower Health opens first Addiction Medicine Clinic,"Eisenhower Health is taking a major step in addressing the substance abuse crisis by opening its first addiction medicine clinic. The Eisenhower Charles Rechlin Outpatient Treatment Center is a new state-of-the-art facility on Palm Canyon Drive in Cathedral City. Eisenhower Health held a ribbon cutting for the clinic Thursday morning. Through support from Charles Rechlin,The post Eisenhower Health opens first Addiction Medicine Clinic appeared first on KESQ.",https://kesq.com/news/2024/06/27/eisenhower-health-opens-first-addiction-medicine-clinic/,kesq,,general,en,us,2024-06-27T18:05:10+00:00,health
