author,title,description,url,source,image,category,language,country,published_at,topic
,Women 'Changing The Game' In Mongolia's Patriarchal Politics,"Women candidates are pushing for greater representation in Mongolia's male-dominated politics, raising their voices for change and inspiring girls to follow in their footsteps.",https://www.ibtimes.com.au/women-changing-game-mongolias-patriarchal-politics-1848952,International Business Times Au,,business,en,au,2024-06-27T04:30:11+00:00,politics
AP News,How the Biden-Trump debate could change the trajectory of the 2024 campaign,"Both President Joe Biden and his Republican rival, Donald Trump, hope to jolt a campaign that many voters are just beginning to watch. Thursday's debate in Atlanta offers unparalleled opportunities for both candidates to try to shape the political narrative. For Biden, the debate gives him the chance to reassure voters that, at 81, he’s capable of guiding the U.S. through a range of challenges. The 78-year-old Trump, meanwhile, could use the moment to try to move past his recent felony conviction in New York. Their performances have the potential to alter the trajectory of the election.",https://www.mymotherlode.com/news/national/general-election/3382170/how-the-biden-trump-debate-could-change-the-trajectory-of-the-2024-campaign.html,mymotherlode,,general,en,us,2024-06-27T04:11:00+00:00,politics
Associated Press,How the Biden-Trump debate could change the trajectory of the 2024 campaign,"Associated Press ATLANTA (AP) — Both President Joe Biden and his Republican rival, Donald Trump, hope to jolt a campaign that many voters are just beginning to watch. Thursday&#8217;s debate in Atlanta offers unparalleled opportunities for both candidates to try to shape the political narrative. For Biden, the debate gives him the chance to reassureThe post How the Biden-Trump debate could change the trajectory of the 2024 campaign appeared first on KION546.",https://kion546.com/news/2024/06/26/how-the-biden-trump-debate-could-change-the-trajectory-of-the-2024-campaign/,kionrightnow,,general,en,us,2024-06-27T04:08:13+00:00,politics
KNEWS,Let’s come together in one accord on issues of human rights to ensure the protection of all,"Dear Editor, I am deeply concerned about the development of our country and the justice served for all. The recent allegation of a female political activist being verbally, sexually abused under the threat of a gun brings to the awareness of society the reality of varied responses by victims and alleged victims of such violence. [&#8230;]The post Let’s come together in one accord on issues of human rights to ensure the protection of all appeared first on Kaieteur News.",https://www.kaieteurnewsonline.com/2024/06/27/lets-come-together-in-one-accord-on-issues-of-human-rights-to-ensure-the-protection-of-all/,Kaieteur News,,general,en,gy,2024-06-27T04:03:42+00:00,politics
Mark Landler,Is King Charles III About to Get a Prime Minister He Likes?,"The British monarch is constitutionally barred from any role in politics. But experts say that Charles and the leader of the Labour Party, Keir Starmer, have much in common.",https://www.nytimes.com/2024/06/27/world/europe/uk-king-charles-keir-starmer.html,nytimes,https://static01.nyt.com/images/2024/06/27/multimedia/27uk-king-starmer-01-hlzk/27uk-king-starmer-01-hlzk-mediumSquareAt3X.jpg,general,en,us,2024-06-27T04:01:24+00:00,politics
KNEWS,Mr. Aubrey Norton Lacks a Vital Tool to Keep his MPs in Line!,"Dear Editor, Judging by the holding of Party Congress and other indicators, the two major political parties, PPPC and PNCR, have already begun to walk on the 2025 national and regional elections’ campaign trail, although neither political party has issued a formal announcement to this effect. The major opposition political party, PNCR, and the smaller [&#8230;]The post Mr. Aubrey Norton Lacks a Vital Tool to Keep his MPs in Line! appeared first on Kaieteur News.",https://www.kaieteurnewsonline.com/2024/06/27/mr-aubrey-norton-lacks-a-vital-tool-to-keep-his-mps-in-line/,Kaieteur News,,general,en,gy,2024-06-27T04:01:13+00:00,politics
Miranda Devine,How CIA interference with the ‘Spies Who Lie’ letter made Biden the president,"We now see that the CIA staged a domestic disinformation campaign to protect its favored candidate, the decrepit and pliable Joe Biden, from the political consequences of his corruption.",https://nypost.com/2024/06/26/opinion/how-cia-interference-with-the-spies-who-lie-letter-made-biden-the-president/,Post,https://nypost.com/wp-content%2Fuploads%2Fsites%2F2%2F2024%2F06%2Fnewspress-collage-wntpwz3et-1719456536539.jpg?quality%3D90%26strip%3Dall%261719442290,general,en,zm,2024-06-27T03:57:41+00:00,politics
Journal Online,TUCP: ₱150 wage hike not politics but a matter of basic fairness and survival employers reply to workers: Drop Dead!,"The Trade Union Congress of the Philippines (TUCP) lambasted employers&#8217; dismissive statements made during the NCR Regional Wage Board Public Hearing last June 20, that a legislated wage hike is just &#8220;politics&#8221; even as they dismissed the survival concerns of their workers by insisting on a one-year wage freeze. At most, another employer representative said, [&#8230;]",https://journal.com.ph/tucp-%e2%82%b1150-wage-hike-not-politics-but-a-matter-of-basic-fairness-and-survival-employers-reply-to-workers-drop-dead/,journal,,general,en,ph,2024-06-27T03:40:20+00:00,politics
,What impact could this election have on Scottish independence?,"Whatever the outcome, it seems unlikely that the constitution will vanish as an issue in Scottish politics.",https://www.bbc.com/news/articles/c0447rxk7jxo,BBC,https://ichef.bbci.co.uk/news/240/cpsprodpb/211a/live/4e249420-33d7-11ef-a044-9d4367d5b599.png,general,en,gb,2024-06-27T03:31:13+00:00,politics
Andrew Lapin,"Harvard antisemitism task force finds ‘dire’ situation for Israelis on campus, urges swift action","Israeli students at Harvard University are facing “dire” exclusion on campus and other students are suffering because of “political litmus tests” to participate in clubs and activities, a task force charged with reporting on antisemitism at Harvard has concluded. The task force was convened by the school’s Jewish interim president, Alan Garber, in January, shortly [&#8230;]--The post Harvard antisemitism task force finds &#8216;dire&#8217; situation for Israelis on campus, urges swift action appeared first on Jewish Telegraphic Agency.",https://www.jta.org/2024/06/26/united-states/harvard-antisemitism-task-force-finds-dire-situation-for-israelis-on-campus-urges-swift-action,jta,https://www.jta.org/wp-content/uploads/2022/04/4-29-22-harvard.jpg,general,en,us,2024-06-27T03:14:39+00:00,politics
ABC News,Why the Biden-Trump debate matters more than you think,"The theme of American politics over the last decade is polarization: Specifically, we've seen a lot of it. Some pundits have bemoaned the disappearance of swing voters, for example, and the rule of ""negative partisanship"" over rationality. As The New York Times asked this February: ""Are There Any Persuadable Voters Left?""",https://www.wwaytv3.com/why-the-biden-trump-debate-matters-more-than-you-think/,wwaytv3,,general,en,us,2024-06-27T02:38:48+00:00,politics
XM.com,What Could UK General Election Mean for Pound?,"UK citizens head to the ballots on July 4 Opinion polls point to a Labour Party victory Political stability could initially benefit the pound But BoE rate cut bets could prove negative in the longer run How it works On July 4, Britons will head to the ballots to vote in a general election, with [&#8230;]The post What Could UK General Election Mean for Pound? appeared first on Action Forex.",https://www.actionforex.com/contributors/fundamental-analysis/557112-what-could-uk-general-election-mean-for-pound/,actionforex,,general,en,us,2024-06-27T02:27:28+00:00,politics
AP News,"Women’s rights will be raised at the UN meeting being attended by Taliban, UN official says","The U.N. political chief who will chair the first meeting between Afghanistan’s Taliban rulers and envoys from about 25 countries says women's rights will be raised at every session. The Undersecretary-General Rosemary DiCarlo was answering sharp criticism that Afghan women have been excluded from the two-day meeting in Qatar that starts Sunday. She stressed to reporters that the meeting is an initial engagement and not recognition of the Taliban as Afghanistan's government. The meeting will also include envoys from the US and EU, Russia, China and several of Afghanistan’s neighbors.",https://www.mymotherlode.com/news/world/3382115/womens-rights-will-be-raised-at-the-un-meeting-being-attended-by-taliban-un-official-says.html,mymotherlode,,general,en,us,2024-06-27T02:09:12+00:00,politics
AP News,"North Carolina party recognition for groups seeking RFK Jr., West on ballot stopped for now","A divided North Carolina election board has blocked for now the official party recognition of political groups that collected signatures and want Robert F. Kennedy Jr. and Cornel West on this fall’s presidential ballot. The We The People party and Justice for All Party of North Carolina initiated petition drives to receive official party designations. It appears the groups collected enough required signatures, but the Democratic majority on the board voted against recognition, saying they want to scrutinize their activities further. Another board meeting on the petition drives is expected...",https://www.mymotherlode.com/news/national/general-election/3382114/north-carolina-party-recognition-for-groups-seeking-rfk-jr-west-on-ballot-stopped-for-now.html,mymotherlode,,general,en,us,2024-06-27T02:08:45+00:00,politics
,UK Election Campaign Enters Final Straight,"Britain goes to the polls next week in a general election that looks set to end 14 years of Conservative rule marked by economic turbulence, Brexit, political scandal and upheaval.",https://www.ibtimes.com.au/uk-election-campaign-enters-final-straight-1848941,International Business Times Au,,business,en,au,2024-06-27T02:06:10+00:00,politics
Caitlin Fitzsimmons,Political fight sparks as electricity network axes timber power poles,"Essential Energy, the electricity distributor that covers 95 per cent of NSW, is switching to composite poles to make its network more resilient in bushfires.",https://www.smh.com.au/environment/sustainability/political-fight-sparks-as-electricity-network-axes-timber-power-poles-20240626-p5jp08.html?ref=rss&utm_medium=rss&utm_source=rss_feed,The Sydney Morning Herald,https://static.ffx.io/images/$zoom_0.3531%2C$multiply_0.7554%2C$ratio_1.777778%2C$width_1059%2C$x_0%2C$y_0/t_crop_custom/q_86%2Cf_auto/8f6b088737eec2553d5d4c4b65138cbe9847ebb5,general,en,au,2024-06-27T01:47:19+00:00,politics
Caitlin Fitzsimmons,Political fight sparks as electricity network axes timber power poles,"Essential Energy, the electricity distributor that covers 95 per cent of NSW, is switching to composite poles to make its network more resilient in bushfires.",https://www.smh.com.au/environment/sustainability/political-fight-sparks-as-electricity-network-axes-timber-power-poles-20240626-p5jp08.html?ref=rss&utm_medium=rss&utm_source=rss_environment,The Sydney Morning Herald,https://static.ffx.io/images/$zoom_0.3531%2C$multiply_0.7554%2C$ratio_1.777778%2C$width_1059%2C$x_0%2C$y_0/t_crop_custom/q_86%2Cf_auto/8f6b088737eec2553d5d4c4b65138cbe9847ebb5,general,en,au,2024-06-27T01:47:19+00:00,politics
Caitlin Fitzsimmons,Political fight sparks as electricity network axes timber power poles,"Essential Energy, the electricity distributor that covers 95 per cent of NSW, is switching to composite poles to make its network more resilient in bushfires.",https://www.theage.com.au/environment/sustainability/political-fight-sparks-as-electricity-network-axes-timber-power-poles-20240626-p5jp08.html?ref=rss&utm_medium=rss&utm_source=rss_environment,The Age,https://static.ffx.io/images/$zoom_0.3531%2C$multiply_0.7554%2C$ratio_1.777778%2C$width_1059%2C$x_0%2C$y_0/t_crop_custom/q_86%2Cf_auto/8f6b088737eec2553d5d4c4b65138cbe9847ebb5,general,en,au,2024-06-27T01:47:19+00:00,politics
Caitlin Fitzsimmons,Political fight sparks as electricity network axes timber power poles,"Essential Energy, the electricity distributor that covers 95 per cent of NSW, is switching to composite poles to make its network more resilient in bushfires.",https://www.watoday.com.au/environment/sustainability/political-fight-sparks-as-electricity-network-axes-timber-power-poles-20240626-p5jp08.html?ref=rss&utm_medium=rss&utm_source=rss_feed,watoday,https://static.ffx.io/images/$zoom_0.3531%2C$multiply_0.7554%2C$ratio_1.777778%2C$width_1059%2C$x_0%2C$y_0/t_crop_custom/q_86%2Cf_auto/8f6b088737eec2553d5d4c4b65138cbe9847ebb5,general,en,au,2024-06-27T01:47:19+00:00,politics
Caitlin Fitzsimmons,Political fight sparks as electricity network axes timber power poles,"Essential Energy, the electricity distributor that covers 95 per cent of NSW, is switching to composite poles to make its network more resilient in bushfires.",https://www.brisbanetimes.com.au/environment/sustainability/political-fight-sparks-as-electricity-network-axes-timber-power-poles-20240626-p5jp08.html?ref=rss&utm_medium=rss&utm_source=rss_feed,Brisbane Times,https://static.ffx.io/images/$zoom_0.3531%2C$multiply_0.7554%2C$ratio_1.777778%2C$width_1059%2C$x_0%2C$y_0/t_crop_custom/q_86%2Cf_auto/8f6b088737eec2553d5d4c4b65138cbe9847ebb5,general,en,au,2024-06-27T01:47:19+00:00,politics
Caitlin Fitzsimmons,Political fight sparks as electricity network axes timber power poles,"Essential Energy, the electricity distributor that covers 95 per cent of NSW, is switching to composite poles to make its network more resilient in bushfires.",https://www.theage.com.au/environment/sustainability/political-fight-sparks-as-electricity-network-axes-timber-power-poles-20240626-p5jp08.html?ref=rss&utm_medium=rss&utm_source=rss_feed,The Age,https://static.ffx.io/images/$zoom_0.3531%2C$multiply_0.7554%2C$ratio_1.777778%2C$width_1059%2C$x_0%2C$y_0/t_crop_custom/q_86%2Cf_auto/8f6b088737eec2553d5d4c4b65138cbe9847ebb5,general,en,au,2024-06-27T01:47:19+00:00,politics
Caitlin Fitzsimmons,Political fight sparks as electricity network axes timber power poles,"Essential Energy, the electricity distributor that covers 95 per cent of NSW, is switching to composite poles to make its network more resilient in bushfires.",https://www.brisbanetimes.com.au/environment/sustainability/political-fight-sparks-as-electricity-network-axes-timber-power-poles-20240626-p5jp08.html?ref=rss&utm_medium=rss&utm_source=rss_environment,brisbanetimes,https://static.ffx.io/images/$zoom_0.3531%2C$multiply_0.7554%2C$ratio_1.777778%2C$width_1059%2C$x_0%2C$y_0/t_crop_custom/q_86%2Cf_auto/8f6b088737eec2553d5d4c4b65138cbe9847ebb5,general,en,au,2024-06-27T01:47:19+00:00,politics
Caitlin Fitzsimmons,Political fight sparks as electricity network axes timber power poles,"Essential Energy, the electricity distributor that covers 95 per cent of NSW, is switching to composite poles to make its network more resilient in bushfires.",https://www.watoday.com.au/environment/sustainability/political-fight-sparks-as-electricity-network-axes-timber-power-poles-20240626-p5jp08.html?ref=rss&utm_medium=rss&utm_source=rss_environment,watoday,https://static.ffx.io/images/$zoom_0.3531%2C$multiply_0.7554%2C$ratio_1.777778%2C$width_1059%2C$x_0%2C$y_0/t_crop_custom/q_86%2Cf_auto/8f6b088737eec2553d5d4c4b65138cbe9847ebb5,general,en,au,2024-06-27T01:47:19+00:00,politics
Associated Press,"Women's rights will be raised at the UN meeting being attended by Taliban, UN official says","The U.N. political chief who will chair the first meeting between Afghanistan’s Taliban rulers and envoys from about 25 countries answered sharp criticism that Afghan women have been excluded, saying Wednesday that women’s rights will be raised at every session. Undersecretary-General Rosemary DiCarlo stressed to a small group of reporters that the two-day meeting starting Sunday is an initial engagement aimed at initiating a step-by-step process with the goal of seeing the Taliban “at peace with itself and its neighbors and adhering to international law,” the U.N. Charter, and human...",https://ca.news.yahoo.com/womens-rights-raised-un-meeting-014323817.html,sports,,general,en,us,2024-06-27T01:43:23+00:00,politics
Associated Press,"North Carolina party recognition for groups seeking RFK Jr., West on ballot stopped for now","Associated Press RALEIGH, N.C. (AP) — A divided North Carolina election board has blocked for now the official party recognition of political groups that collected signatures and want Robert F. Kennedy Jr. and Cornel West on this fall’s presidential ballot. The We The People party and Justice for All Party of North Carolina initiated petitionThe post North Carolina party recognition for groups seeking RFK Jr., West on ballot stopped for now appeared first on KION546.",https://kion546.com/news/2024/06/26/north-carolina-party-recognition-for-groups-seeking-rfk-jr-west-on-ballot-stopped-for-now/,kionrightnow,,general,en,us,2024-06-27T01:39:25+00:00,politics
Greg Barns,How a rainbow coalition of Australian politicians came together to push for Julian Assange’s freedom | Greg Barns,"After bleak beginnings, our campaign united a formidable group of parliamentarians from across the political spectrumIn late 2012 I had a call from John Shipton, Julian Assange’s father. I had done some advocacy on the Assange case for the Australian Lawyers Alliance. John wanted to know if I would run Julian’s bid to be elected to the Senate in the 2013 federal election. From that time on I have worked with John, Julian’s brother, Gabriel Shipton, the lawyer Steve Kenny and others to help bring an end to the US pursuit of Assange for publishing material which clearly implicated that...",https://www.theguardian.com/commentisfree/article/2024/jun/27/julian-assange-freedom-push-australian-mps-politicians,The Guardian,https://i.guim.co.uk/img/media/77927338880f48170fc11274b0070ef1a9f09518/0_81_3900_2340/master/3900.jpg?width=140&quality=85&auto=format&fit=max&s=fd9e8718f381ff3cf850d2c7dab84ed8,politics,en,au,2024-06-27T01:31:34+00:00,politics
,Who is Bolivia's President Luis Arce? Former economist survives coup attempt,"(marketscreener.com) Bolivian President Luis Arce, a mild-mannered and bespectacled former economy minister, faced down a coup attempt on Wednesday, as the armed forces withdrew after occupying the central square in La Paz and entering the presidential palace. Arce, 60, won election in 2020 after a period of deep political turmoil. A ballot the year...https://www.marketscreener.com/quote/commodity/CRB-COMMODITY-INDEX-16179/news/Who-is-Bolivia-s-President-Luis-Arce-Former-economist-survives-coup-attempt-47251922/?utm_medium=RSS&utm_content=20240626",https://www.marketscreener.com/quote/commodity/CRB-COMMODITY-INDEX-16179/news/Who-is-Bolivia-s-President-Luis-Arce-Former-economist-survives-coup-attempt-47251922/?utm_medium=RSS&utm_content=20240626,4-traders,,general,en,us,2024-06-27T01:23:13+00:00,politics
Rachel Withers,What’s the deal with Dai Le?,The Fowler MP’s politics leave many scratching their heads. But she represents a warning to the ALP not to take its working-class heartland for granted.The post What’s the deal with Dai Le? appeared first on Crikey.,https://www.crikey.com.au/2024/06/27/whats-the-deal-with-dai-le/,crikey,,general,en,au,2024-06-27T01:02:56+00:00,politics
BeauHD,"Crypto Industry Super PAC Is 33-2 In Primaries, With $100 Million For House and Senate Races","A super PAC called Fairshake, funded primarily by top cryptocurrency companies, achieved several wins in congressional primaries and plans to spend over $100 million to support pro-crypto candidates in the general elections. CNBC reports: Fairshake and its two affiliated political action committees, one for Republicans, one for Democrats, quietly racked up half a dozen other wins Tuesday as the candidates they backed glided to victory, although none of the races were competitive. They included Rep. John Curtis, who won the Republican nomination for Utah's open Senate seat. Created last year as...",https://slashdot.org/story/24/06/26/2215259/crypto-industry-super-pac-is-33-2-in-primaries-with-100-million-for-house-and-senate-races?utm_source=rss1.0mainlinkanon&utm_medium=feed,slashdot,,general,en,us,2024-06-27T00:50:00+00:00,politics
Marc H. Morial,Project 2025 is Trump's blueprint to get rid of democracy and the rule of law,"The presidential election still is four months away, the major parties have not officially nominated their candidates, and the first debate has yet to take place.But preparations already are underway for a second Donald Trump presidency, and they should alarm every American, of every political persuasion, who is concerned about preserving democracy and the rule of law. An extremist, dark money “slime machine” is preparing a list of federal civil servants deemed disloyal to Trump, who could be reclassified, reassigned or fired if he takes office, The Associated Press reports.The chilling...",https://chicago.suntimes.com/columnists/2024/06/26/project-2025-donald-trump-civil-service-heritage-foundation-viktor-orban-democracy-marc-morial-column,suntimes,,general,en,us,2024-06-27T00:32:09+00:00,politics
Craig Kapitan,Former Green MP Golriz Ghahraman to learn fate after $9000 shoplift spree,"Once one of the Green Party's brightest stars, her political career is now in tatters.",https://www.nzherald.co.nz/nz/crime/former-green-mp-golriz-ghahraman-to-learn-fate-after-9000-shoplift-spree/HWFXCM3VZVBL5PBW7LED63KDKE/,NZ Herald,https://www.nzherald.co.nz/resizer/v2/HSNI6ZVKENFO7CM5K5QCGV2RWM.jpg?width=300&height=300&auth=deec397c2fa9b62eae4a55afcb5ad085395ad78b53fde2a7a6641cf92bb50fea&smart=true,general,en,nz,2024-06-27T00:28:44+00:00,politics
,Putin And Kim: A New World Order? – OpEd,"The recent meeting of Vladimir Putin and Kim Jong Un in North Korea marks a new stage not only in their alliance but in their ideological convergence. This is no mere marriage of convenience. The two leaders have become so much closer in their political and economic sympathies over the last two decades that they now qualify as a compatible couple.In this most recent meeting, Putin’s first trip to North Korea in 24 years, the two leaders acted very much like two spurned lovers in a rebound relationship. Putin has turned his back on the West and sees his political and economic fortunes in the...",https://api.follow.it/track-rss-story-click/v3/Qw9d99ManWeZzf4DpReoTIIAmcWJ0TmB,eurasiareview,,general,en,us,2024-06-27T00:19:14+00:00,politics
AP News,How tensions in Bolivia fueled an attempt to oust President Arce from power,"Armored vehicles rammed into the doors of Bolivia’s government palace as President Luis Arce said his country faced an apparent attempted coup. The uprising was, in a sense, the culmination of tensions that have been brewing in Bolivia for months with protesters streaming into the nation’s capital amid a growing economic crisis and as two political titans battle for control of the ruling party. At the same time, the apparent attempted coup appeared to have lacked any meaningful support. Even Arce’s rivals quickly closed ranks to defend democracy and repudiate the uprising.",https://www.mymotherlode.com/news/latin/3382067/how-tensions-in-bolivia-fueled-an-attempt-to-oust-president-arce-from-power.html,mymotherlode,,general,en,us,2024-06-27T00:11:59+00:00,politics
Debra J. Saunders,SAUNDERS: What does science have to do with transgender politics? Nothing,A Biden administration health official urged a world panel to drop age guidelines for transgender surgeries for minors. Credit ideology and politics.,https://www.reviewjournal.com/opinion/opinion-columns/debra-saunders/saunders-what-does-science-have-to-do-with-transgender-politics-nothing-3075694/,lvrj,,general,en,us,2024-06-26T23:31:14+00:00,politics
Adeyinka Salami,"How National Lottery Trust Fund Chief, Maigari Remains Winner by Betting on Tinubu","In democracies all over the world, there are political figures who stake their all to make electoral victory possible, writes Wada Musa The victory of Bola Tinubu in the 2023",https://www.thisdaylive.com/index.php/2024/06/27/how-national-lottery-trust-fund-chief-maigari-remains-winner-by-betting-on-tinubu/,thisdaylive,,general,en,us,2024-06-26T23:28:00+00:00,politics
Betsey Piette,On the ‘rift’ between Biden and Netanyahu,Much is being made of the “rift” or “break” between the U.S. President Joe Biden and Israeli Prime Minister Benjamin Netanyahu over tactics on the “war” against Palestine. Both face serious political fights in their own countries to remain in office. Both face growing opposition and demonstrations by the masses . . .Continue reading On the ‘rift’ between Biden and Netanyahu at Workers.org,https://www.workers.org/2024/06/79382/?utm_source=rss&utm_medium=rss&utm_campaign=on-the-rift-between-biden-and-netanyahu,workers,,general,en,us,2024-06-26T23:18:59+00:00,politics
