author,title,description,url,source,image,category,language,country,published_at,topic
Katharina Buczek,"A New Survey Revealed 78% Of Dating App Users Are Burnt Out, With Gen Zers Feeling The Most Exhaustion","We&#8217;ve heard of feeling burnt out from work, personal relationships, and even social media. But is it possible to get burnt out from endlessly swiping on dating apps? According to a new survey commissioned by Forbes Health and conducted by OnePoll, the answer is a resounding yes. The survey included 1,000 Americans who&#8217;ve used a [&#8230;]",https://www.chipchick.com/2024/06/a-new-survey-revealed-78-of-dating-app-users-are-burnt-out-with-gen-zers-feeling-the-most-exhaustion.html,chipchick,,general,en,us,2024-06-26T23:05:00+00:00,health
Yahoo Life UK,"The products you should never pay full price for, from toothpaste to deodorant",A new investigation by consumer champion Which? reveals price variations in some of the most popular health products.,https://uk.style.yahoo.com/health-products-consumer-shopping-which-230116142.html,sports,,general,en,us,2024-06-26T23:01:16+00:00,health
,Urgent nationwide health warning over 'mushroom' lollies linked to terrifying hallucinations which has put five people in hospital,"Five people are in hospital after eating toxic mushroom gummies, with some patients experiencing hallucinations.",https://www.dailymail.co.uk/news/article-13573657/Urgent-nationwide-health-warning-mushroom-lollies-linked-terrifying-hallucinations-five-people-hospital.html?ns_mchannel=rss&ns_campaign=1490&ito=1490,Mail,https://i.dailymail.co.uk/1s/2024/06/26/23/86620347-0-image-a-23_1719440805065.jpg,general,en,gb,2024-06-26T22:56:11+00:00,health
Lisa Schencker,Former Outcome Health CEO Rishi Shah sentenced to 7.5 years in prison for role in fraud,The sentencing came about 14 months after a jury found Rishi Shah and two other former Outcome leaders guilty of fraud.,https://www.chicagotribune.com/2024/06/26/former-outcome-ceo-rishi-shah-sentencing/,Chicago Tribune,https://www.chicagotribune.com/wp-content/uploads/2024/06/CTC-L-shah-outcome-sentencing05_198708532.jpg?w=1400px&strip=all,general,en,us,2024-06-26T22:43:05+00:00,health
CNN Newsource,Remembering DeAndre Jones: A Call for Mental Health Awareness,"By Francis Page, Jr. Click here for updates on this story &#160;&#160;&#160;&#160;June 26, 2024 (Houston Style Magazine) &#8212; In a heartbreaking announcement, legendary boxing champion Roy Jones Jr. shared that his son, DeAndre Jones, tragically passed away by suicide on Saturday at the age of 32. This devastating news has prompted Jones to emphasize theThe post Remembering DeAndre Jones: A Call for Mental Health Awareness appeared first on KESQ.",https://kesq.com/cnn-regional/2024/06/26/remembering-deandre-jones-a-call-for-mental-health-awareness/,kesq,,general,en,us,2024-06-26T22:41:00+00:00,health
Sajid Salamat,Fittest countries worldwide revealed in a new study,"With the climbing season underway, trekking experts at MagicalNepal.com have analysed global health data to find the fittest countries. The study analysed 11 factors that contribute to a person&#8217;s overall fitness and ability to take on challenges that push the body to its limits. These range from life expectancy and alcohol consumption to disease, death [&#8230;]",https://dailytimes.com.pk/1204299/fittest-countries-worldwide-revealed-in-a-new-study/,Daily Times,,general,en,pk,2024-06-26T22:33:21+00:00,health
Sajid Salamat,Nausheen Shah nearly wipes Instagram profile hours after requesting prayers,"Film and TV actor Nausheen Shah deleted all but only a few of her Instagram posts, hours after she requested prayers from her fans. Actor Nausheen Shah turned to her Instagram stories on Tuesday evening, asking her followers to pray for her as she has been struggling with her mental health and going through anxiety [&#8230;]",https://dailytimes.com.pk/1204298/nausheen-shah-nearly-wipes-instagram-profile-hours-after-requesting-prayers/,Daily Times,,general,en,pk,2024-06-26T22:33:12+00:00,health
Fort Worth Weekly,HelpCare Plus: Changing the Mental Health Landscape,"Access to quality healthcare, especially mental health services, can be challenging. In Fort Worth, TX, HelpCare Plus is changing the landscape by offering a telecounseling app at a discounted rate. This service aims to make mental health support accessible and affordable, providing a significant advantage to the local community. &#160; The Growing Need for Telecounseling Mental [&#8230;]The post HelpCare Plus: Changing the Mental Health Landscape appeared first on Fort Worth Weekly.",https://www.fwweekly.com/2024/06/26/helpcare-plus-changing-the-mental-health-landscape/,fwweekly,,general,en,us,2024-06-26T22:09:30+00:00,health
Haxtun Health,Dr. Dana Morgan comes to Haxtun Health,"Haxtun Health is welcoming a new doctor. Dana Morgan, MD, has over 30 years of experience as a primary care physician. She began her training in Microbiology at the University of Montana in 1983 and once she earned her bachelor’s she headed west to the University of Washington in Seattle, earning her Doctor of Medicine [&#8230;]",https://www.journal-advocate.com/2024/06/26/dr-dana-morgan-comes-to-haxtun-health/,journal-advocate,https://www.journal-advocate.com/wp-content/uploads/2024/06/STJ-L-DanaMorgan.jpg?w=1400px&strip=all,general,en,us,2024-06-26T22:09:00+00:00,health
,What is POTS? Christina Applegate's daughter reveals diagnosis of nervous system condition,"Christina Applegate's 13-year-old daughter, Sadie, reveals that she's dealing with health issues of her own: an autonomic nervous system condition known as POTS.",https://www.latimes.com/entertainment-arts/story/2024-06-26/christina-applegate-daughter-sadie-grace-pots-diagnosis,latimes,,general,en,us,2024-06-26T22:06:32+00:00,health
Ken Hashizume,Hospital partners with U of G on health-care delivery and education in Guelph,An MOU was signed on Friday intended to position the university and the hospital for the challenges that are impacting the health of the community.,https://globalnews.ca/news/10589389/hospital-partners-university-of-guelph-health-care-delivery-education/,globallethbridge,https://globalnews.ca/wp-content/uploads/2024/06/U-of-G-GGH-Partnership.jpg?quality=85&strip=all&w=700&h=365&crop=1,general,en,us,2024-06-26T22:00:51+00:00,health
wclonews,Domestic pets could fall victim to H5N1,Local veterinarians are keeping a close eye on the bird flu after the U.S. Department of Agriculture reports that 21 cats in nine states have tested positive. Rock County Public Health Supervisor Kelsey Cordova says fortunately H5N1,https://www.wclo.com/2024/06/26/domestic-pets-could-fall-victim-to-h5n1/,wclo,https://dehayf5mhw1h7.cloudfront.net/wp-content/uploads/sites/446/2024/06/26130311/H5N1.jpg,general,en,us,2024-06-26T22:00:19+00:00,health
Colleen Parette,Senior Health and Safety Fair Promotes Aging Well,The City of Cornwall&#8217;s Senior Friendly Community Committee hosted the second Aging Well: Senior Health and Safety Fair on June 19th at the Benson Center. The event was free and…L’article Senior Health and Safety Fair Promotes Aging Well est apparu en premier sur Cornwall Seaway News.,https://www.cornwallseawaynews.com/local/senior-health-and-safety-fair-promotes-aging-well/,cornwallseawaynews,,general,en,us,2024-06-26T22:00:18+00:00,health
Airman 1st Class Stassney Davis,Fairchild honors those who lost their lives in B-52 crash with 30th anniversary commemoration ceremony [Image 1 of 6],"Airman 1st Class Yeo Lee, a health administrative support technician assigned to 92nd Medical Group, sings the national anthem during a commemoration ceremony at Fairchild Air Force Base, Washington, June 24, 2024. On June 24, 1994, a B-52H Stratofortress, callsign “CZAR 52,” crashed while practicing maneuvers for an airshow. The crash claimed the lives of Col. Robert Wolff, Lt. Col. Mark McGeehan, Lt. Col. Kenneth Huston and Lt. Col. Arthur “Bud” Holland. The 92nd Air Refueling Wing leadership team hosted the victims’ family members to commemorate the 30th anniversary of the crash. (...",https://www.dvidshub.net/image/8501078/fairchild-honors-those-who-lost-their-lives-b-52-crash-with-30th-anniversary-commemoration-ceremony,dvidshub,https://d1ldvf68ux039x.cloudfront.net/thumbs/photos/2406/8501078/250w_q95.jpg,general,en,us,2024-06-26T21:57:20+00:00,health
,Health Care Down as Moderna Slides -- Health Care Roundup,"(marketscreener.com) Health-care companies ticked down after a poor showing from one hotly anticipated vaccine candidate. Moderna shares slid after the biotech company said its respiratory syncytial virus, or RSV, shot showed 50% efficacy in preventing the illness after 18 months. Merck shares slipped ahead of a Food and Drug Administration ruling on...https://www.marketscreener.com/quote/stock/MODERNA-INC-47437573/news/Health-Care-Down-as-Moderna-Slides-Health-Care-Roundup-47251298/?utm_medium=RSS&utm_content=20240626",https://www.marketscreener.com/quote/stock/MODERNA-INC-47437573/news/Health-Care-Down-as-Moderna-Slides-Health-Care-Roundup-47251298/?utm_medium=RSS&utm_content=20240626,4-traders,,general,en,us,2024-06-26T21:49:34+00:00,health
Ian Millhiser,"The Supreme Court’s newly leaked abortion decision, explained","TOPSHOT - Reproductive rights activists demonstrate in front of the Supreme Court in Washington, DC, on June 24, 2024. (Photo by Jim WATSON / AFP) (Photo by JIM WATSON/AFP via Getty Images)For the second time in two years, a major Supreme Court abortion decision leaked before the justices officially released it. This time, however, the most likely explanation is a clerical error by someone who manages the Court’s website.Two years ago, an early draft of Justice Samuel Alito’s opinion in Dobbs v. Jackson Women’s Health Organization, the case overruling Roe v. Wade, leaked to the press. The...",https://www.vox.com/scotus/357302/supreme-court-leaked-abortion-moyle-united-states,VOX,,general,en,gi,2024-06-26T21:45:03+00:00,health
CNN Newsource,Mistakenly posted Supreme Court document indicates pregnant people in Idaho should have access to emergency care – for now,"By Jen Christensen, CNN (CNN) &#8212; A document that was mistakenly posted on the US Supreme Court website Wednesday indicates that the court may allow abortions in medical emergencies in Idaho, at least temporarily. The state would not be allowed to deny an emergency abortion to a pregnant person whose health is in danger, atThe post Mistakenly posted Supreme Court document indicates pregnant people in Idaho should have access to emergency care – for now appeared first on News Channel 3-12.",https://keyt.com/health/cnn-health/2024/06/26/mistakenly-posted-supreme-court-document-indicates-pregnant-people-in-idaho-should-have-access-to-emergency-care-for-now/,keyt,,general,en,us,2024-06-26T21:20:04+00:00,health
Associated Press,California dad who drove family off cliff will get mental health treatment instead of trial,A California radiologist accused of trying to kill his family by driving off a cliff along the Northern California coast will receiveThe post California dad who drove family off cliff will get mental health treatment instead of trial appeared first on The Business Journal.,https://thebusinessjournal.com/california-dad-who-drove-family-off-cliff-will-get-mental-health-treatment-instead-of-trial/?utm_source=rss&utm_medium=rss&utm_campaign=california-dad-who-drove-family-off-cliff-will-get-mental-health-treatment-instead-of-trial,thebusinessjournal,,general,en,us,2024-06-26T21:16:43+00:00,health
MIKE STOBBE AP Medical Writer,US health officials strengthen endorsement of RSV shots for oldest Americans,"U.S. health officials on Wednesday made a stronger endorsement for RSV vaccinations for people 75 and older, but offered aThe post US health officials strengthen endorsement of RSV shots for oldest Americans appeared first on The Business Journal.",https://thebusinessjournal.com/us-health-officials-strengthen-endorsement-of-rsv-shots-for-oldest-americans/?utm_source=rss&utm_medium=rss&utm_campaign=us-health-officials-strengthen-endorsement-of-rsv-shots-for-oldest-americans,thebusinessjournal,,general,en,us,2024-06-26T21:12:25+00:00,health
AP News,California dad who drove family off cliff will get mental health treatment instead of trial,"A California radiologist accused of trying to kill his wife and two children when he drove his Tesla off a cliff along the Northern California coast will receive mental health treatment instead of standing trial. A San Mateo County judge has ruled Dharmesh Patel will have to complete a two-year mental health outpatient treatment program at a Bay Area hospital for the charges to be dropped. Prosecutors charged Patel, of Pasadena, with attempted murder after the car he was driving plunged off a 250-foot (76 meters) cliff along the Pacific Coast Highway in San Mateo County, injuring his family.  ...",https://www.mymotherlode.com/news/state/3381954/california-dad-who-drove-family-off-cliff-will-get-mental-health-treatment-instead-of-trial.html,mymotherlode,,general,en,us,2024-06-26T21:11:38+00:00,health
The Associated Press,California dad who drove family off cliff will get mental health treatment instead of trial,"REDWOOD CITY, Calif. (AP) &#8212; A California radiologist accused of trying to kill his family by driving off a cliff along the Northern California coast will receive mental health treatment instead of standing trial, a judge ruled. Prosecutors charged Dharmesh A. Patel, 43, with attempted murder after the Tesla he was driving plunged off a [&#8230;]",https://nationalpost.com/pmn/news-pmn/california-dad-who-drove-family-off-cliff-will-get-mental-health-treatment-instead-of-trial,nationalpost,,general,en,us,2024-06-26T21:09:27+00:00,health
Associated Press,US health officials strengthen endorsement of RSV shots for oldest Americans,AP Medical Writer NEW YORK (AP) — Federal health officials are strengthening their endorsement of RSV vaccinations for people 75 and older. But they also made a narrower recommendation for people 60 to 74. The director of the Centers for Disease Control and Prevention on Wednesday accepted the recommendations from a committee of outside advisersThe post US health officials strengthen endorsement of RSV shots for oldest Americans appeared first on KION546.,https://kion546.com/news/2024/06/26/us-health-officials-strengthen-endorsement-of-rsv-shots-for-oldest-americans/,kionrightnow,,general,en,us,2024-06-26T21:06:30+00:00,health
associatedpress,California dad who drove family off cliff will get mental health treatment instead of trial,"REDWOOD CITY, Calif. (AP) — A California radiologist accused of trying to kill his family by driving off a cliff along the Northern California coast will receive mental health treatment instead of standing trial, a judge ruled. Prosecutors charged Dharmesh A. Patel, 43, with attempted murder after the Tesla he was driving plunged off aThe post California dad who drove family off cliff will get mental health treatment instead of trial appeared first on News Channel 3-12.",https://keyt.com/news/2024/06/26/california-dad-who-drove-family-off-cliff-will-get-mental-health-treatment-instead-of-trial/,keyt,,general,en,us,2024-06-26T21:02:34+00:00,health
Sage Alexander,"Report: Humboldt County behavioral health teams critical, need stable funding","There are two street outreach programs in Humboldt County that work with people with significant behavioral health issues. These teams, each staffed by law enforcement and outreach workers, are the subject of the latest Humboldt County Civil Grand Jury report released Tuesday. The report found proactive outreach is essential, but the teams need more stable funding sources.",https://www.times-standard.com/2024/06/26/report-humboldt-county-behavioral-health-teams-critical-need-stable-funding/,times-standard,https://www.times-standard.com/wp-content/uploads/migration/2017/201704/NEWS_170409856_AR_0_KZJXBWNZUUJP.jpg?w=1400px&strip=all,general,en,us,2024-06-26T21:02:07+00:00,health
,Haleon sells off nicotine brands for £500m as it trims down its consumer health portfolio,"Indian firm Dr Reddy's is taking on products including Nicotinell, Habitrol and Thrive, which are sold in 30 markets around the world",https://www.dailymail.co.uk/money/markets/article-13572639/Haleon-sells-nicotine-brands-500m-trims-consumer-health-portfolio.html?ns_mchannel=rss&ns_campaign=1490&ito=1490,thisismoney,https://i.dailymail.co.uk/1s/2024/06/26/17/86606109-0-image-m-5_1719420219236.jpg,general,en,uk,2024-06-26T21:00:33+00:00,health
Sajid Salamat,NCSW to launch first phase of trans formative consultation,"The National Commission on the Status of Women (NCSW) has launched the first phase of its trans formative consultation conference series, titled ‘The Next Horizon’, aiming to create a comprehensive National Agenda for Women and Girls in Pakistan. The series began with a conference on health ‘Inclusive Healthcare for Women: Paving the Way Forward’, organized [&#8230;]",https://dailytimes.com.pk/1204107/ncsw-to-launch-first-phase-of-trans-formative-consultation/,Daily Times,,general,en,pk,2024-06-26T20:56:19+00:00,health
,"Select Medical Holdings Corporation and Concentra Group Holdings Parent, Inc. Announce Pricing of Offering of $650 Million of 6.875% Senior Notes due 2032 by Concentra Escrow Issuer Corporation","(marketscreener.com) MECHANICSBURG, Pa., June 26, 2024 /PRNewswire/ -- Select Medical Holdings Corporation and Concentra Group Holdings Parent, Inc. , today announced that Concentra Escrow Issuer Corporation , a wholly-owned subsidiary of Concentra Health Services, Inc. , has priced its offering of $650 million aggregate principal amount of 6.875% senior notes due...https://www.marketscreener.com/quote/stock/SELECT-MEDICAL-HOLDINGS-C-5610006/news/Select-Medical-Holdings-Corporation-and-Concentra-Group-Holdings-Parent-Inc-Announce-Pricing-of-Of-47250933/?utm_medium=RSS&utm_content=20240626",https://www.marketscreener.com/quote/stock/SELECT-MEDICAL-HOLDINGS-C-5610006/news/Select-Medical-Holdings-Corporation-and-Concentra-Group-Holdings-Parent-Inc-Announce-Pricing-of-Of-47250933/?utm_medium=RSS&utm_content=20240626,4-traders,,general,en,us,2024-06-26T20:56:07+00:00,health
Sajid Salamat,Action directed against absent doctors at Dir Lower,"Additional Deputy Commissioner (General) Bashir Khan has underlined the need for taking tangible measures to provide best healthcare facilities to people. He expressed these views while chairing a meeting of the District Steering Committee on Health. He said that priority was being given to ensure all medical facilities at hospitals and in this regard, he [&#8230;]",https://dailytimes.com.pk/1204103/action-directed-against-absent-doctors-at-dir-lower/,dailytimes,,general,en,pk,2024-06-26T20:55:51+00:00,health
Bernie Zilio,Francia Raísa reveals reproductive system diagnosis recently ‘took a serious turn’,"""What strikes me the most is that it's not enough that I take care of my health and body,"" the ""How I Met Your Father"" star lamented.",https://pagesix.com/2024/06/26/entertainment/francia-raisa-reveals-diagnosis-took-a-serious-turn/,Post,https://pagesix.com/wp-content%2Fuploads%2Fsites%2F3%2F2024%2F06%2F84517526.jpg?quality%3D90%26strip%3Dall,general,en,zm,2024-06-26T20:41:21+00:00,health
Reuters,"US banks suffer steeper losses, but retain large cushions in annual Fed health check","US banks suffer steeper losses, but retain large cushions in annual Fed health check",https://www.investing.com/news/stock-market-news/us-banks-suffer-steeper-losses-but-retain-large-cushions-in-annual-fed-health-check-3498324,Investing.com | Stock Market Quotes &amp; Financial News,https://i-invdn-com.investing.com/trkd-images/LYNXMPEK5P0TO_L.jpg,business,en,us,2024-06-26T20:36:28+00:00,health
Grace Ptak,"Boulder County youth-led grantmaking program distributes $41,100 in grants to local nonprofits","Community Foundation Boulder County’s youth-led grantmaking program, 15 Forever, recently distributed a record-breaking $41,100 in grants to six nonprofits working to support youth mental health in Boulder County.",https://www.dailycamera.com/2024/06/26/boulder-county-youth-led-grantmaking-program-distributes-41100-in-grants-to-local-nonprofits/,dailycamera,https://www.dailycamera.com/wp-content/uploads/2024/06/Capture.jpg?w=1400px&strip=all,general,en,us,2024-06-26T20:33:13+00:00,health
Bekah McClelland,Capital Area Behavioral Health CEO Scott Suhring stresses vital role of mental health care amid pandemic challenges,"Scott Suhring, 65, is the chief executive officer of the Capital Area Behavioral Health Collaborative, Inc., a jointly owned nonprofit company that administers behavioral healthcare contracts for its five member counties.The post Capital Area Behavioral Health CEO Scott Suhring stresses vital role of mental health care amid pandemic challenges appeared first on Central Penn Business Journal.",https://www.cpbj.com/capital-area-behavioral-health-ceo-scott-suhring-stresses-vital-role-of-mental-health-care-amid-pandemic-challenges/,centralpennbusiness,,general,en,us,2024-06-26T20:30:34+00:00,health
,Clover Health regains compliance with Nasdaq minimum bid price requirement,Clover Health regains compliance with Nasdaq minimum bid price requirement,https://seekingalpha.com/news/4119809-clover-health-regains-compliance-with-nasdaq-minimum-bid-price-requirement?utm_source=feed_news_all&utm_medium=referral&feed_item_type=news,Seeking Alpha,,business,en,us,2024-06-26T20:25:40+00:00,health
Melanie Gilbert,Rynne Beach closed due to high bacteria levels,LOWELL — The Board of Health closed Rynne Beach on Tuesday due to “high bacteria levels in the water.”,https://www.lowellsun.com/2024/06/26/rynne-beach-closed-due-to-high-bacteria-levels/,Lowell Sun,https://www.lowellsun.com/wp-content/uploads/2024/06/LOW-L-RynneBeach-062624-01.jpg?w=1400px&strip=all,general,en,us,2024-06-26T20:17:31+00:00,health
,Corinne Foxx says dad Jamie Foxx has his hands all over her wedding planning,"Corinne Foxx says dad Jamie Foxx is getting plenty of exercise and 'doing amazing' more than a year after his health scare, the details of which remain private.",https://www.latimes.com/entertainment-arts/tv/story/2024-06-26/jamie-foxx-corinne-foxx-health-wedding-update,latimes,,general,en,us,2024-06-26T20:12:34+00:00,health
Ken Warren,No swimming advisory at local beaches,"Ottawa Public Health issued a &#8220;swimming not recommended&#8221; advisory for Britannia Beach, Petrie East Bay and Petrie River Wednesday due to elevated E. coli counts. All three beaches exceeded 200 ecoli per 100 millilitres of water, which is the provincial standard for issuing such an alert. When those numbers are exceeded, swimmers are at increased [&#8230;]",https://ottawacitizen.com/news/local-news/no-swimming-advisory-at-local-beaches,ottawacitizen,,general,en,us,2024-06-26T20:12:14+00:00,health
Kyle Wiggers,Sonia’s AI chatbot steps in for therapists,"Can chatbots replace human therapists? Some startups &#8212; and patients &#8212; claim that they can. But it&#8217;s not exactly settled science. One study found that 80% of people who&#8217;ve used OpenAI&#8217;s ChatGPT for mental health advice consider it a good alternative to regular therapy, while a separate report found that chatbots can be effective in [&#8230;]© 2024 TechCrunch. All rights reserved. For personal use only.",https://techcrunch.com/2024/06/26/sonias-ai-chatbot-steps-in-for-therapists/,TechCrunch,,technology,en,us,2024-06-26T20:12:12+00:00,health
,"Elevance Health to Hold Conference Call and Webcast to Discuss Second Quarter 2024 Results on July 17, 2024","(marketscreener.com) Elevance Health will release second quarter 2024 financial results on July 17, 2024, at 6:00 a.m. Eastern Daylight Time . Management will review these results and its outlook during a conference call at 8:30 a.m. EDT that same morning. The conference call should be accessed at least 15 minutes prior to its start with the following...https://www.marketscreener.com/quote/stock/ELEVANCE-HEALTH-INC-18740543/news/Elevance-Health-to-Hold-Conference-Call-and-Webcast-to-Discuss-Second-Quarter-2024-Results-on-July-1-47250592/?utm_medium=RSS&utm_content=20240626",https://www.marketscreener.com/quote/stock/ELEVANCE-HEALTH-INC-18740543/news/Elevance-Health-to-Hold-Conference-Call-and-Webcast-to-Discuss-Second-Quarter-2024-Results-on-July-1-47250592/?utm_medium=RSS&utm_content=20240626,4-traders,,general,en,us,2024-06-26T20:06:07+00:00,health
Erinn Callahan,Willie Nelson Fans Flood Social Media With Well Wishes as Country Legend Cancels Another Show for Health Reasons,"Willie Nelson has been one of the most beloved (and prolific) names in country music for the better part of a century. The 91-year-old Texan recently released his 75th studio album of original material in May. So naturally, the country legend sparked some online concern among fans when health issues forced him to cancel the [&#8230;]The post Willie Nelson Fans Flood Social Media With Well Wishes as Country Legend Cancels Another Show for Health Reasons appeared first on American Songwriter.",https://americansongwriter.com/willie-nelson-fans-flood-social-media-with-well-wishes-as-country-legend-cancels-another-show-for-health-reasons/,americansongwriter,https://americansongwriter.com/wp-content/uploads/2024/06/Willie-Nelson-and-Lukas-Nelson.jpg?fit=662%2C265,general,en,us,2024-06-26T20:04:23+00:00,health
