author,title,description,url,source,image,category,language,country,published_at,topic
Business Matters,"UK’s Energy Security at Risk Due to Political Policies, Warns Serica Energy","Serica Energy criticises UK government policies and opposition, citing windfall taxes and political instability as major threats to the offshore oil industry and energy security.Read more: UK&#8217;s Energy Security at Risk Due to Political Policies, Warns Serica Energy",https://bmmagazine.co.uk/news/uks-energy-security-at-risk-due-to-political-policies-warns-serica-energy/,Business Matters | The Uk's Leading Sme Business Magazine,,business,en,gb,2024-06-28T06:42:16+00:00,politics
CNN Newsource,Biden’s disastrous debate pitches his reelection bid into crisis,"Analysis by Stephen Collinson, CNN (CNN) &#8212; If Joe Biden loses November’s election, history will record that it took just 10 minutes to destroy a presidency. It was clear a political disaster was about to unfold as soon as the 81-year-old commander in chief stiffly shuffled on stage in Atlanta to stand eight feet fromThe post Biden’s disastrous debate pitches his reelection bid into crisis appeared first on KION546.",https://kion546.com/cnn-opinion/2024/06/27/bidens-disastrous-debate-pitches-his-reelection-bid-into-crisis/,kionrightnow,,general,en,us,2024-06-28T06:38:02+00:00,politics
The Associated Press,"As political fervor for New Zealand’s Māori resurgence wanes, a new Indigenous holiday comes of age","WELLINGTON, New Zealand (AP) &#8212; When Ngarauru Mako told her family she was calling off Christmas festivities in favor of celebrating Matariki, the Māori new year holiday that&#8217;s experiencing a renaissance in New Zealand, her children didn&#8217;t believe her. &#8220;We grew up with Christmas because it was just what you did, but I realized it [&#8230;]",https://nationalpost.com/pmn/news-pmn/as-political-fervor-for-new-zealands-maori-resurgence-wanes-a-new-indigenous-holiday-comes-of-age,nationalpost,,general,en,us,2024-06-28T06:37:57+00:00,politics
,"CAC 40: Crucial session, limited risk-taking","(marketscreener.com) The Paris Bourse is set to open higher on Friday morning, but without much conviction, with caution prevailing against a backdrop of questions about the pace of inflation and the changing political landscape in France.At around 8:15 a.m., the 'future' contract on the CAC 40 index - July delivery - climbed 14.5 points to 7559 points, signalling a...https://www.marketscreener.com/quote/index/CAC-40-4941/news/CAC-40-Crucial-session-limited-risk-taking-47263499/?utm_medium=RSS&utm_content=20240628",https://www.marketscreener.com/quote/index/CAC-40-4941/news/CAC-40-Crucial-session-limited-risk-taking-47263499/?utm_medium=RSS&utm_content=20240628,4-traders,,general,en,us,2024-06-28T06:32:14+00:00,politics
KBC Digital,Kenyan media mourns veteran journalist Mutegi Njau,"Tributes and condolences from across the media industry are pouring in for veteran journalist Mutegi Njau who passed on Thursday evening. The former editor, political talk show co-host at Citizen TV has been receiving treatment for the last three weeks after suffering a stroke. The news of his passing was announced by the family which [&#8230;]The post Kenyan media mourns veteran journalist Mutegi Njau first appeared on KBC.",https://www.kbc.co.ke/kenyan-media-mourns-veteran-journalist-mutegi-njau/?utm_source=rss&utm_medium=rss&utm_campaign=kenyan-media-mourns-veteran-journalist-mutegi-njau,kbc,,general,en,ke,2024-06-28T06:31:26+00:00,politics
Reuters,Column-Political risk aversion rubs its eyes: Mike Dolan,Column-Political risk aversion rubs its eyes: Mike Dolan,https://www.investing.com/news/economy-news/columnpolitical-risk-aversion-rubs-its-eyes-mike-dolan-3500676,Investing.com | Stock Market Quotes &amp; Financial News,https://i-invdn-com.investing.com/trkd-images/LYNXMPEK5R06T_L.jpg,business,en,us,2024-06-28T06:11:17+00:00,politics
Finian Cunningham,Myanmar’s civil war… will the U.S. escalate a proxy war against China?,"A civil war has been raging for three years, although the nation has always been gripped by inter-ethnic violence since independence in 1948 as a legacy of British colonialist abuse. KJ Noh is a seasoned political analyst and commentator on the Asia-Pacific region. He says the U.S. is already heavily involved in fanning the civil [&#8230;]The post Myanmar’s civil war… will the U.S. escalate a proxy war against China? first appeared on Dissident Voice.",https://dissidentvoice.org/2024/06/myanmars-civil-war-will-the-u-s-escalate-a-proxy-war-against-china/,dissidentvoice,,general,en,us,2024-06-28T06:10:47+00:00,politics
AP News,Biden’s debate performance spurs Democratic panic about his ability to lead party against Trump,"Above all, Joe Biden’s allies have wanted him to demonstrate strength and energy on the debate stage this week to help put to rest questions about the 81-year-old Democrat’s physical and mental acuity. But on the biggest stage in U.S. politics on Thursday night, Biden did not meet their modest expectations. And by the end of the 90-minute affair, the Democratic president’s allies — party strategists and rank-and-file voters alike — panicked about his chances against former President Donald Trump this fall. They cited a debate performance punctuated by repeated stumbles, uncomfortable...",https://www.mymotherlode.com/news/national/general-election/3382954/bidens-debate-performance-spurs-democratic-panic-about-his-ability-to-lead-party-against-trump.html,mymotherlode,,general,en,us,2024-06-28T06:08:53+00:00,politics
Ashmit Kumar,"“Cannot Breathe”: Seth Curry, Josh Hart, & NBA Stars Stunned as 2024 Presidential Debate Turns into Golf Banter","The 2024 US Presidential Election dominated the headlines over the last few hours, as President Joe Biden and former President Donald Trump clashed face-to-face for the first time this year. The two oldest candidates to ever run for the highest political office devoted over one and a half hours to a debate that had them [&#8230;]The post “Cannot Breathe”: Seth Curry, Josh Hart, & NBA Stars Stunned as 2024 Presidential Debate Turns into Golf Banter appeared first on EssentiallySports.",https://www.essentiallysports.com/nba-active-basketball-news-joe-biden-donald-trump-cannot-breathe-seth-curry-josh-hart-and-nba-stars-stunned-as-twenty-twenty-four-presidential-debate-turns-into-golf-banter/,Essentially Sports,https://image-cdn.essentiallysports.com/wp-content/uploads/Untitled-design_20240628_104828_0000-560x315.jpg,sports,en,us,2024-06-28T06:03:09+00:00,politics
AP News,Photo Gallery: Americans watch Trump and Biden in election debate,"HAMILTON, Ohio (AP) — U.S. President Joe Biden and his Republican rival, former President Donald Trump, met for the first general election debate of the 2024 season — a chance for the candidates to try to reshape the political narrative and persuade undecided voters. Thursday’s 90-minute debate was held in Atlanta and hosted by CNN. [&#8230;]",https://www.mymotherlode.com/news/national/general-election/3382942/photo-gallery-americans-watch-trump-and-biden-in-election-debate.html,mymotherlode,,general,en,us,2024-06-28T05:18:37+00:00,politics
,‘LET’S RISE ABOVE PETTY POLITICS’,"EZULWINI &ndash; Minister of Sports, Culture and Youth Affairs Bongani Nzima has identified the need to conduct football in a way that inspires confidence.In his",http://www.times.co.sz/sports/145815-%E2%80%98let%E2%80%99s-rise-above-petty-politics%E2%80%99.html,Times of Swaziland,,general,en,sz,2024-06-28T05:18:00+00:00,politics
AP News,France is facing an election like no other. Here’s how it works and what comes next,"French voters are called to the polls this weekend for an exceptional moment in their political history. Sunday is the first round of snap parliamentary elections that could see the country’s first far-right government since the World War II Nazi occupation — or no majority emerging at all. The second round is on July 7. The outcome of the vote remains highly uncertain. Three major political blocs are competing. They are the far-right National Rally, President Emmanuel Macron’s centrist alliance and a left-wing coalition. The French system is complex and not proportionate to nationwide...",https://www.mymotherlode.com/news/world/3382933/france-is-facing-an-election-like-no-other-heres-how-it-works-and-what-comes-next.html,mymotherlode,,general,en,us,2024-06-28T05:15:02+00:00,politics
Reuters,Analysis-French bond market gets taste of euro zone 'periphery' turmoil,"The recent turmoil in France's bond market could mark a new chapter for the euro zone's wealthiest economies, with emerging political and fiscal risks fuelling volatility earlier associated with its high-debt members such as Greece or Spain. French President Emmanuel Macron's rattled markets with his shock decision on June 9 to call a snap election after his grouping got trounced by far-right parties in European parliamentary elections. French government bond yields are around 3.25%, near their highest level of the year.",https://ca.finance.yahoo.com/news/analysis-french-bond-market-gets-051112090.html,sports,,general,en,us,2024-06-28T05:11:12+00:00,politics
,Analysis-Election and Fed risks loom for US stocks after strong first half of 2024,"(marketscreener.com) As U.S. stocks lock in a solid first half, investors are speculating whether political uncertainty, potential Federal Reserve policy shifts and big tech's market dominance could make the rest of 2024 a tougher slog. The S&amp;P 500 is up 15% year-to-date thanks to strong corporate earnings, a resilient U.S. economy and enthusiasm...https://www.marketscreener.com/quote/stock/NVIDIA-CORPORATION-57355629/news/Analysis-Election-and-Fed-risks-loom-for-US-stocks-after-strong-first-half-of-2024-47262252/?utm_medium=RSS&utm_content=20240628",https://www.marketscreener.com/quote/stock/NVIDIA-CORPORATION-57355629/news/Analysis-Election-and-Fed-risks-loom-for-US-stocks-after-strong-first-half-of-2024-47262252/?utm_medium=RSS&utm_content=20240628,4-traders,,general,en,us,2024-06-28T05:02:41+00:00,politics
,Who won the presidential debate? Experts reveal whether Trump or Biden prevailed after their first 2024 matchup,Democrat and Republican political experts almost all agreed on who clearly ended up on top at the end of the night. DailyMail.com breaks down analysis from top political minds.,https://www.dailymail.co.uk/news/article-13578163/who-won-presidential-debate-trump-biden-2024-matchup.html?ns_mchannel=rss&ito=1490&ns_campaign=1490,dailymail,https://i.dailymail.co.uk/1s/2024/06/28/03/86680663-0-image-a-1_1719543121343.jpg,general,en,us,2024-06-28T04:55:58+00:00,politics
,Who won the presidential debate? Experts reveal whether Trump or Biden prevailed after their first 2024 matchup,Democrat and Republican political experts almost all agreed on who clearly ended up on top at the end of the night. DailyMail.com breaks down analysis from top political minds.,https://www.dailymail.co.uk/news/article-13578163/who-won-presidential-debate-trump-biden-2024-matchup.html?ns_mchannel=rss&ns_campaign=1490&ito=1490,dailymail,https://i.dailymail.co.uk/1s/2024/06/28/03/86680663-0-image-a-1_1719543121343.jpg,general,en,uk,2024-06-28T04:55:58+00:00,politics
,Factbox-Reactions to Joe Biden and Donald Trump's debate performances,"(marketscreener.com) Democratic President Joe Biden and his Republican rival Donald Trump faced off in the first presidential debate of the 2024 race. Below are reactions from lawmakers, political analysts, strategists and leaders of advocacy groups: KAMALA HARRIS, VICE PRESIDENT ""What we saw tonight is the president making a very...https://www.marketscreener.com/news/latest/Factbox-Reactions-to-Joe-Biden-and-Donald-Trump-s-debate-performances--47262113/?utm_medium=RSS&utm_content=20240628",https://www.marketscreener.com/news/latest/Factbox-Reactions-to-Joe-Biden-and-Donald-Trump-s-debate-performances--47262113/?utm_medium=RSS&utm_content=20240628,4-traders,,general,en,us,2024-06-28T04:31:32+00:00,politics
KNEWS,Unprecedented case before the Court,"Dear Editor, A lawyer has filed a petition before the High Court for urgent hearing relating to the PNC/R Congress slated for June 28 to 30. The petitioner threads in an area where virtually no one in Guyana did before – the court’s intervention in the internal affairs of a political party (supposedly a private [&#8230;]The post Unprecedented case before the Court appeared first on Kaieteur News.",https://www.kaieteurnewsonline.com/2024/06/28/unprecedented-case-before-the-court/,Kaieteur News,,general,en,gy,2024-06-28T04:03:08+00:00,politics
,DIARY-Top Economic Events to August 30,"(marketscreener.com) June 28 - For other diaries, please see: Top Economic Events Emerging Markets Economic Events Government Debt Auctions Political and General News U.S. Federal Reserve Today in...https://www.marketscreener.com/news/latest/DIARY-Top-Economic-Events-to-August-30--47262000/?utm_medium=RSS&utm_content=20240628",https://www.marketscreener.com/news/latest/DIARY-Top-Economic-Events-to-August-30--47262000/?utm_medium=RSS&utm_content=20240628,4-traders,,general,en,us,2024-06-28T04:01:01+00:00,politics
Reice Shipley,Viewers questioned why Stephen A. Smith was on NewsNation’s debate coverage,"ESPN personality Stephen A. Smith recently reaffirmed that he is not afraid to openly discuss politics despite the network beginning to shy away from political discussions. And to further reinforce this on Wednesday prior to the first presidential debate between Donald Trump and Joe Biden, Smith appeared on NewsNation alongside host Chris Cuomo and radio Read more...The post Viewers questioned why Stephen A. Smith was on NewsNation&#8217;s debate coverage appeared first on Awful Announcing.",https://awfulannouncing.com/politics/stephen-a-smith-newsnation-presidential-debate.html,awfulannouncing,,general,en,us,2024-06-28T03:39:29+00:00,politics
,Biden's biggest weakness -- his age -- on full display tonight: ANALYSIS,"From the earliest moments of the night, President Joe Biden's biggest political weakness -- his age and perceived frailty -- became a clear liability on the debate stage.",https://abcnews.go.com/538/bidens-biggest-weakness-age-full-display-thursday-debate-analysis/story?id=111500745,ABC News,https://s.abcnews.com/images/Politics/biden-trump-debate-47-ap-gmh-240627_1719544376437_hpMain_4x3t_384.jpg,general,en,us,2024-06-28T03:36:09+00:00,politics
Steven Nelson,"Biden stuns with weak voice, freezes and stumbles in debate against Trump","President Biden repeatedly froze and misspoke during his first — and possibly only — debate against former President Donald Trump Thursday night, prompting anguish and panic in the Democratic Party fewer than four months before the general election. In what will be the most-replayed political moment of the night, the week, the month and maybe...",https://nypost.com/2024/06/27/us-news/biden-stuns-with-weak-voice-freezes-and-stumbles-in-debate-against-trump/,Post,https://nypost.com/wp-content%2Fuploads%2Fsites%2F2%2F2024%2F06%2FScreenshot-2024-06-27-at-91438%E2%80%AFPM-2-1.jpg?quality%3D90%26strip%3Dall,general,en,zm,2024-06-28T03:26:56+00:00,politics
Christian Paz,Can Democrats replace Biden as their nominee?,"US President Joe Biden during the first presidential debate with former US President Donald Trump, not pictured, in Atlanta, Georgia, US, on Thursday, June 27, 2024. Biden and Trump are facing off for their first 2024 debate, a high-stakes opportunity to break through to politics-weary Americans and one that holds the potential for disastrous missteps. Photographer: Eva Marie Uzcategui/Bloomberg via Getty ImagesThat President Joe Biden, age 81, is an elderly man is nothing new.But the first presidential debate between Biden and former President Donald Trump Thursday night has pushed the...",https://www.vox.com/2024-elections/357739/biden-trump-debate-democrats-replace-nominee-whitmer-moore-newsom,VOX,,general,en,gi,2024-06-28T03:21:53+00:00,politics
Chief Editor,Exposing Political Manipulation by the “Church Elder” Hakainde Hichilema,"By Misheck Kakonde Today, we face a bitter truth of political betrayal and evasion. We were promised a future where corruption would be rooted out, the economy would thrive, jobs would abound, taxes would ease, and crucial sectors like healthcare, education, and agriculture would flourish. These were not mere campaign slogans but solemn commitments from [&#8230;]",https://www.lusakatimes.com/?p=454762,Lusaka Times,,general,en,zm,2024-06-28T03:20:43+00:00,politics
Ayo Yusuf,Stakeholders Step Up Move to Produce Gov AbdulRazaq’s Successor in Kwara,"Hammed Shittu&#160;writes about the array of political gladiators in Kwara State in deft moves to succeed Governor AbdulRahman AbdulRazaq come 2027. As the&#160;2027 general election is fast approaching, political activities,",https://www.thisdaylive.com/index.php/2024/06/28/stakeholders-step-up-move-to-produce-gov-abdulrazaqs-successor-in-kwara/,thisdaylive,,general,en,us,2024-06-28T02:33:42+00:00,politics
"Ian Mohr, Mara Siegler","Eric Adams’ stunning super booster Eleonora Srugo is a ‘RHONY’ candidate, top NYC broker and fervent supporter of the mayor",Stunning Srugo — who is politically charged on issues from education to Israel — has supported Adams since the beginning of his administration.,https://nypost.com/2024/06/27/us-news/eric-adams-booster-eleonora-srugo-one-of-nycs-top-brokers/,Post,https://nypost.com/wp-content%2Fuploads%2Fsites%2F2%2F2024%2F06%2Fnewspress-collage-rordrke85-1719540233465.jpg?quality%3D90%26strip%3Dall%261719525875,general,en,zm,2024-06-28T02:15:25+00:00,politics
Ayo Yusuf,Towards a More Perfect Democracy (2)DemocracyTowards a More Perfect Democracy (2),"Anthony Kila&#160;writes about the need to evolve a better democracy for the country through active participation of all and sundry on how&#160; political parties and institutions evolve. Dear Readers, We",https://www.thisdaylive.com/index.php/2024/06/28/towards-a-more-perfect-democracy-2democracytowards-a-more-perfect-democracy-2/,thisdaylive,,general,en,us,2024-06-28T02:08:52+00:00,politics
Andrew McDonald,The next king of Scotland,Scottish Labour Leader Anas Sarwar is following in the footsteps of his legendary political father.,https://www.politico.eu/article/scotland-anas-sarwar-scottish-labour-party/?utm_source=RSS_Feed&utm_medium=RSS&utm_campaign=RSS_Syndication,europeanvoice,,general,en,us,2024-06-28T02:01:00+00:00,politics
,"Political leaders all go potty! With just days left in their election campaigns - Rishi Sunak, Keir Starmer and Ed Davey all try their hand at pottery",The election is just days away and the politicians have officially gone potty.Three party leaders dabbled in a little pottery yesterday as crunch time loomed ever nearer,https://www.dailymail.co.uk/news/article-13578165/Rishi-Sunak-Keir-Starmer-Ed-Davey-try-hand-pottery.html?ns_mchannel=rss&ito=1490&ns_campaign=1490,dailymail,https://i.dailymail.co.uk/1s/2024/06/28/00/86672907-0-image-a-48_1719530020235.jpg,general,en,uk,2024-06-28T00:25:06+00:00,politics
,"Political leaders all go potty! With just days left in their election campaigns - Rishi Sunak, Keir Starmer and Ed Davey all try their hand at pottery",The election is just days away and the politicians have officially gone potty.Three party leaders dabbled in a little pottery yesterday as crunch time loomed ever nearer,https://www.dailymail.co.uk/news/article-13578165/Rishi-Sunak-Keir-Starmer-Ed-Davey-try-hand-pottery.html?ns_mchannel=rss&ns_campaign=1490&ito=1490,mailonsunday,https://i.dailymail.co.uk/1s/2024/06/28/00/86672907-0-image-a-48_1719530020235.jpg,general,en,uk,2024-06-28T00:23:52+00:00,politics
Nathan L,US: TikTok ban & imperialist feuds,"In reality, this is about undermining Chinese imperialism and censoring political speech in the US Zia Faeder, Socialist Alternative (ISA in the United States) (This article was first published on 12 June 2024) At the end of April, the US Senate voted to pass a bill that would require TikTok’s Chinese parent company ByteDance to [&#8230;]這篇文章 US: TikTok ban & imperialist feuds 最早出現於 China Worker。",https://chinaworker.info/en/2024/06/28/45458/?utm_source=rss&utm_medium=rss&utm_campaign=us-tiktok-ban-imperialist-feuds,chinaworker,,general,en,cn,2024-06-28T00:17:45+00:00,politics
-,Hillary Clinton to release essay collection about personal and public life,"Hillary Clinton’s next book is a collection of essays, touching upon everything from marriage to politics to faith, that her publisher is calling her most personal yet. Simon and Schuster announced Tuesday that Clinton’s “Something Lost, Something Gained: Reflections on Life, Love and Liberty” will be released Sept. 17. Among the topics she will cover: [&#8230;]The post Hillary Clinton to release essay collection about personal and public life appeared first on MACAU DAILY TIMES 澳門每日時報.",https://macaudailytimes.com.mo/hillary-clinton-to-release-essay-collection-about-personal-and-public-life.html,macaudailytimes,,general,en,mo,2024-06-28T00:09:01+00:00,politics
Contributed,Inside a former TC Energy execâs claim he got pro-pipeline messaging âstuck on government letterheadâ (BC),"The call starts as a run-of-the-mill internal corporate presentation. With a cheerful preamble, Liam Iliffe, a B.C.-based political staffer turned industry executive, introduces himself to his colleagues at TC Energy, a major North American energy company that builds and operates crude oil and natu...",https://www.castanet.net/news/BC/494630/Inside-a-former-TC-Energy-exec-s-claim-he-got-pro-pipeline-messaging-stuck-on-government-letterhead-,Castanet,https://www.castanet.net/content/2024/6/20240419170436-6622e4afba6761ff84ca7e07jpeg_p3782013_p3833177.jpg,general,en,us,2024-06-27T23:57:00+00:00,politics
WTOP Staff,"After failed coup attempt, many Bolivians rally behind president, though some are wary","LA PAZ, Bolivia (AP) — Supporters of Bolivia’s president rallied outside his palace on Thursday, giving some political breathing room&#8230;",https://wtop.com/world/2024/06/bolivia-reels-from-short-lived-coup-attempt-as-apparent-calm-returns/,wtop,https://wtop.com/wp-content/uploads/2024/06/Bolivia_Army_04695-1024x683.jpg,general,en,us,2024-06-27T23:42:30+00:00,politics
,"EU Leaders Greenlight Top Job Package With Von Der Leyen, Costa, Kallas","By Alexandra Brzozowski, Aurélie Pugnet, Eliza Gkritsi, Max Griera and Thomas Moller-Nielsen(EurActiv) -- EU leaders on Thursday gave their political approval to a trio of names – Ursula von der Leyen, Antonio Costa, and Kaja Kallas – to lead the EU’s three major institutions over the next five years.The EU’s top job ‘package deal’ includes a second term for incumbent European Commission President Ursula von der Leyen from centre-right European People’s Party (EPP), Portugal’s former Socialist prime minister;Antonio Costa;as European Council president, and Estonia’s...",https://api.follow.it/track-rss-story-click/v3/Qw9d99ManWeG27WKOBlSBEQqW5gBv7mX,eurasiareview,,general,en,us,2024-06-27T23:22:57+00:00,politics
Chronicle Editor,Big Josh’s Silver Jubilee Anniversary beyond borders: Dr Nkomo’s dream of a unified southern Africa,"Gibson Mhaka, Zimpapers Politics Hub IN eulogising the fallen Caesar in the play, Julius Caesar, William Shakespeare says of Mark Antony, “The evil that men do lives after them; the good is often interred with their bones.” While the quote suggests people are more often remembered for their bad deeds than their good ones, exceptions do sometimes [&#8230;]",https://www.chronicle.co.zw/big-joshs-silver-jubilee-anniversary-beyond-borders-dr-nkomos-dream-of-a-unified-southern-africa/,The Chronicle,,general,en,gh,2024-06-27T23:15:22+00:00,politics
,Biden and Trump arrive for a debate that could change the trajectory of the 2024 campaign,"ATLANTA — President Joe Biden and his Republican rival, Donald Trump, will meet for a debate on Thursday that offers an unparalleled opportunity for both candidates to try to reshape the political narrative.",https://www.toledoblade.com/news/nation/2024/06/27/biden-trump-debate-cnn-trajectory-2024-presidential-campaign-atlanta-voters/stories/20240627136,toledoblade,https://www.toledoblade.com/image/2024/06/27/600x_a4-3_cCM/Election-2024-Biden-2-20.jpg,general,en,us,2024-06-27T23:08:07+00:00,politics
Betsey Piette,3 webinar for Mumia: The people vs. the state,"Hear from student participants in encampments for Gaza from universities including Boston’s M.I.T., New York’s City College, Columbia University, UPenn in Philadelphia and the Union Theological Seminary, linking their experiences confronting the state over their demands for campus divestments from Israel and those of political prisoners, including Mumia Abu-Jamal.   Mumia . . .Continue reading 3 webinar for Mumia: The people vs. the state at Workers.org",https://www.workers.org/2024/06/79406/?utm_source=rss&utm_medium=rss&utm_campaign=3-webinar-for-mumia-the-people-vs-the-state,workers,,general,en,us,2024-06-27T23:05:34+00:00,politics
The Associated Press,"Biden, Trump arrive for debate that could change trajectory of campaign","President Joe Biden and his Republican rival, Donald Trump, will meet for a debate that offers an unparalleled opportunity for both candidates to try to reshape the political narrative.",https://www.reviewjournal.com/news/nation-and-world/biden-trump-arrive-for-debate-that-could-change-trajectory-of-campaign-3076346/,lvrj,,general,en,us,2024-06-27T22:48:12+00:00,politics
