author,title,description,url,source,image,category,language,country,published_at,topic
Mitchell Armentrout,"Illinois sports betting tax hike hits FanDuel, DraftKings hard under Pritzker budget",Illinois legislators have called the bluff of online sports betting companies that are suggesting they might reduce operations — or close up shop in the state altogether — after being slapped with a higher graduated tax system in Gov. J.B. Pritzker’s latest budget.FanDuel and DraftKings will soon see their net revenue taxed on a scale that tops out at 40% under the spending plan that passed the Illinois General Assembly last week. That’s up from the 15% flat rate levied against sportsbooks since the now billion-dollar Illinois industry launched in 2020.The top two mobile betting giants...,https://chicago.suntimes.com/casinos-gambling/2024/06/02/illinois-sports-betting-tax-hike-jb-pritzker,suntimes,,general,en,us,2024-06-02T14:10:00+00:00,sports
,Why Mbappe makes Real Madrid 'almost impossible to stop',"BBC Sport asks Real Madrid fans and experts what new signing Kylian Mbappe will bring to the Bernabeu, as the French forward joins from Paris Saint Germain.",https://www.bbc.com/sport/football/videos/crgg0dlvg6go,BBC,https://ichef.bbci.co.uk/news/240/cpsprodpb/2766/live/4d8bc0a0-192a-11ef-baa7-25d483663b8e.jpg,general,en,gb,2024-06-02T14:02:53+00:00,sports
Payal Tomar,Pakistan origin players to watch out for in T20 World Cup,Plenty of Pakistan-born players are playing for other nations where they get the opportunity to represent the country.The post Pakistan origin players to watch out for in T20 World Cup appeared first on Inside Sport India.,https://www.insidesport.in/cricket/pakistan-origin-players-to-watch-out-for-in-t20-world-cup/,Insidesport,,sports,en,us,2024-06-02T14:02:05+00:00,sports
Richard N. Velotta,Neighboring Arizona makes gains on Nevada sports-betting business,An expert who monitors sports wagering nationwide thinks Nevada may need to change its in-person registration policy to keep up with competitors nationwide.,https://www.reviewjournal.com/business/business-columns/inside-gaming/neighboring-arizona-makes-gains-on-nevada-sports-betting-business-3060962/,lvrj,,general,en,us,2024-06-02T14:00:24+00:00,sports
paulmbanks,"Real Madrid Transfer Talk: Kylian Mbappe, Luka Modric","No one involved with the deal, nor the player himself, will officially say it, until now- Kylian Mbappe has joined Real Madrid. No one from the club will say it out loud, in public, until this week. Obviously, we have all known, for several months that this was going to happen. Mbappe to Madrid has [&#8230;]The post Real Madrid Transfer Talk: Kylian Mbappe, Luka Modric appeared first on The Sports Bank.",https://www.thesportsbank.net/football/real-madrid/mbappe-modric/,thesportsbank,,general,en,us,2024-06-02T13:59:27+00:00,sports
Jaclyn Hendricks,Jena Sims stuns at SI Swimsuit runway show with Brooks Koepka by her side,Sims hit the runway Saturday as part of Miami Swim Week after making her anticipated debut in Sports Illustrated Swimsuit.,https://nypost.com/2024/06/02/sports/jena-sims-stuns-at-si-swimsuit-runway-show-with-brooks-koepka-by-her-side/,Post,https://nypost.com/wp-content%2Fuploads%2Fsites%2F2%2F2024%2F06%2Fnewspress-collage-4g0j2ypiv-1717335722938.jpg?quality%3D90%26strip%3Dall%261717321409,general,en,zm,2024-06-02T13:59:03+00:00,sports
temp,Video: Bermuda Rugby Team Defeat Bahamas,"Thomas Greenslade captained Bermuda as they completed a solid win over the Bahamas, as they claimed a 35 – 5 win at the National Sport Center. Bermuda’s Starting Line-Up: &#8211; 1 Aidon Campbell, 2 Thomas Greenslade [capt.], 3 Allan Steynor, 4 Aldo Campbell, 5 Nathan Wilson, 6 Jake Fields, 7 Jamie Baum, 8 Brynley Toms, [&#8230;]",https://bernews.com/2024/06/video-bermuda-win-big-over-the-bahamas/,bernews,,general,en,us,2024-06-02T13:48:42+00:00,sports
Ansh Athani,WI vs PNG Live Score: T20 World Cup’s first upset coming up in Guyana?,This will be the first T20I match between the West Indies and Papua New Guinea.The post WI vs PNG Live Score: T20 World Cup&#8217;s first upset coming up in Guyana? appeared first on Inside Sport India.,https://www.insidesport.in/cricket/wi-vs-png-live-score-papua-new-guinea-to-upset-west-indies-in-t20-world-cup-2024-match-2/,Insidesport,,sports,en,us,2024-06-02T13:30:00+00:00,sports
Steve DelVecchio,Caleb Williams looked so unathletic swinging a baseball bat,"There have been many NFL quarterbacks through the years who could have gone pro playing baseball, but we can say with certainty that Caleb Williams is not one of them. Williams earlier this week was invited to practice some hitting with the Chicago Cubs. Those who watched the video felt that Williams did not look...The post Caleb Williams looked so unathletic swinging a baseball bat appeared first on Larry Brown Sports.",https://larrybrownsports.com/football/caleb-williams-unathletic-baseball-swing-video/633963,larrybrownsports,,general,en,us,2024-06-02T13:18:44+00:00,sports
paulmbanks,"Sir Alex Ferguson Sits Next Andrea Pirlo, Max Allegri at UCL Final","Sir Alex Ferguson is 82 years young and retired from football for well over a decade, but he remains relevant. He was in attendance today at Wembley Stadium, as Real Madrid won their 15th UEFA Champions League title, and ninth straight UCL final match. Los Blancos bested Borussia Dortmund 2-0, meaning Luka Modric, Toni Kroos, [&#8230;]The post Sir Alex Ferguson Sits Next Andrea Pirlo, Max Allegri at UCL Final appeared first on The Sports Bank.",https://www.thesportsbank.net/football/manchester-united/sir-alex-pirlo-allegri/,thesportsbank,,general,en,us,2024-06-02T13:11:47+00:00,sports
Riley Gaines,Trans-formation: Saving women’s sports from male intrusion is a matter of civil rights,"We can be a powerful, unstoppable force for good in protecting women’s sport, ensuring that the next generation of female athletes can compete with dignity and equal chances of opportunity and success.",https://nypost.com/2024/06/02/opinion/trans-athletes-make-womens-sports-a-civil-rights-issue/,Post,https://nypost.com/wp-content%2Fuploads%2Fsites%2F2%2F2024%2F06%2Fnewspress-collage-uy5osgrim-1717332931472.jpg?quality%3D90%26strip%3Dall%261717318559,general,en,zm,2024-06-02T13:07:25+00:00,sports
Ansh Athani,Rohan Bopanna starts his French Open title contention with a tight 3-set victory,"Prior to this victory, Bopanna and Ebden had a poor 1-3 record on clay. This included two first-round exits and one second-round exit at the Masters.The post Rohan Bopanna starts his French Open title contention with a tight 3-set victory appeared first on Inside Sport India.",https://www.insidesport.in/tennis/rohan-bopanna-starts-his-french-open-title-contention-with-a-tight-3-set-victory/,Insidesport,,sports,en,us,2024-06-02T13:06:42+00:00,sports
paulmbanks,Puppy Crawl: Greatest Halftime Show Ever,"When it comes to Puppy Crawl, you can have a debate about it. That debate is: &#8220;was is is the greatest halftime show in Big Ten Tournament history? Or &#8220;was it the greatest halftime show in basketball history?&#8221; One can&#8217;t say a lot good things about how the Illinois Fighting Illini played last night, in [&#8230;]The post Puppy Crawl: Greatest Halftime Show Ever appeared first on The Sports Bank.",https://www.thesportsbank.net/pets/puppy-crawl-halftime/,thesportsbank,,general,en,us,2024-06-02T13:03:06+00:00,sports
John Smith,Spanish basketball players honoured in Madrid,"The unexpected silver medal collected by the Spanish men’s basketball team in the 1984 Los Angeles Olympic Games undoubtedly promoted the sport in Spain. Honoured 40 years on Despite the fact that Russia and Hungary withdrew from the event in a tit for tat response to the USA boycott of Moscow 1980, the previous Gold [&#8230;]",https://euroweeklynews.com/2024/06/02/spanish-basketball-players-honoured-in-madrid/,euroweeklynews,https://euroweeklynews.com/wp-content/uploads/2024/06/Presentation-to-Laia-Palau-1024x683.jpg,general,en,us,2024-06-02T12:49:46+00:00,sports
Triyasha Chatterjee,Confident Igor Stimac backs Blue Tigers to ‘make history in most important’ India vs Kuwait game,The India vs Kuwait game is also set to be Indian Captain Sunil Chhetri's last game in the national coloursThe post Confident Igor Stimac backs Blue Tigers to &#8216;make history in most important&#8217; India vs Kuwait game appeared first on Inside Sport India.,https://www.insidesport.in/football/confident-igor-stimac-backs-blue-tigers-to-make-history-in-most-important-india-vs-kuwait-game/,Insidesport,,sports,en,us,2024-06-02T12:30:47+00:00,sports
AP News,Makhachev beats Poirier by submission at UFC 302 to defend lightweight title,"Islam Makhachev defended his lightweight title and extended his winning streak to 14 fights, third-longest in UFC history, by getting a submission over Dustin Poirier in the fifth round at UFC 302. Overcoming one of the sport’s accomplished veterans and a crowd that was against him from the start, Makhachev ran his record to 26-1 and said afterward he may move up in weight for another challenge. There’s certainly not much left for him at 155 pounds, where he defended his title for the third time and showed why he is ranked as the pound-for-pound best in UFC. Poirier fell short in his third...",https://www.mymotherlode.com/sports/top-sports-general-news/3368259/makhachev-beats-poirier-by-submission-at-ufc-302-to-defend-lightweight-title.html,mymotherlode,,general,en,us,2024-06-02T12:11:00+00:00,sports
emmakd,Ghana Black Stars begin preparation for 2026 World Cup qualifiers,"The Black Stars of Ghana have commenced preparations at the University of Ghana Sports Stadium, for the 2026 World Cup qualifiers against Mali and Central African Republic (CAR).The post Ghana Black Stars begin preparation for 2026 World Cup qualifiers appeared first on Ghana Business News.",https://www.ghanabusinessnews.com/2024/06/02/ghana-black-stars-begin-preparation-for-2026-world-cup-qualifiers/,ghanabusinessnews,,general,en,us,2024-06-02T12:02:50+00:00,sports
Steve DelVecchio,CJ Stroud reveals his top-5 NFL quarterback rankings,"CJ Stroud recently shared his rankings of the top quarterbacks in the NFL, and the Houston Texans star feels he is very close to the top of the league. In a post on his Instagram story, Stroud listed his rankings for the top-five quarterbacks in the NFL based &#8220;off of last year.&#8221; He placed himself...The post CJ Stroud reveals his top-5 NFL quarterback rankings appeared first on Larry Brown Sports.",https://larrybrownsports.com/football/cj-stroud-top-5-nfl-quarterback-rankings/633962,larrybrownsports,,general,en,us,2024-06-02T11:58:24+00:00,sports
Pranchal Srivastava,How to watch T20 World Cup opening ceremony live?,Check out where and how to watch the T20 World Cup opening ceremony live streaming and broadcast for the Indian fans. The post How to watch T20 World Cup opening ceremony live? appeared first on Inside Sport India.,https://www.insidesport.in/cricket/how-to-watch-t20-world-cup-opening-ceremony-live/,Insidesport,,sports,en,us,2024-06-02T11:53:30+00:00,sports
Triyasha Chatterjee,India’s Amit Panghal beats Liu Chuang to secure Paris Olympics 2024 quota,"Earlier, Nishant Dev also secured his spot in the Paris Olympics by defeating Moldova’s Vasile Cebotari 5-0 in the men’s 71kg eventThe post India&#8217;s Amit Panghal beats Liu Chuang to secure Paris Olympics 2024 quota appeared first on Inside Sport India.",https://www.insidesport.in/boxing/indias-amit-panghal-beats-liu-chuang-to-secure-paris-olympics-2024-quota/,Insidesport,,sports,en,us,2024-06-02T11:53:10+00:00,sports
Alexander Engelhardt,Alexander Englehardt: How close is MMA to becoming Olympic sport,"With the Paris 2024 Olympics around the corner, the quadr...",https://web5.insidethegames.biz/articles/1145757/gamma-president-mma-future-olympics,insidethegames,,general,en,biz,2024-06-02T11:41:34+00:00,sports
Alexander Engelhardt,Alexander Englehardt: How close is MMA to becoming Olympic sport,"With the Paris 2024 Olympics around the corner, the quadr...",https://web4.insidethegames.biz/articles/1145757/gamma-president-mma-future-olympics,insidethegames,,general,en,biz,2024-06-02T11:40:06+00:00,sports
Inside The Games,"Title IX is a ruse to require trans sports participation, GOP states say",The Biden administration has put on hold a plan to prohibit across-the-board bans on transgender ...,https://web4.insidethegames.biz/articles/1145758/title-ix-is-a-ruse-to-require-trans,insidethegames,,general,en,biz,2024-06-02T11:38:41+00:00,sports
Pranchal Srivastava,Yuvraj Singh to Misbah-ul-Haq: Players to hit longest sixes in T20 World Cup history,"Team India veteran batter, Yuvraj Singh holds the record for smashing the longest six in T20 World Cup history. Check out the top 5 list. The post Yuvraj Singh to Misbah-ul-Haq: Players to hit longest sixes in T20 World Cup history appeared first on Inside Sport India.",https://www.insidesport.in/cricket/yuvraj-singh-to-misbah-ul-haq-players-to-hit-longest-sixes-in-t20-world-cup-history/,Insidesport,,sports,en,us,2024-06-02T11:10:27+00:00,sports
highlandnews,Burst water main to cause supply disruptions in Letterkenny,Repairs to a burst water main may cause supply disruptions to Letterkenny and surrounding area. Works are scheduled to take place until midnight on 2nd June. Uisce Eireann recommend that those affected allow 3-4 hours after the estimated restoration time for supply to fully return.The post Burst water main to cause supply disruptions in Letterkenny appeared first on Highland Radio - Latest Donegal News and Sport.,https://highlandradio.com/2024/06/02/burst-water-main-to-cause-supply-disruptions-in-letterkenny/,Highland Radio,,general,en,ie,2024-06-02T11:06:31+00:00,sports
Triyasha Chatterjee,"Demand for India vs Kuwait tickets go over roof, third phase of sale to begin at 6PM","For 19 years Sunil Chhetri has remained the stalwart for the Blue Tigers, and the demand to see him for one last time in the Blues jersey The post Demand for India vs Kuwait tickets go over roof, third phase of sale to begin at 6PM appeared first on Inside Sport India.",https://www.insidesport.in/football/demand-for-india-vs-kuwait-tickets-go-over-roof-third-phase-of-sale-to-begin-soon/,Insidesport,,sports,en,us,2024-06-02T11:00:49+00:00,sports
Himanga Mahanta,MMA News Roundup – Joe Rogan Gets Emotional After Dustin Poirier Loss; Donald Trump Finally Meets Khabib Nurmagomedov; Dana White Downplays Islam Makhachev’s P4P Status for Jon Jones,"Did you miss out on the biggest headlines during one of MMA&#8217;s biggest weekends? Well, there is no need to frown because we have just the thing you need to stay updated about the latest happenings in our favorite sport &#8211; the daily roundup. As such, today&#8217;s list will start with longtime UFC commentator Joe [&#8230;]The post MMA News Roundup – Joe Rogan Gets Emotional After Dustin Poirier Loss; Donald Trump Finally Meets Khabib Nurmagomedov; Dana White Downplays Islam Makhachev’s P4P Status for Jon Jones appeared first on EssentiallySports.",https://www.essentiallysports.com/ufc-mma-news-mma-news-roundup-joe-rogan-gets-emotional-after-dustin-poirier-loss-donald-trump-finally-meets-khabib-nurmagomedov-dana-white-downplays-islam-makhachev-p-for-p-status-for-jon-jones/,Essentially Sports,https://image-cdn.essentiallysports.com/wp-content/uploads/Joe-Rogan-Dana-White-Islam-Makhachev-Donald-Trump-and-Khabib-Nurmagomedov-1-560x315.jpg,sports,en,us,2024-06-02T11:00:11+00:00,sports
Alexander Engelhardt,Alexander Englehardt: How close is MMA to becoming Olympic sport,"With the Paris 2024 Olympics around the corner, the quadr...",https://www.insidethegames.biz/articles/1145757/gamma-president-mma-future-olympics,insidethegames,,general,en,biz,2024-06-02T10:50:03+00:00,sports
Inside The Games,"Title IX is a ruse to require trans sports participation, GOP states say",The Biden administration has put on hold a plan to prohibit across-the-board bans on transgender ...,https://www.insidethegames.biz/articles/1145758/title-ix-is-a-ruse-to-require-trans,insidethegames,,general,en,biz,2024-06-02T10:50:03+00:00,sports
Aman Verma,Watch: Rishabh Pant’s ‘put’fect practice for the IND vs IRE T20 World Cup match,"After destroying the Bangladesh bowlers, Rishabh Pant was seen spending some fun time with Suryakumar Yadav ahead of the India vs Ireland T20 World Cup game.The post Watch: Rishabh Pant&#8217;s &#8216;put&#8217;fect practice for the IND vs IRE T20 World Cup match appeared first on Inside Sport India.",https://www.insidesport.in/cricket/watch-rishabh-pants-putfect-practice-for-the-ind-vs-ire-t20-world-cup-match/,Insidesport,,sports,en,us,2024-06-02T10:30:44+00:00,sports
Allan Abe,Caitlin Clark’s Mistreatment Turns Paige Spiranac Into Women Sports’ Advocate Whole Expressing Frustrations,"No one can refute the effect that Caitlin Clark had on the sport. Her selection by the Indiana Fever in the 2024 WNBA draft sure did bring a lot of viewers into the game of women&#8217;s basketball. Her advent resulted in a whopping 93% surge in ticket sales, with Indiana&#8217;s second home game against the [&#8230;]The post Caitlin Clark’s Mistreatment Turns Paige Spiranac Into Women Sports’ Advocate Whole Expressing Frustrations appeared first on EssentiallySports.",https://www.essentiallysports.com/golf-news-wnba-basketball-news-caitlin-clarks-mistreatment-turns-paige-spiranac-into-women-sports-advocate-as-she-expressing-her-frustrations-indiana-fever-chicago-sky/,Essentially Sports,https://image-cdn.essentiallysports.com/wp-content/uploads/Caitlin-Clark-Paige-Spiranac-Collage-560x315.png,sports,en,us,2024-06-02T10:00:59+00:00,sports
Bon Adamson,The 5 best sports streaming services in 2024,"Sports have crept more and more into the world of streaming, and some services have become prime destinations for fans of all sorts of sports.",https://www.pocket-lint.com/best-sports-streaming-service/,pocket-lint,https://static1.pocketlintimages.com/wordpress/wp-content/uploads/2024/05/pixel-8a-2-2.jpg,general,en,us,2024-06-02T10:00:15+00:00,sports
highlandnews,Details announced for Cruinniú na nÓg 2024,"This year Cruinniú na nÓg, the annual day of free creativity for children and young people, will take place on Saturday 15th June, with over 50 events planned for the county. The event is being coordinated by Donegal County Council&#8217;s Culture and Creativity Team, which says there is more capacity this year than ever before, &#8230; Details announced for Cruinniú na nÓg 2024 Read More &#187;The post Details announced for Cruinniú na nÓg 2024 appeared first on Highland Radio - Latest Donegal News and Sport.",https://highlandradio.com/2024/06/02/details-announced-for-cruinniu-na-nog-2024/,Highland Radio,,general,en,ie,2024-06-02T09:55:33+00:00,sports
Triyasha Chatterjee,"What happened last time when Virat Kohli, Rohit Sharma opened for India in T20I?","However, India sprung up a surprise in IND vs BAN warm up match with Sanju Samson opening alongside Rohit SharmaThe post What happened last time when Virat Kohli, Rohit Sharma opened for India in T20I? appeared first on Inside Sport India.",https://www.insidesport.in/cricket/what-happened-last-time-when-virat-kohli-rohit-sharma-opened-for-india-in-t20i/,Insidesport,,sports,en,us,2024-06-02T09:34:08+00:00,sports
ABMN Staff,Dimensional Fund Advisors LP Grows Position in Madison Square Garden Sports Corp. (NYSE:MSGS),Dimensional Fund Advisors LP Grows Position in Madison Square Garden Sports Corp. (NYSE:MSGS),https://www.americanbankingnews.com/2024/06/02/dimensional-fund-advisors-lp-grows-position-in-madison-square-garden-sports-corp-nysemsgs.html,americanbankingnews,,general,en,us,2024-06-02T09:32:43+00:00,sports
Associated Press,Today in Sports History: Red Sox star Ted Williams enlists,"In 1942, Red Sox star Ted Williams enlisted as a US Navy aviator.",https://www.chicagotribune.com/2024/06/02/today-in-sports-history-red-sox-star-ted-williams-enlists/,Chicago Tribune,https://www.chicagotribune.com/wp-content/uploads/migration/2020/05/22/AJ3TRQNF6FFWFKASKVQUPGXSNE.jpg?w=1400px&strip=all,general,en,us,2024-06-02T09:15:47+00:00,sports
Pranchal Srivastava,How to book IND vs PAK T20 World Cup tickets?,Check out where and how to book IND vs PAK T20 World Cup tickets.The post How to book IND vs PAK T20 World Cup tickets? appeared first on Inside Sport India.,https://www.insidesport.in/cricket/how-to-book-ind-vs-pak-t20-world-cup-tickets/,Insidesport,,sports,en,us,2024-06-02T08:37:54+00:00,sports
ABMN Staff,ANTA Sports Products Limited (OTCMKTS:ANPDF) Short Interest Update,"ANTA Sports Products Limited (OTCMKTS:ANPDF &#8211; Get Free Report) saw a significant growth in short interest in May. As of May 15th, there was short interest totalling 9,561,600 shares, a growth of 5.3% from the April 30th total of 9,078,900 shares. Based on an average daily trading volume, of 2,200 shares, the short-interest ratio is [&#8230;]",https://www.americanbankingnews.com/2024/06/02/anta-sports-products-limited-otcmktsanpdf-short-interest-update.html,americanbankingnews,,general,en,us,2024-06-02T08:30:44+00:00,sports
Souvik Mukherjee,T20 World Cup 2024 Points Table: USA lead India’s Group A with thumping win over Canada,Check out complete points table of the T20 World Cup 2024. The post T20 World Cup 2024 Points Table: USA lead India&#8217;s Group A with thumping win over Canada appeared first on Inside Sport India.,https://www.insidesport.in/cricket/icc-t20-world-cup-2024-points-table-rankings-nrr-all-4-group/,Insidesport,,sports,en,us,2024-06-02T07:54:00+00:00,sports
Ankita Banerjee,French Open: Novak Djokovic Vents Frustration at Scheduling Debacle That Forced Him to Push Physical Limits,"Novak Djokovic&#8217;s late-night showdown at the French Open ultimately secured him another spot in the history of the sport. But, the question of scheduling still remains a point of despair for World No. 1. Speaking about it to the press, the 37-year-old player who defeated Lorenzo Musetti in the third round, addressed the &#8220;scheduling&#8221; problem [&#8230;]The post French Open: Novak Djokovic Vents Frustration at Scheduling Debacle That Forced Him to Push Physical Limits appeared first on EssentiallySports.",https://www.essentiallysports.com/atp-tennis-news-french-open-novak-djokovic-vents-frustration-at-scheduling-debacle-that-forced-him-to-push-physical-limits/,Essentially Sports,https://image-cdn.essentiallysports.com/wp-content/uploads/2023-05-17T114828Z_1849704394_UP1EJ5H0WSQ50_RTRMADP_3_TENNIS-ROME-455x315.jpg,sports,en,us,2024-06-02T07:50:19+00:00,sports
TMZ Staff,WNBA Star Brittney Griner Says Son Will Be An Athlete,"Look out, future athletes -- WNBA star Brittney Griner says her baby on the way will 100% be involved in sports ... telling TMZ Sports it's a no-brainer!! The Phoenix Mercury center has been a basketball star her whole life ... from recording 52&hellip;",https://www.tmz.com/2024/06/02/brittney-griner-wnba-son-athlete-nba/,TMZ,,entertainment,en,us,2024-06-02T07:40:54+00:00,sports
M.R. Jenifer,“Horrible”: EA Sports College Football 25’s Crucial Changes May Disappoint Devoted Fans,"Excitement is building for the return of EA Sports College Football 25 after an 11-year hiatus. To build excitement, the team shared several updates last month, including 10,000 players confirming their participation and veteran commentators bringing the games to life. The May 17 trailer fueled anticipation with stunningly realistic graphics of players and mascots. Everything [&#8230;]The post “Horrible”: EA Sports College Football 25’s Crucial Changes May Disappoint Devoted Fans appeared first on EssentiallySports.",https://www.essentiallysports.com/nfl-ncaa-news-horrible-ea-sports-college-football-twenty-fives-crucial-changes-may-disappoint-devoted-fans/,Essentially Sports,https://image-cdn.essentiallysports.com/wp-content/uploads/WhatsApp-Image-2024-02-22-at-11.55.11-PM-560x287.jpeg,sports,en,us,2024-06-02T07:37:51+00:00,sports
Madhav Agarwal,"USA vs CAN: Aaron Jones joins elite company after blistering 94, surpasses Yuvraj Singh","T20 World Cup: In an innings that shocked the world, Aaron Jones smashed 94 from 40 deliveries as USA chased down 194 in 17.3 overs.The post USA vs CAN: Aaron Jones joins elite company after blistering 94, surpasses Yuvraj Singh appeared first on Inside Sport India.",https://www.insidesport.in/cricket/usa-vs-can-aaron-jones-joins-elite-company-after-blistering-94-surpasses-yuvraj-singh/,Insidesport,,sports,en,us,2024-06-02T07:28:10+00:00,sports
Anukul Chauhan,Venkatesh Iyer takes the vows: India star marries Shruti Raghunathan in traditional South Indian ceremony,"With his cricketing career flourishing and his personal life blossoming, Iyer seems to be on a winning streak both on and off the field.The post Venkatesh Iyer takes the vows: India star marries Shruti Raghunathan in traditional South Indian ceremony appeared first on Inside Sport India.",https://www.insidesport.in/cricket/venkatesh-iyer-takes-the-vows-india-star-marries-shruti-raghunathan-in-traditional-south-indian-ceremony/,Insidesport,,sports,en,us,2024-06-02T07:27:17+00:00,sports
Omobola Samuel,"Marwa, Fayoade, UI VC honoured as SWAN,NDLEA hold talks on doping, sports diplomacy","Chairman/Chief Executive Officer, National Drug Law Enforcement Agency (NDLEA), Brig-Gen. Muhamed Buba Marwa; Commissioner of Police, Lagos State, Adegoke Fayoade and Vice Chancellor, University of Ibadan, Professor Kayode Oyebode Adebowale...The post Marwa, Fayoade, UI VC honoured as SWAN,NDLEA hold talks on doping, sports diplomacy appeared first on The Nation Newspaper.",https://thenationonlineng.net/marwa-fayoade-ui-vc-honoured-as-swanndlea-hold-talks-on-doping-sports-diplomacy/,thenationonlineng,,general,en,us,2024-06-02T07:10:22+00:00,sports
