author,title,description,url,source,image,category,language,country,published_at,topic
AP News,Russia presses its offensive in Ukraine and issues new threats as the West tries to blunt the push,"Slowly but steadily this summer, Russian troops are forging through Ukraine’s outgunned and undermanned defenses along the front line of the battlefield in a relentless onslaught, prompting the West to push for new weapons and strategies to shore up Kyiv. That, in turn, has brought new political demands by President Vladimir Putin of Ukraine’s leadership and threats of retaliation against the West — either directly or by indirect methods. The moves by the West to blunt the offensive and the potential Kremlin response could lead to a dangerous escalation as the war drags through its third...",https://www.mymotherlode.com/news/east-europe/3383618/russia-presses-its-offensive-in-ukraine-and-issues-new-threats-as-the-west-tries-to-blunt-the-push.html,mymotherlode,,general,en,us,2024-06-29T05:07:34+00:00,politics
David Thompson,UUP's Diana Armstrong on why voters in Fermanagh and South Tyrone should back her on July 4,"A daughter of former Ulster Unionist leader and Fermanagh and South Tyrone MP Harry West, Diana Armstrong is steeped in the politics of the party and of the county – and is now the standard bearer for unionism in a head to head battle with Sinn Fein’s Pat Cullen.",https://www.newsletter.co.uk/news/politics/uups-diana-armstrong-on-why-voters-in-fermanagh-and-south-tyrone-should-back-her-on-july-4-4683886,newsletter,https://www.newsletter.co.uk/webimg/b25lY21zOjQxYzUyOWMxLTM5NjctNDk5OC1hYzY4LTEyYjBjMzBlMzYxNjpiODNkOWJmYi1mMzU3LTRmZTEtOGNlNS00MWU0MzE4ZThjMDE=.jpg?width=1200&auto=webp,general,en,uk,2024-06-29T05:00:00+00:00,politics
Associated Press,Russia presses its offensive in Ukraine and issues new threats as the West tries to blunt the push,"Slowly but steadily this summer, Russian troops are forging through Ukraine’s outgunned and undermanned defenses along the front line of the battlefield in a relentless onslaught, prompting the West to push for new weapons and strategies to shore up Kyiv. That, in turn, has brought new political demands by President Vladimir Putin of Ukraine’s leadershipThe post Russia presses its offensive in Ukraine and issues new threats as the West tries to blunt the push appeared first on KVIA.",https://kvia.com/news/2024/06/28/russia-presses-its-offensive-in-ukraine-and-issues-new-threats-as-the-west-tries-to-blunt-the-push/,kvia,,general,en,us,2024-06-29T04:20:54+00:00,politics
Associated Press,Russia presses its offensive in Ukraine and issues new threats as the West tries to blunt the push,"Slowly but steadily this summer, Russian troops are forging through Ukraine’s outgunned and undermanned defenses along the front line of the battlefield in a relentless onslaught, prompting the West to push for new weapons and strategies to shore up Kyiv. That, in turn, has brought new political demands by President Vladimir Putin of Ukraine’s leadership",https://localnews8.com/news/2024/06/28/russia-presses-its-offensive-in-ukraine-and-issues-new-threats-as-the-west-tries-to-blunt-the-push/,localnews8,,general,en,us,2024-06-29T04:20:54+00:00,politics
KNEWS,The PNC and AFC Congresses,"Dear Editor, Two political parties that formed an alliance (coalition) for the 2015 and 2020 general elections hold separate national conventions (Congress) and internal executive elections (including leader) this weekend. The PNC (the dominant constituent of APNU) holds its Congress from Friday June 28 thru Sunday June 30. The AFC holds a one-day convention. Both [&#8230;]The post The PNC and AFC Congresses appeared first on Kaieteur News.",https://www.kaieteurnewsonline.com/2024/06/29/the-pnc-and-afc-congresses/,Kaieteur News,,general,en,gy,2024-06-29T04:02:04+00:00,politics
KNEWS,Residents should reclaim “Kaka” Street to preserve Hari Prashad’s legacy,"Dear Editor, In July 1958, Dattatreya Balkrushna Kalelkar (1885-1981), an Indian nationalist, visited British Guiana. Kalelkar was described as “…a freedom fighter, social and political worker, journalist, publicist, and educationist, shuttlecocking between the Ashram and jails…” Originally from the Indian state of Maharashtra, where the famous paintings and rock-cut sculptures of Ajanta and Ellora are [&#8230;]The post Residents should reclaim “Kaka” Street to preserve Hari Prashad’s legacy appeared first on Kaieteur News.",https://www.kaieteurnewsonline.com/2024/06/29/residents-should-reclaim-kaka-street-to-preserve-hari-prashads-legacy/,Kaieteur News,,general,en,gy,2024-06-29T04:01:23+00:00,politics
Megan Specia,Why U.K.’s Young Voters Feel Forgotten by Politicians,Many young people in the northern English cities of Liverpool and Manchester say they feel disillusioned by politics.,https://www.nytimes.com/2024/06/29/world/europe/britain-young-voters.html,nytimes,https://static01.nyt.com/images/2024/06/29/multimedia/29uk-election-youth-01-qzck/29uk-election-youth-01-qzck-mediumSquareAt3X.jpg,general,en,us,2024-06-29T04:01:19+00:00,politics
Ayo Yusuf,Tinubu Appoints Eight New Federal Permanent Secretaries,Deji Elumoye in Abuja President Bola Tinubu has approved the appointment of eight new Federal Permanent Secretaries to fill in existing and impending vacancies of some states and geo-political zones,https://www.thisdaylive.com/index.php/2024/06/29/tinubu-appoints-eight-new-federal-permanent-secretaries-2/,thisdaylive,,general,en,us,2024-06-29T03:26:19+00:00,politics
Ayo Yusuf,CUPP to IGP: Probe Alleged Plot to Frame Ugochinyere for Murder,Adedayo Akinwale and Sunday Aborisade in Abuja The Coalition of United Political Parties (CUPP) has raised the alarm over an alleged plot to frame a member of the House of,https://www.thisdaylive.com/index.php/2024/06/29/cupp-to-igp-probe-alleged-plot-to-frame-ugochinyere-for-murder/,thisdaylive,,general,en,us,2024-06-29T03:17:45+00:00,politics
DC Correspondent,Telugu actor Ali quits active politics,Telugu actor Ali quits active politics,https://www.deccanchronicle.com/southern-states/andhra-pradesh/telugu-actor-ali-quits-active-politics-1308604,deccanchronicle,https://www.deccanchronicle.com/h-upload/2024/06/29/1100341-untitleddesign30.webp,general,en,us,2024-06-29T03:15:21+00:00,politics
Castanet,"Should Old Age Pension benefits for Canadians total more than $25,000 per year? (Poll)","&ldquo;No matter who&rsquo;s in power in politics, seniors deserve to have a living wage.&rdquo; That&rsquo;s from Lorraine Beaudion, a senior rallying at the corner of Highway 97 and 25th Avenue in Vernon Thursday. Beaudion says she wants to raise awareness that seniors cannot live on current pensi...",https://www.castanet.net/news/Poll/494575/Should-Old-Age-Pension-benefits-for-Canadians-total-more-than-25-000-per-year,Castanet,https://www.castanet.net/content/2024/6/screen_shot_2024-06-27_at_1.19.48_pm_p3833010.jpg,general,en,us,2024-06-29T02:30:00+00:00,politics
John Perry,The U.S. Has Imposed Sanctions on Georgia and Nicaragua …,"Source: Georgia Today Politicians in the small Caucasian nation of Georgia have been sanctioned by Washington for “undermining democracy” and depriving Georgian people of “fundamental freedoms,” simply because its parliament has passed a law to control foreign influence over Georgian politics. Politicians in another small country, Nicaragua, were subjected to U.S. sanctions for doing the [&#8230;]The post The U.S. Has Imposed Sanctions on Georgia and Nicaragua … first appeared on Dissident Voice.",https://dissidentvoice.org/2024/06/the-u-s-has-imposed-sanctions-on-georgia-and-nicaragua/,dissidentvoice,,general,en,us,2024-06-29T01:46:50+00:00,politics
Alistair Smout and Andrew MacAskill,Rishi Sunak hurt and angry over Reform volunteer’s racial slur,Nigel Farages said he was dismayed by the language but later said the volunteer was an actor involved in “a political setup” to undermine his party.,https://www.smh.com.au/world/europe/rishi-sunak-hurt-and-angry-over-reform-volunteer-s-racial-slur-20240629-p5jpr8.html?ref=rss&utm_medium=rss&utm_source=rss_world,The Sydney Morning Herald,https://static.ffx.io/images/$zoom_0.2507%2C$multiply_0.7554%2C$ratio_1.777778%2C$width_1059%2C$x_282%2C$y_0/t_crop_custom/q_86%2Cf_auto/144e567fa4e8350359ab481d750cc675bdcd3429,general,en,au,2024-06-29T01:12:38+00:00,politics
Alistair Smout and Andrew MacAskill,Rishi Sunak hurt and angry over Reform volunteer’s racial slur,Nigel Farages said he was dismayed by the language but later said the volunteer was an actor involved in “a political setup” to undermine his party.,https://www.theage.com.au/world/europe/rishi-sunak-hurt-and-angry-over-reform-volunteer-s-racial-slur-20240629-p5jpr8.html?ref=rss&utm_medium=rss&utm_source=rss_world,The Age,https://static.ffx.io/images/$zoom_0.2507%2C$multiply_0.7554%2C$ratio_1.777778%2C$width_1059%2C$x_282%2C$y_0/t_crop_custom/q_86%2Cf_auto/144e567fa4e8350359ab481d750cc675bdcd3429,general,en,au,2024-06-29T01:12:38+00:00,politics
Alistair Smout and Andrew MacAskill,Rishi Sunak hurt and angry over Reform volunteer’s racial slur,Nigel Farages said he was dismayed by the language but later said the volunteer was an actor involved in “a political setup” to undermine his party.,https://www.watoday.com.au/world/europe/rishi-sunak-hurt-and-angry-over-reform-volunteer-s-racial-slur-20240629-p5jpr8.html?ref=rss&utm_medium=rss&utm_source=rss_feed,watoday,https://static.ffx.io/images/$zoom_0.2507%2C$multiply_0.7554%2C$ratio_1.777778%2C$width_1059%2C$x_282%2C$y_0/t_crop_custom/q_86%2Cf_auto/144e567fa4e8350359ab481d750cc675bdcd3429,general,en,au,2024-06-29T01:12:38+00:00,politics
Alistair Smout and Andrew MacAskill,Rishi Sunak hurt and angry over Reform volunteer’s racial slur,Nigel Farages said he was dismayed by the language but later said the volunteer was an actor involved in “a political setup” to undermine his party.,https://www.smh.com.au/world/europe/rishi-sunak-hurt-and-angry-over-reform-volunteer-s-racial-slur-20240629-p5jpr8.html?ref=rss&utm_medium=rss&utm_source=rss_feed,The Sydney Morning Herald,https://static.ffx.io/images/$zoom_0.2507%2C$multiply_0.7554%2C$ratio_1.777778%2C$width_1059%2C$x_282%2C$y_0/t_crop_custom/q_86%2Cf_auto/144e567fa4e8350359ab481d750cc675bdcd3429,general,en,au,2024-06-29T01:12:38+00:00,politics
Alistair Smout and Andrew MacAskill,Rishi Sunak hurt and angry over Reform volunteer’s racial slur,Nigel Farages said he was dismayed by the language but later said the volunteer was an actor involved in “a political setup” to undermine his party.,https://www.watoday.com.au/world/europe/rishi-sunak-hurt-and-angry-over-reform-volunteer-s-racial-slur-20240629-p5jpr8.html?ref=rss&utm_medium=rss&utm_source=rss_world,watoday,https://static.ffx.io/images/$zoom_0.2507%2C$multiply_0.7554%2C$ratio_1.777778%2C$width_1059%2C$x_282%2C$y_0/t_crop_custom/q_86%2Cf_auto/144e567fa4e8350359ab481d750cc675bdcd3429,general,en,au,2024-06-29T01:12:38+00:00,politics
Alistair Smout and Andrew MacAskill,Rishi Sunak hurt and angry over Reform volunteer’s racial slur,Nigel Farages said he was dismayed by the language but later said the volunteer was an actor involved in “a political setup” to undermine his party.,https://www.brisbanetimes.com.au/world/europe/rishi-sunak-hurt-and-angry-over-reform-volunteer-s-racial-slur-20240629-p5jpr8.html?ref=rss&utm_medium=rss&utm_source=rss_feed,Brisbane Times,https://static.ffx.io/images/$zoom_0.2507%2C$multiply_0.7554%2C$ratio_1.777778%2C$width_1059%2C$x_282%2C$y_0/t_crop_custom/q_86%2Cf_auto/144e567fa4e8350359ab481d750cc675bdcd3429,general,en,au,2024-06-29T01:12:38+00:00,politics
Alistair Smout and Andrew MacAskill,Rishi Sunak hurt and angry over Reform volunteer’s racial slur,Nigel Farages said he was dismayed by the language but later said the volunteer was an actor involved in “a political setup” to undermine his party.,https://www.brisbanetimes.com.au/world/europe/rishi-sunak-hurt-and-angry-over-reform-volunteer-s-racial-slur-20240629-p5jpr8.html?ref=rss&utm_medium=rss&utm_source=rss_world,brisbanetimes,https://static.ffx.io/images/$zoom_0.2507%2C$multiply_0.7554%2C$ratio_1.777778%2C$width_1059%2C$x_282%2C$y_0/t_crop_custom/q_86%2Cf_auto/144e567fa4e8350359ab481d750cc675bdcd3429,general,en,au,2024-06-29T01:12:38+00:00,politics
Alistair Smout and Andrew MacAskill,Rishi Sunak hurt and angry over Reform volunteer’s racial slur,Nigel Farages said he was dismayed by the language but later said the volunteer was an actor involved in “a political setup” to undermine his party.,https://www.theage.com.au/world/europe/rishi-sunak-hurt-and-angry-over-reform-volunteer-s-racial-slur-20240629-p5jpr8.html?ref=rss&utm_medium=rss&utm_source=rss_feed,The Age,https://static.ffx.io/images/$zoom_0.2507%2C$multiply_0.7554%2C$ratio_1.777778%2C$width_1059%2C$x_282%2C$y_0/t_crop_custom/q_86%2Cf_auto/144e567fa4e8350359ab481d750cc675bdcd3429,general,en,au,2024-06-29T01:12:38+00:00,politics
AP News,Bolivia’s leader says the general accused of leading failed coup wanted to take over as president,"Bolivian President Luis Arce says a former general had intended to take over the government and become president in a failed coup, and he denied that the Andean nation was experiencing an economic crisis. In an interview with The Associated Press, the embattled leader denied once again that Wednesday’s attack on the government palace was a “self-coup” designed to garner him political points. “I didn’t escape, I stayed to defend democracy,” Arce said. About ongoing political spats with his one-time ally Evo Morales, Arce said “we’ve been politically attacked” by Morales...",https://www.mymotherlode.com/news/latin/3383507/bolivias-leader-says-the-general-accused-of-leading-failed-coup-wanted-to-take-over-as-president.html,mymotherlode,,general,en,us,2024-06-29T01:08:37+00:00,politics
,Debate Refuels Concerns Over Biden’s Health – OpEd,"By Dalia Al-Aqidi The presidential debate between Joe Biden and Donald Trump has left an indelible mark on the political landscape, stirring a mix of disappointment, shock, and concern. It was disheartening to witness the leader of the US struggling to articulate his thoughts clearly.The debate’s agenda was broad, encompassing critical issues such as abortion rights, immigration policies, and international relations with Ukraine and the Middle East.From the outset, Biden’s performance was uneven. At 81, his halting speech and occasional raspy voice, attributed by his campaign to a cold, did...",https://api.follow.it/track-rss-story-click/v3/Qw9d99ManWfWGCjmKoDd65ONpYks2fGs,eurasiareview,,general,en,us,2024-06-29T01:02:24+00:00,politics
,"France’s Mysterious Two-Round Voting System, Explained – Analysis","By Théo Bourgery-Gonse(EurActiv) &#8212; French voters go to the polls this Sunday (30 June) for the first round of snap legislative elections – but the country’s two-round first-past-the-post system makes projections complex and political tactics numerous, ultimately benefiting the surging far-right.On 9 June, President Emmanuel Macron announced he would;dissolve the National Assembly;by calling snap legislative elections – a constitutional prerogative only he can use – after his Ensemble centrist coalition received a trouncing from the far-right Rassemblement national (RN...",https://api.follow.it/track-rss-story-click/v3/Qw9d99ManWcBMQX8LlqQIvnNuMIJyU22,eurasiareview,,general,en,us,2024-06-29T00:59:43+00:00,politics
"Jakob Rodgers, Shomik Mukherjee",FBI raids: Obscure Oakland homebuilder highlights ties between Duongs and East Bay’s messy politics,"News about a small Oakland homebuilder adds to the questions about the Duong family, the influential Vietnamese business leaders and political donors at the center of last week's FBI raids.",https://www.mercurynews.com/2024/06/28/fbi-raids-obscure-oakland-homebuilder-highlights-ties-between-duongs-and-east-bays-messy-politics/,mercurynews,https://www.mercurynews.com/wp-content/uploads/2024/06/SJM-L-RAIDSEVO-0629-10.jpg?w=1400px&strip=all,general,en,us,2024-06-29T00:38:14+00:00,politics
Postmedia News,LILLEY UNLEASHED: Accusations of racism at city councillor in Yonge-Dundas Sq. renaming debate ,WATCH BELOW: Sun political columnist Brian Lilley talks with Toronto City Councillor Brad Bradford about a colleague on council levelling accusations of racism towards him when he asked about the cost and process of the renaming of Yonge-Dundas Square to Sankofa Square. What do YOU think? Tweet and Facebook us! And don’t forget to subscribe [&#8230;],https://torontosun.com/news/lilley-unleashed-accusations-of-racism-at-city-councillor-in-yonge-dundas-sq-renaming-debate,m,,general,en,us,2024-06-29T00:36:52+00:00,politics
Sarah Karp,CTU endorses slate of candidates for Chicago’s first elected school board,"The Chicago Teachers Union is announcing its endorsements for Chicago’s first elected school board — a major step for the powerful political force that helped to elect the city’s mayor.The CTU is not publicly saying how much it will devote to support these candidates, and so far, none of the candidates have reported contributions from the CTU to the Illinois Board of Elections. In addition to money, the union has about 30,000 members who have been key in knocking on doors and getting out the vote.The endorsements come less than a week after the deadline to file petitions to get on the...",https://chicago.suntimes.com/education/2024/06/27/ctu-endorses-slate-of-candidates-for-chicagos-first-elected-school-board,suntimes,,general,en,us,2024-06-29T00:28:46+00:00,politics
,"Rock band Idles lead Glastonbury crowd in chanting 'f*** the king', discusses Gaza and sticks the boot into Joe Biden while Charlotte Church sings 'free Palestine' as festival turns political",Rock band Idles led the Glastonbury crowd in chanting 'f*** the king' as the festival turned political on Friday night.,https://www.dailymail.co.uk/news/article-13581789/Rock-band-Idles-lead-Glastonbury-crowd-chanting-f-king-discusses-Gaza-sticks-boot-Joe-Biden-Charlotte-Church-sings-free-Palestine-festival-turns-political.html?ns_mchannel=rss&ito=1490&ns_campaign=1490,dailymail,https://i.dailymail.co.uk/1s/2024/06/29/00/86718143-0-image-m-34_1719617241116.jpg,general,en,us,2024-06-29T00:28:32+00:00,politics
CNN Newssource,SXSW decision to end US Army sponsorship spotlights political tightrope for festival organizers amid Israel-Hamas war,"By Elizabeth Wagmeister, CNN (CNN) &#8212; At the South by Southwest festival earlier this year, dozens of indie artists and speakers cancelled appearances in protest of the event’s sponsorship from US military and defense contractors amid the war between Israel and Hamas. SXSW organizers in March expressed support for the right of artists to express “free speech,”The post SXSW decision to end US Army sponsorship spotlights political tightrope for festival organizers amid Israel-Hamas war appeared first on KRDO.",https://krdo.com/news/2024/06/28/sxsw-decision-to-end-us-army-sponsorship-spotlights-political-tightrope-for-festival-organizers-amid-israel-hamas-war/,krdo,,general,en,us,2024-06-29T00:12:05+00:00,politics
AP News,"Some cities facing homelessness crisis applaud Supreme Court decision, while others push back","San Francisco’s mayor says the decision by the U.S. Supreme Court allowing cities to enforce bans on sleeping outside in public spaces will allow the city to begin clearing homeless encampments that have plagued the city. The Democratic mayor applauded the ruling Friday. But the ruling was not welcomed everywhere and some cities, such as Seattle, said their approach to encampments will not change. The case is the most significant on the issue to come before the high court in decades and comes as cities across the country have wrestled with the politically complicated issue of how to deal with...",https://www.mymotherlode.com/news/national/3383487/some-cities-facing-homelessness-crisis-applaud-supreme-court-decision-while-others-push-back.html,mymotherlode,,general,en,us,2024-06-29T00:10:17+00:00,politics
Joe Kukura,"Alleged ‘Straw Donor’ in Sheng Thao Controversy Had His Home Shot At, and Was Allegedly Beaten Up","A minor figure in the expanding political storm over the Sheng Thao FBI raid says he’s had some major harassment and violence directed at him, and shots were fired at his home just days before the raid.",https://sfist.com/2024/06/28/alleged-straw-donor-in-sheng-thao-controversy-had-his-home-shot-at-and-was-allegedly-beaten-up/,sfist,https://img.sfist.com/2024/06/GettyImages-2151163507-1.jpg,general,en,us,2024-06-29T00:07:49+00:00,politics
Postmedia News,"EDITORIAL: Two leaders, one message — it’s time to move on","The hardest thing in politics is to speak truth to power. That’s especially so if a leader is arrogant, egotistical &#8211; or cognitively impaired. This week, two world leaders got strong messages that it’s time to move on. The messages didn&#8217;t come from strategists or pundits. It was voters in the downtown Toronto riding of [&#8230;]",https://torontosun.com/opinion/editorials/editorial-two-leaders-one-message-its-time-to-move-on,torontosun,,general,en,us,2024-06-28T22:48:47+00:00,politics
Cameron Macdonald,Fauci event in Marin draws fans and foes,"The former director of the National Institute of Allergy and Infectious Diseases stopped in San Rafael to discuss the coronavirus pandemic, politics and his new memoir.",https://www.marinij.com/2024/06/28/fauci-event-in-marin-draws-fans-and-foes/,marinij,https://www.marinij.com/wp-content/uploads/2024/06/MIJ-L-FAUCI-0620-01.jpg?w=1400px&strip=all,general,en,us,2024-06-28T22:36:44+00:00,politics
NewsReports Staff,Cambodian leader endorses controversial messaging app,"Cambodian leader Hun Sen has publicly backed a Cambodian-made messaging app, CoolApp, causing apprehension among critics who fear the tool may be weaponized to monitor and control political discussions. Sen sees CoolApp as an instrument to bolster national security and defend Cambodia’s information infrastructure against foreign intrusion. The endorsement has sparked attention and controversy. Critics [&#8230;]The post Cambodian leader endorses controversial messaging app appeared first on NewsReports.",https://www.newsreports.com/cambodian-leader-endorses-controversial-messaging-app/,appolicious,,general,en,us,2024-06-28T22:22:00+00:00,politics
Jakob Rodgers,"Oakland political operative attacked twice in recent months, including at address raided by FBI last week",Mario Juarez is a longtime a political operative and two-time Oakland council candidate whose recent campaign dealings have drawn the attention of Alameda County prosecutors and the state’s political watchdog.,https://www.mercurynews.com/2024/06/28/oakland-political-operative-attacked-twice-in-recent-months-including-at-address-raided-by-fbi-last-week/,mercurynews,https://www.mercurynews.com/wp-content/uploads/2018/07/Dellums_20.jpg?w=1400px&strip=all,general,en,us,2024-06-28T22:07:30+00:00,politics
Chronicle Editor,Government to tackle those instigating unrest,"Mukudzei Chingwere, Harare Bureau THE Government has warned unruly political formations, politicians and ill-meaning civil society organisations against “choreographed theatrics” aimed at instigating anarchy and despondency in the country. Acting Minister of Home Affairs and Cultural Heritage Dr Jenfan Muswere issued the warning in Harare yesterday, saying Government systems were oiled and on alert to deal [&#8230;]",https://www.chronicle.co.zw/government-to-tackle-those-instigating-unrest/,The Chronicle,,general,en,gh,2024-06-28T22:05:32+00:00,politics
Dave Pollard,STOSSEL: Interviewing a candidate who cares about freedom,"Former president Donald Trump spoke at the Libertarian Party convention, asking delegates to vote for him, promising, &#8220;I will put a libertarian in my Cabinet!&#8221; But Libertarians nominated Chase Oliver instead. Unlike most political candidates, Oliver learned about the world by working regular jobs. &#8220;My first job was dishwasher,&#8221; he tells me. &#8220;But then I [&#8230;]",https://torontosun.com/opinion/columnists/stossel-interviewing-a-candidate-who-cares-about-freedom,torontosun,,general,en,us,2024-06-28T21:26:10+00:00,politics
Letters to the Editor,Don't give up on Joe Biden,"It’s too late for Hunter S. Thompson to write a sequel to his book “Fear and Loathing on the Campaign Trail.” If it weren’t, I can only imagine what he would think of those on the fringe of the Democratic Party calling for an open convention after President Biden’s debate performance on Thursday night. It’s bizarre to see said Democrats forget a basic political lesson at this crucial moment — always close ranks around the successful incumbent.Some Democrats, who haven’t learned from the damage Ted Kennedy’s primary challenge dealt to President Carter in 1980, can’t help but...",https://chicago.suntimes.com/letters-to-the-editor/2024/06/28/president-biden-donald-trump-presidential-debate-illinois-slavery-southwest-side-white-sox-letters,suntimes,,general,en,us,2024-06-28T21:18:44+00:00,politics
Sydney St. Claire,Reaction to Biden after presidential debate,"LEXINGTON, Ky. (ABC36 NEWS NOW) &#8211; Reaction coming swiftly on after Thursday&#8217;s first presidential debate. There are just five months until the 2024 presidential election. According to political consultant Jared Smith, Thursday&#8217;s debate did not seem to go in President Joe Biden&#8217;s favor. &#8220;I thought the debate prep was a mispractice of a campaign with how Biden did it,&#8221; said...",https://www.wtvq.com/reaction-to-biden-after-presidential-debate/,wtvq,,general,en,us,2024-06-28T21:18:08+00:00,politics
