source,author,title,description,url,urlToImage,publishedAt,content,topic
"{'id': None, 'name': 'The Daily Caller'}",Jennifer Nuelle,University Donors Feel ‘Betrayed’ Scholarships Can No Longer Be Based On Race,"University of Missouri (MU) donors stated they feel ""betrayed"" that they can no longer keep white students from applying to minority-related scholarships.",https://dailycaller.com/2024/06/14/university-donors-feel-betrayed-scholarships-no-longer-based-ace/,https://cdn01.dailycaller.com/wp-content/uploads/2024/06/GettyImages-73507677-scaled-e1718391793587.jpg,2024-06-14T21:49:06Z,"University of Missouri donors voiced feelings of dismay that they can no longer keep white students from applying for minority-related scholarships, according to an article Inside Higher Ed published… [+3903 chars]",politics
"{'id': 'time', 'name': 'Time'}",Harry Booth and Tharin Pillay,Trump Worries AI Deepfakes Could Trigger Nuclear War,"Former President Donald Trump discussed with Logan Paul how AI deepfakes could cause nuclear war, and how America should respond.",https://time.com/6988935/trump-worries-ai-deepfakes-trigger-nuclear-war/,https://api.time.com/wp-content/uploads/2024/06/Trump-AI.jpg?quality=85&w=1200&h=628&crop=1,2024-06-14T21:47:04Z,"Former President Donald Trump shared his mixed feelings on artificial intelligence with YouTuber Logan Paul Thursday, describing the technology as a superpower that writes beautifully while also call… [+3775 chars]",politics
"{'id': None, 'name': 'UN News'}",United Nations,"Intolerance, Hate Speech Often Very Cause of Wars, Conflicts, Speaker Tells Security Council","Violence often starts with words — words of hatred that spread intolerance, divide societies, and promote and endorse discrimination, a senior United Nations official told the Security Council today, as members examined the international community’s response …",https://press.un.org/en/2024/sc15731.doc.htm,,2024-06-14T21:47:00Z,"Violence often starts with words words of hatred that spread intolerance, divide societies, and promote and endorse discrimination, a senior United Nations official told the Security Council today, a… [+21922 chars]",politics
"{'id': None, 'name': 'Politicalwire.com'}",Taegan Goddard,Trump’s Remarks Cap Chaotic Week for GOP on Abortion,"“Donald Trump on Thursday told Republicans to talk more about abortion. But earlier this week, at a gathering of staunchly anti-abortion Southern Baptists, Trump didn’t mention the word — opting instead to talk of defending ‘innocent life,’” Politico reports.…",https://politicalwire.com/2024/06/14/trumps-remarks-cap-chaotic-week-for-gop-on-abortion/,https://politicalwire.com/wp-content/uploads/2018/02/PW-podcast-logo.jpg,2024-06-14T21:42:49Z,"“There are a lot of blogs and news sites claiming to understand politics, but only a few actually do. Political Wire is one of them.”
 Chuck Todd, host of “Meet the Press”
“Concise. Relevant. To th… [+594 chars]",politics
"{'id': None, 'name': 'NPR'}",NPR,Could the U.K. election mean an off-ramp from personality politics?,"The year 2016 was one of several moments in recent history where the American and British political atmospheres seemed to run in parallel. Since 2016, right-wing political movements in Europe and the U.S. continue to show strength.
But as the U.K. gears up fo…",https://www.npr.org/2024/06/14/1198912636/uk-election-swing-left-power-shift-tories-sunak-july-election-analysis,https://media.npr.org/assets/img/2024/06/14/ap23191406641709_wide-98deb2ff9a7d2efd30e9ba20a74fe0eb8067dbef.jpg?s=1400&c=100&f=jpeg,2024-06-14T21:42:19Z,"Britain's Prime Minister Rishi Sunak meets with U.S. President Joe Biden at 10 Downing Street in London, Monday, July 10, 2023.
Susan Walsh/AP
The year 2016 was one of several moments in recent his… [+860 chars]",politics
"{'id': None, 'name': 'Freerepublic.com'}",The Holy Bible (KJV),Revelation Ch. 16 and 2 Corinthians Ch. 12,"""And lest I should be exalted above measure through the abundance of the revelations, there was given to me a thorn in the flesh, the messenger of Satan to buffet me, lest I should be exalted above measure. ""For this thing I besought the Lord thrice, that it …",https://freerepublic.com/focus/f-religion/4244394/posts,,2024-06-14T21:40:39Z,"Skip to comments.
Revelation Ch. 16 and 2 Corinthians Ch. 12The Holy Bible (KJV) ^Posted on 06/14/2024 2:40:39 PM PDT by Faith Presses On
""And lest I should be exalted above measure through the abu… [+7450 chars]",politics
"{'id': None, 'name': 'Freerepublic.com'}",Daily Mail,"EXCLUSIVE Hunter Biden's not important. But covering his gun trial and infamous laptop showed the glaring hypocrisy and lies by dad Joe KNEW about his son's crimes and is suspected of involvement in his shady foreign deals, says JOSH BOSWELL","I was the first journalist to authenticate Hunter Biden's laptop using top cyber forensics experts back in early 2021. I've followed his story ever since then. Now that he has been convicted of three felonies, the most important thing to know is this: Hunter …",https://freerepublic.com/focus/f-news/4244393/posts,,2024-06-14T21:39:56Z,"Skip to comments.
EXCLUSIVE Hunter Biden's not important. But covering his gun trial and infamous laptop showed the glaring hypocrisy and lies by dad Joe KNEW about his son's crimes and is suspected… [+6346 chars]",politics
"{'id': None, 'name': 'The Daily Caller'}",Jason Cohen,"Ex-Hillary Clinton Spox Guffaws, Says ‘Black Voters Are Not Gonna Vote For Byron Donalds’ As Trump’s VP",inney on Friday laughed while asserting black voters will not cast any ballots for Donalds if Trump selects him to be his vice presidential pick.,https://dailycaller.com/2024/06/14/ex-hillary-clinton-spox-guffaws-says-black-voters-are-not-gonna-vote-byron-donalds-trumps-vp/,https://cdn01.dailycaller.com/wp-content/uploads/2024/06/Screen-Shot-2024-06-14-at-5.14.52-PM-e1718399772267.png,2024-06-14T21:36:28Z,Democratic strategist and former Hillary Clinton spokesperson Karen Finney on Friday laughed while asserting black voters will not cast any ballots for Republican Florida Rep. Byron Donalds if former… [+2827 chars],politics
"{'id': None, 'name': 'Japan Today'}",,"Supreme Court strikes down Trump-era ban on bump stocks, gun accessories used in 2017 Vegas massacre","The Supreme Court on Friday struck down a Trump-era ban on bump stocks, a rapid-fire gun accessory that was used in the deadliest mass shooting in modern U.S. history. The high court's conservative majority found that the Trump administration did not follow f…",https://japantoday.com/category/world/supreme-court-strikes-down-trump-era-ban-on-bump-stocks-gun-accessories-used-in-2017-vegas-massacre,,2024-06-14T21:33:34Z,"The Supreme Court on Friday struck down a Trump-era ban on bump stocks, a rapid-fire gun accessory that was used in the deadliest mass shooting in modern U.S. history.
The high court's conservative … [+4955 chars]",politics
"{'id': None, 'name': 'BBC News'}",,Dáithí's Law campaigner in King's birthday honours,"Mairtin Mac Gabhann says it “was not easy"" to accept but that his son's campaign is bigger than politics.",https://www.bbc.com/news/articles/c0wwx21rng6o,https://ichef.bbci.co.uk/news/1024/branded_news/80ea/live/2504e730-2a85-11ef-a3c6-1d848887354f.jpg,2024-06-14T21:33:13Z,"The father of the child who inspired a major change in organ donation rules is among those from Northern Ireland named in the King's Birthday Honours list.
Mairtin Mac Gabhann said it was not an eas… [+15545 chars]",politics
"{'id': None, 'name': 'Patheos'}",Fred Clark,"Too many halos, not enough heroes","Asking anybody to ""pledge allegiance"" is creepy. Full stop. Also: ""There is no The Media,"" and Nazi crank magnetism.",https://www.patheos.com/blogs/slacktivist/2024/06/14/too-many-halos-not-enough-heroes/,https://wp-media.patheos.com/blogs/sites/52/2024/06/SWTE22.jpg,2024-06-14T21:32:38Z,"Thomas Bremers Flag Day column on How reciting the Pledge of Allegiance became a sacred, patriotic ritual includes some fine things. Theres a nice introduction to Robert Bellahs concept of civil reli… [+4688 chars]",politics
"{'id': None, 'name': 'Japan Today'}",,Sunak warns: A vote for Farage gifts Labour the election,"British Prime Minister Rishi Sunak warned on Friday that a vote for Nigel Farage's Reform UK party would hand electoral victory to Labour, after a poll put the right-wing group ahead of Sunak's Conservatives for the first time. Farage is one of Britain's most…",https://japantoday.com/category/world/uk-pm-sunak-warns-a-vote-for-farage-gifts-labour-the-election,,2024-06-14T21:32:36Z,"British Prime Minister Rishi Sunak warned on Friday that a vote for Nigel Farage's Reform UK party would hand electoral victory to Labour, after a poll put the right-wing group ahead of Sunak's Conse… [+2772 chars]",politics
"{'id': None, 'name': 'Slashdot.org'}",feedfeeder,Ctrl-Alt-Speech: Moderating Politics & Politicizing Moderation,"Ctrl-Alt-Speech is a weekly podcast about the latest news in online speech, from Mike Masnick and Everything in Moderations Ben Whitelaw. Subscribe now on Apple Podcasts, Overcast, Spotify, Pocket Casts, YouTube, or your podcast app of choice — or go straight…",https://slashdot.org/firehose.pl?op=view&amp;id=174148181,,2024-06-14T21:32:03Z,Sign up for the Slashdot newsletter! OR check out the new Slashdot job board to browse remote jobs or jobs in your areaDo you develop on GitHub? You can keep using GitHub but automatically sync your … [+268 chars],politics
"{'id': None, 'name': 'BBC News'}",,"Alan Bates knighted, as Staunton and Emin made dames among Birthday Honours","Gordon Brown, 3 Dads Walking and Susie Dent also given awards in the King's Birthday honours.",https://www.bbc.com/news/articles/c511l0j4l2po,https://ichef.bbci.co.uk/news/1024/branded_news/5750/live/860f4040-2a88-11ef-a3c6-1d848887354f.jpg,2024-06-14T21:30:02Z,"By John Hand and Ben Fell, BBC News
Dame Imelda Staunton, Sir Alan Bates and Dame Tracey Emin can start using their new titles immediately
Alan Bates - the former sub-postmaster who successfully ca… [+9932 chars]",politics
"{'id': None, 'name': 'Japan Today'}",,"Experts, activists slam G7 on climate","The Group of Seven rich democracies have failed to deliver significant new progress on climate during a summit in Italy, instead reiterating previous commitments, experts and activists said Friday. &quot;The G7 leaders could have stayed at home. No new commit…",https://japantoday.com/category/features/environment/experts-activists-slam-%27pointless%27-g7-on-climate,,2024-06-14T21:28:50Z,"The Group of Seven rich democracies have failed to deliver significant new progress on climate during a summit in Italy, instead reiterating previous commitments, experts and activists said Friday.
… [+3667 chars]",politics
"{'id': None, 'name': 'Techdirt'}",Leigh Beadon,Ctrl-Alt-Speech: Moderating Politics & Politicizing Moderation,"Ctrl-Alt-Speech is a weekly podcast about the latest news in online speech, from Mike Masnick and Everything in Moderation‘s Ben Whitelaw. Subscribe now on Apple Podcasts, Overcast, Spotify, Pocket Casts, YouTube, or your podcast app of choice — or go straigh…",https://www.techdirt.com/2024/06/14/ctrl-alt-speech-moderating-politics-politicizing-moderation/,https://www.techdirt.com/wp-content/themes/techdirt/assets/images/td-rect-logo-white.png,2024-06-14T21:28:13Z,"from the ctrl-alt-speech dept
Ctrl-Alt-Speech is a weekly podcast about the latest news in online speech, from Mike Masnick and Everything in Moderation‘s Ben Whitelaw. 
Subscribe now on Apple Podc… [+504 chars]",politics
"{'id': None, 'name': 'Freerepublic.com'}",nbclosangeles,Why Silver Lake took down a couple of No U-turn signs from 1990s,Street signs that officials said previously targeted LGBTQ community members were taken down from a Silver Lake neighborhood Monday. The signs that read “No Cruising” and prohibited U-turns were installed in 1997 when neighbors complained about gay men hangin…,https://freerepublic.com/focus/f-news/4244389/posts,,2024-06-14T21:26:17Z,"Skip to comments.
Why Silver Lake took down a couple of No U-turn signs from 1990snbclosangeles ^
 | 06/10/2024
 | Helen Jeong 
Posted on 06/14/2024 2:26:17 PM PDT by ChicagoConservative27
Stree… [+5147 chars]",politics
"{'id': None, 'name': 'Politicalwire.com'}",Taegan Goddard,Supreme Court’s Pace Will Produce Pileup of Rulings,"“The Supreme Court has been moving at a sluggish pace in issuing decisions this term, entering the second half of June with more than 20 left to go. That is not terribly different from the last two terms, when the pace at which the court issued decisions star…",https://politicalwire.com/2024/06/14/supreme-courts-pace-will-produce-pileup-of-rulings/,https://politicalwire.com/wp-content/uploads/2018/02/PW-podcast-logo.jpg,2024-06-14T21:26:00Z,"“There are a lot of blogs and news sites claiming to understand politics, but only a few actually do. Political Wire is one of them.”
 Chuck Todd, host of “Meet the Press”
“Concise. Relevant. To th… [+594 chars]",politics
"{'id': 'bbc-news', 'name': 'BBC News'}",,Parties agree on South Africa unity government,"South Africa's governing African National Congress (ANC) and the main opposition Democratic Alliance (DA) have agreed to form a government of national unity, along with two smaller opposition parties. We look at the state of politics in South Africa as the on…",https://www.bbc.co.uk/programmes/w172zb8x6c8x4qh,https://ichef.bbci.co.uk/images/ic/1200x675/p0j4bx6b.jpg,2024-06-14T21:26:00Z,"South Africa's governing African National Congress (ANC) and the main opposition Democratic Alliance (DA) have agreed to form a government of national unity, along with two smaller opposition parties… [+465 chars]",politics
"{'id': None, 'name': 'Politicalwire.com'}",Taegan Goddard,Neo-Nazi Group Designated as Terrorist Organization,"“The State Department on Friday designated the largest neo-Nazi group in Sweden and its leaders as terrorists, only the second time it has applied the label to a white supremacist group known for a long history of violence,” the New York Times reports.“The de…",https://politicalwire.com/2024/06/14/neo-nazi-group-designated-as-terrorist-organization/,https://politicalwire.com/wp-content/uploads/2018/02/PW-podcast-logo.jpg,2024-06-14T21:24:31Z,"“There are a lot of blogs and news sites claiming to understand politics, but only a few actually do. Political Wire is one of them.”
 Chuck Todd, host of “Meet the Press”
“Concise. Relevant. To th… [+594 chars]",politics
"{'id': None, 'name': 'Crooksandliars.com'}",Brett Wilkins,Remember Mick Mulvaney? He's Calling For A Trumpy 'Revenge-a-Thon',"""What's wrong with a little revenge?""


That's what Mick Mulvaney, former President Donald Trump's one-time acting White House chief of staff—who consumer advocate Ralph Nader once described as the twice-impeached Republican's ""sadist-in-chief""—asked Tuesday …",https://crooksandliars.com/2024/06/remember-mick-mulvaney-hes-calling-trumpy,https://crooksandliars.com/files/primary_image/24/06/gettyimages-819683488.jpg,2024-06-14T21:23:29Z,"""What's wrong with a little revenge?""
That's what Mick Mulvaney, former President Donald Trump's one-time acting White House chief of staffwho consumer advocate Ralph Nader once described as the twi… [+3323 chars]",politics
"{'id': None, 'name': 'Crooksandliars.com'}",Tengrain,Republicans Really Want A Trump Dynasty With Prince Don Jr,"With a serious face, Axios morning email thingie reports that Junior Mints is a king maker in MAGAmerica:
Donald Trump Jr. has become a behind-the-scenes power broker in GOP politics — a guy whose endorsements are coveted as much as anyone except his father’s…",https://crooksandliars.com/2024/06/republicans-really-want-trump-dynasty,https://crooksandliars.com/files/primary_image/24/06/junior_high_don.jpg,2024-06-14T21:22:41Z,"With a serious face, Axios morning email thingie reports that Junior Mints is a king maker in MAGAmerica:
Donald Trump Jr. has become a behind-the-scenes power broker in GOP politics a guy whose end… [+1054 chars]",politics
"{'id': None, 'name': 'Slashdot.org'}",msmash,AI Candidate Running For Parliament in the UK Says AI Can Humanize Politics,"An artificial intelligence candidate is on the ballot for the United Kingdom's general election next month. From a report: ""AI Steve,"" represented by Sussex businessman Steve Endacott, will appear on the ballot alongside non-AI candidates running to represent…",https://politics.slashdot.org/story/24/06/14/2011209/ai-candidate-running-for-parliament-in-the-uk-says-ai-can-humanize-politics,https://a.fsdn.com/sd/topics/ai_64.png,2024-06-14T21:22:00Z,"""AI Steve,"" represented by Sussex businessman Steve Endacott, will appear on the ballot alongside non-AI candidates running to represent constituents in the Brighton Pavilion area of Brighton and Hov… [+990 chars]",politics
"{'id': None, 'name': 'Chrislakin.blog'}",Chris Lakin,Spaced repetition for teaching two-year olds how to read,"This father has been using spaced repetition (Anki) to teach his children how to read several years earlier than average. Michael Nielsen and Gwern tweeted about the interesting case of a reddit user, u/caffeine314 (henceforth dubbed “CoffeePie”), who has bee…",https://chrislakin.blog/p/spaced-repetition-for-teaching-two,"https://substackcdn.com/image/youtube/w_728,c_limit/8U-Lza__Kko",2024-06-14T21:20:37Z,"This father has been using spaced repetition (Anki) to teach his children how to read several years earlier than average.
Michael Nielsen and Gwern1 tweeted about the interesting case of a reddit us… [+7691 chars]",politics
"{'id': None, 'name': 'Politicalwire.com'}",Taegan Goddard,Garret Graves Won’t Run Again,"Rep. Garret Graves (R-LA) said “he will not run for reelection — ending months of questions about his political future after redistricting scrambled Louisiana's congressional map,” Politico reports.“The decision comes as Graves, a close ally of former Speaker…",https://politicalwire.com/2024/06/14/garret-graves-wont-run-again/,https://politicalwire.com/wp-content/uploads/2018/02/PW-podcast-logo.jpg,2024-06-14T21:20:00Z,"“There are a lot of blogs and news sites claiming to understand politics, but only a few actually do. Political Wire is one of them.”
 Chuck Todd, host of “Meet the Press”
“Concise. Relevant. To th… [+594 chars]",politics
"{'id': None, 'name': 'Politicalwire.com'}",Taegan Goddard,Sunak Vows to Stay as MP If Tories Lose,"“Rishi Sunak said he would stay on as a member of Parliament for five years, the typical full-length term of a UK government, even if his Conservative Party is ousted from power in next month’s general election,” Bloomberg reports.",https://politicalwire.com/2024/06/14/sunak-vows-to-stay-as-mp-if-tories-lose/,https://politicalwire.com/wp-content/uploads/2018/02/PW-podcast-logo.jpg,2024-06-14T21:19:00Z,"“There are a lot of blogs and news sites claiming to understand politics, but only a few actually do. Political Wire is one of them.”
 Chuck Todd, host of “Meet the Press”
“Concise. Relevant. To th… [+594 chars]",politics
"{'id': None, 'name': 'New York Post'}",Victor Davis Hanson,How to tell that the West’s ‘pro-Palestinian’ protesters really only care about bashing Israel,What are the mobs in Washington defiling iconic federal statues with impunity and pelting policemen really protesting?,https://nypost.com/2024/06/14/opinion/wests-pro-palestine-protesters-only-want-to-bash-israel/,https://nypost.com/wp-content/uploads/sites/2/2024/06/pro-palestinian-protester-tries-grab-83801374-e1718399219937.jpg?quality=75&strip=all&w=1024,2024-06-14T21:17:28Z,"What are the mobs in Washington defiling iconic federal statues with impunity and pelting policemen really protesting?
What are the throngs in London brazenly swarming parks and rampaging in the str… [+5244 chars]",politics
"{'id': None, 'name': 'Minneapolis Star Tribune'}",Associated Press,Canadian auto parts billionaire Frank Stronach accused of sexually assaulting 3 complainants,"Austrian-Canadian auto parts billionaire Frank Stronach is accused of sexually assaulting three different complainants in alleged incidents that took place in Toronto and Aurora, Ontario, a court document filed this week shows.",https://www.startribune.com/canadian-auto-parts-billionaire-frank-stronach-accused-of-sexually-assaulting-3-complainants/600373665/,https://www.startribune.com/static/img/branding/logos/strib-social-card.png?d=1717510706,2024-06-14T21:17:02Z,"TORONTO Austrian-Canadian auto parts billionaire Frank Stronach is accused of sexually assaulting three different complainants in alleged incidents that took place in Toronto and Aurora, Ontario, a c… [+1336 chars]",politics
"{'id': None, 'name': '[Removed]'}",,[Removed],[Removed],https://removed.com,,1970-01-01T00:00:00Z,[Removed],politics
"{'id': None, 'name': 'Yahoo Entertainment'}",Associated Press,Canadian auto parts billionaire Frank Stronach accused of sexually assaulting 3 complainants,Austrian-Canadian auto parts billionaire Frank Stronach is accused of sexually assaulting three different complainants in alleged incidents that took place...,https://www.yahoo.com/news/canadian-auto-parts-billionaire-frank-211632568.html,https://s.yimg.com/ny/api/res/1.2/VbHRJtJP1MdqwBEcpxe1Rg--/YXBwaWQ9aGlnaGxhbmRlcjt3PTEyMDA7aD04MDA-/https://media.zenfs.com/en/ap.org/22d28e405e0d111517d7b69f037546f8,2024-06-14T21:16:32Z,"TORONTO (AP) Austrian-Canadian auto parts billionaire Frank Stronach is accused of sexually assaulting three different complainants in alleged incidents that took place in Toronto and Aurora, Ontario… [+1329 chars]",politics
"{'id': None, 'name': 'Bleeding Cool News'}",Rich Johnston,Bleeding Cool Presents: Image Comics Full September 2024 Solicits,"Image Comics' September 2024 solicits and solicitations have dropped with a new Creepshow volume, the return of Dead Eyes, the new Horizon Experiment from Pornsak Picketshote, Rachel and Terry Dodson, Knights Vs Samurai by David Dastmalchian and Federico Mele…",https://bleedingcool.com/comics/image-comics-september-2024-solicits/,https://bleedingcool.com/wp-content/uploads/2024/06/ISSUE31NEXTPHASE_FINAL-164-2000x1125.jpg,2024-06-14T21:16:10Z,"Posted in: Comics, Comics Publishers, Current News, Image, Walking Dead | Tagged: Creepshow, dead eyes, gi joe, spawn, transformers
Image Comics' September 2024 solicits with Knights Vs Samurai, The… [+50788 chars]",politics
"{'id': None, 'name': 'NPR'}","Asma Khalid, Don Gonyea","Politics Roundup: Trump on the Hill, older voters in Florida","Donald Trump returned to Capitol Hill for the first time since his supporters disrupted the peaceful transfer of power on Jan. 6, 2021. The event was a clear demonstration of how the party has coalesced entirely behind him.And voters over 50 are an essential …",https://www.npr.org/2024/06/14/1197956580/podcast-trump-on-the-hill-older-voters-in-florida,https://media.npr.org/assets/img/2024/06/14/landscape-1600x900px-47-_wide-e71908ed1f0d132bd1b491d6fb9f13b5880db3bd.png?s=1400&c=100&f=png,2024-06-14T21:15:39Z,"Donald Trump returned to Capitol Hill for the first time since his supporters disrupted the peaceful transfer of power on Jan. 6, 2021. The event was a clear demonstration of how the party has coales… [+771 chars]",politics
"{'id': 'cnn', 'name': 'CNN'}",Marianne Garvey,Pat Sajak passes ‘Wheel of Fortune’ hosting duties to Ryan Seacrest,Ryan Seacrest will now be asking “Wheel of Fortune”contestants if they’d like to buy a vowel.,https://www.cnn.com/2024/06/14/entertainment/wheel-of-fortune-pat-sajak-ryan-seacrest/index.html,"https://media.cnn.com/api/v1/images/stellar/prod/screen-shot-2024-06-14-at-10-51-32-am.jpg?c=16x9&q=w_800,c_fill",2024-06-14T21:13:00Z,"Ryan Seacrest will now be asking Wheel of Fortunecontestants if theyd like to buy a vowel.
Pat Sajak has handed over hosting duties of the long-running game show to Seacrest, who will appear in new … [+926 chars]",politics
"{'id': None, 'name': 'Starpointllp.com'}",InsidePmts,eCom – Politics and Scenarios,"What are banks talking about this week? How did Apple’s announcement impact them? While 15bps on 2% of eCom GDV is a nuisance, 15bps on 15% of eComm GDV is an earthquake.  Continue reading →",https://blog.starpointllp.com/?p=6646,,2024-06-14T21:12:44Z,"Frank Young – Contributor
What are banks talking about this week? How did Apples announcement impact them? While 15bps on 2% of eCom GDV is a nuisance, 15bps on 15% of eComm GDV is an earthquake. 
… [+93 chars]",politics
"{'id': None, 'name': 'Freerepublic.com'}",CBS News,"North Texas man arrested, charged with threatening FBI agent after Hunter Biden verdict","LOCAL NEWS North Texas man arrested, charged with threatening FBI agent after Hunter Biden verdict texas By S.E. Jenkins Updated on: June 14, 2024 / 8:25 AM CDT / CBS Texas FORT WORTH – A North Texas man was arrested Thursday and charged with threatening an F…",https://freerepublic.com/focus/f-news/4244387/posts,,2024-06-14T21:11:37Z,"Skip to comments.
North Texas man arrested, charged with threatening FBI agent after Hunter Biden verdictCBS News ^
 | June 14, 2024
 | S.E. Jenkins
Posted on 06/14/2024 2:11:37 PM PDT by Coronal… [+2628 chars]",politics
