source,author,title,description,url,urlToImage,publishedAt,content,topic
"{'id': None, 'name': 'Minneapolis Star Tribune'}",DAVID KLEPPER,"Presidential election a prime target for foreign disinformation, intelligence officials say","U.S. officials who track disinformation campaigns say they have issued more warnings to political candidates, government leaders and others targeted by foreign groups in recent months as America's adversaries seek to influence the outcome of the 2024 election.",https://www.startribune.com/presidential-election-a-prime-target-for-foreign-disinformation-intelligence-officials-say/600373104/,https://www.startribune.com/static/img/branding/logos/strib-social-card.png?d=1717510706,2024-06-12T22:18:00Z,"WASHINGTON U.S. officials who track disinformation campaigns say they have issued more warnings to political candidates, government leaders and others targeted by foreign groups in recent months as A… [+3664 chars]",politics
"{'id': None, 'name': 'Lawyersgunsmoneyblog.com'}",Paul Campos,"Nolan Ryan, the backup quarterback, and Donald Trump",Andrew Gelman has an interesting analysis of my response to Nate Silver’s claims about what would happen if Napoleon had a B-52 at the Battle of Waterloo Joe Biden and/or Donald Trump were replaced on their respective presidential tickets before November’s el…,https://www.lawyersgunsmoneyblog.com/2024/06/nolan-ryan-the-backup-quarterback-and-donald-trump,https://s.hdnux.com/photos/01/15/47/16/20345787/4/rawImage.jpg,2024-06-12T22:17:46Z,"Andrew Gelman has an interesting analysis of my response to Nate Silver’s claims about what would happen if Napoleon had a B-52 at the Battle of Waterloo 
Joe Biden and/or Donald Trump were replaced… [+7396 chars]",politics
"{'id': None, 'name': 'Boston Herald'}",Associated Press,"Presidential election a prime target for foreign disinformation, intelligence officials say","By DAVID KLEPPER (Associated Press) WASHINGTON (AP) — U.S. officials who track disinformation campaigns say they have issued more warnings to political candidates, government leaders and others targeted by foreign groups in recent months as America’s adversar…",https://www.bostonherald.com/2024/06/12/presidential-election-a-prime-target-for-foreign-disinformation-intelligence-officials-say/,https://www.bostonherald.com/wp-content/uploads/2024/06/Election_2024_Foreign_Interfference_19547.jpg?w=1024&h=683,2024-06-12T22:17:26Z,"By DAVID KLEPPER (Associated Press)
WASHINGTON (AP) — U.S. officials who track disinformation campaigns say they have issued more warnings to political candidates, government leaders and others targ… [+3705 chars]",politics
"{'id': 'abc-news', 'name': 'ABC News'}",JULIE CARR SMYTH Associated Press,A closer-than-expected Ohio congressional race surprises Republicans and encourages Democrats,A political newcomer’s closer-than-expected finish in Tuesday’s special congressional election in Ohio surprised Republicans and jolted Democrats in a former bellwether state,https://abcnews.go.com/Politics/wireStory/closer-expected-ohio-congressional-race-surprises-republicans-encourages-111074155,https://i.abcnewsfe.com/a/784298e0-6f1b-419a-98a2-ebf4bff11a91/wirestory_0dfd1b1945cd162d03c277f194196fbb_16x9.jpg?w=1600,2024-06-12T22:14:42Z,"COLUMBUS, Ohio -- A political newcomer's closer-than-expected finish in Tuesday's special congressional election in Ohio surprised Republicans and jolted Democrats in a former bellwether state both p… [+2976 chars]",politics
"{'id': 'abc-news', 'name': 'ABC News'}",JULIE CARR SMYTH Associated Press,A closer-than-expected Ohio congressional race surprises Republicans and encourages Democrats,A political newcomer’s closer-than-expected finish in Tuesday’s special congressional election in Ohio surprised Republicans and jolted Democrats in a former bellwether state,https://abcnews.go.com/US/wireStory/closer-expected-ohio-congressional-race-surprises-republicans-encourages-111074154,https://i.abcnewsfe.com/a/784298e0-6f1b-419a-98a2-ebf4bff11a91/wirestory_0dfd1b1945cd162d03c277f194196fbb_16x9.jpg?w=1600,2024-06-12T22:14:41Z,"COLUMBUS, Ohio -- A political newcomer's closer-than-expected finish in Tuesday's special congressional election in Ohio surprised Republicans and jolted Democrats in a former bellwether state both p… [+2976 chars]",politics
"{'id': None, 'name': 'The Atlantic'}",Tom Nichols,Let’s Talk About Trump’s Gibberish,What the former president’s shark tirade says about American politics and media,https://www.theatlantic.com/politics/archive/2024/06/trump-sharks-las-vegas-rally-speech/678667/?utm_source=feed,,2024-06-12T22:12:45Z,"Sign up for The Decision, a newsletter featuring our 2024 election coverage.Perhaps the greatest trick Donald Trump ever pulled was convincing millions of people—and the American media—to treat his l… [+7000 chars]",politics
"{'id': 'cbc-news', 'name': 'CBC News'}",,Trudeau says he considered stepping down during marriage difficulties,Prime Minister Justin Trudeau said in a recent podcast that he considered walking away from the job last year as his marriage began to fracture.,https://www.cbc.ca/news/politics/trudeau-considered-stepping-down-1.7233185,https://i.cbc.ca/1.6925258.1690993280!/fileImage/httpImage/image.jpg_gen/derivatives/16x9_620/mexico-canada.jpg,2024-06-12T22:10:33Z,"Prime Minister Justin Trudeau said in a recent podcast that he considered walking away from the job last year as his marriage began to fracture.
Trudeau and his wife, Sophie Grégoire Trudeau, announ… [+3246 chars]",politics
"{'id': None, 'name': 'Ms. Magazine'}",Aviva Dove-Viebahn,‘Vote for Abortion’ Bus Tour and Rally Show the Power of Grassroots Organizing,"An extraordinary grassroots activation took place this past Saturday at 8 a.m., when two buses full of organizers, activists, celebrities, politicians, doctors and influencers braved the Phoenix heat—which would top out at 107 degrees by the afternoon—to set …",https://msmagazine.com/2024/06/12/abortion-bus-tour-rally-arizona/,https://msmagazine.com/wp-content/uploads/2024/06/Party-Bus-scaled.jpg,2024-06-12T22:08:22Z,"Influencers, content creators and activists hand out free Julie emergency contraception to a party bus outside the Maya Day Club in Scottsdale, Ariz. on June 8, 2024 during the Vote for Abortion bus … [+13164 chars]",politics
"{'id': None, 'name': 'Freerepublic.com'}",Washington Examiner,"Trump odds of winning hit new high, 19 points over Biden","The odds that former President Donald Trump will win back the White House have increased to a record high of 58%, according to political oddsmaker SportsHandle. Its latest election odds tracker of overseas betting on the race shows President Joe Biden trailin…",https://freerepublic.com/focus/f-news/4243937/posts,,2024-06-12T22:06:46Z,"Skip to comments.
Trump odds of winning hit new high, 19 points over BidenWashington Examiner ^
 | June 12, 2024 2:49 pm
 | Paul Bedard 
Posted on 06/12/2024 3:06:46 PM PDT by E. Pluribus Unum
T… [+3200 chars]",politics
"{'id': None, 'name': 'New York Post'}",Kirsten Fleming,"For the sake of America, Joey Chestnut and Nathan’s Hot Dogs must come to a peace agreement",It's time to squash the beef.,https://nypost.com/2024/06/12/us-news/joey-chestnut-and-nathans-hot-dogs-must-reach-peace-for-the-us/,https://nypost.com/wp-content/uploads/sites/2/2024/06/newspress-collage-vn7b0j1d1-1718218483107.jpg?quality=75&strip=all&1718204157&w=1024,2024-06-12T22:03:03Z,"Hot diggity dog, can we take another blow? This country was already protest weary, trial weary and deeply divided by Team USA’s Caitlin Clark snub.
Then on Tuesday, The Post’s Steve Cuozzo exclusive… [+4693 chars]",politics
"{'id': None, 'name': 'BBC News'}",,How could global turmoil affect the election in Scotland?,A lot has happened in the five years since the United Kingdom last went to the polls in a general election.,https://www.bbc.com/news/articles/clddgxgg12vo,https://ichef.bbci.co.uk/news/1024/branded_news/9c4a/live/893c91b0-28e3-11ef-b8b7-bbe991438f26.jpg,2024-06-12T22:02:03Z,"By James Cook, Scotland editor
It's nearly five years since the United Kingdom last went to the polls in a general election and a lot has happened in that time.
Three events in particular will have… [+9591 chars]",politics
"{'id': None, 'name': 'Freerepublic.com'}",The Federalist,The Martyring Of Hunter Biden Is A Distraction,"First, let’s dispel the myth that Hunter Biden’s conviction on gun charges proves that Joe Biden’s Department of Justice dispenses justice fairly.Democrats contend that Hunter is only facing gun charges because he’s the president’s son. While it’s true lying …",https://freerepublic.com/focus/f-news/4243936/posts,,2024-06-12T21:59:10Z,"Skip to comments.
The Martyring Of Hunter Biden Is A DistractionThe Federalist ^
 | June 12, 2024 
 | David Harsanyi
Posted on 06/12/2024 2:59:10 PM PDT by E. Pluribus Unum
First, lets dispel th… [+2631 chars]",politics
"{'id': None, 'name': 'Japan Today'}",,"Russia, largely excluded from international sports, hosts athletes at BRICS Games","Thousands of athletes in both major and obscure sports will be vying for medals in the Russian city of Kazan at the sixth BRICS Games, an international competition shadowed by politics amid Russia's exclusion from major sports events. The games opened Wednesd…",https://japantoday.com/category/sports/russia-largely-excluded-from-international-sports-hosts-athletes-at-brics-games,,2024-06-12T21:59:05Z,"Thousands of athletes in both major and obscure sports will be vying for medals in the Russian city of Kazan at the sixth BRICS Games, an international competition shadowed by politics amid Russia's … [+3325 chars]",politics
"{'id': None, 'name': 'Minneapolis Star Tribune'}",JULIE CARR SMYTH,A closer-than-expected Ohio congressional race surprises Republicans and encourages Democrats,A political newcomer's closer-than-expected finish in Tuesday's special congressional election in Ohio surprised Republicans and jolted Democrats in a former bellwether state both parties had all but given over to a runaway Trump victory this fall.,https://www.startribune.com/a-closer-than-expected-ohio-congressional-race-surprises-republicans-and-encourages-democrats/600373102/,https://www.startribune.com/static/img/branding/logos/strib-social-card.png?d=1717510706,2024-06-12T21:59:00Z,"COLUMBUS, Ohio A political newcomer's closer-than-expected finish in Tuesday's special congressional election in Ohio surprised Republicans and jolted Democrats in a former bellwether state both part… [+3002 chars]",politics
"{'id': None, 'name': 'Freerepublic.com'}",,Pelosi’s Embarrassing Home Movies,"Then-House Speaker Nancy Pelosi (D., Calif.) arrives with her daughter Alexandra at the Americans for the Arts National Arts Awards in New York City in 2009. (Lucas Jackson/Reuters) HBO empowers the entitled in worshipful documentaries made by the daughter of…",https://freerepublic.com/focus/f-news/4243932/posts,,2024-06-12T21:56:16Z,"Skip to comments.
Pelosis Embarrassing Home Movieshttps://www.nationalreview.com/2023/10/pelosis-embarrassing-home-movies/ ^Posted on 06/12/2024 2:56:16 PM PDT by cuz1961
Then-House Speaker Nancy P… [+2702 chars]",politics
"{'id': None, 'name': 'Investing.com'}",Reuters,Bank of Mexico says it could act to restore 'order' in markets,Bank of Mexico says it could act to restore 'order' in markets,https://www.investing.com/news/economy-news/bank-of-mexico-says-it-could-act-to-restore-order-in-markets-3482225,https://i-invdn-com.investing.com/news/indicatornews_5_800x533_L_1412601619.jpg,2024-06-12T21:55:38Z,"By Anthony Esposito and Brendan O'Boyle
MEXICO CITY (Reuters) - The Bank of Mexico is monitoring recent volatility in domestic financial markets, including foreign exchange markets, and could act to… [+2715 chars]",politics
"{'id': None, 'name': 'New York Post'}",Post Editorial Board,"Blame the hostage-takers, rise of the ghost voters and other commentary","“In a morally sane world, the rescue of civilian hostages should have been widely celebrated as a heroic operation,” not international outcry, lament National Review’s editors.",https://nypost.com/2024/06/12/opinion/blame-the-hostage-takers-rise-of-the-ghost-voters-and-other-commentary/,https://nypost.com/wp-content/uploads/sites/2/2024/06/newspress-collage-t5ftkfots-1718228421194.jpg?quality=75&strip=all&1718214845&w=1024,2024-06-12T21:54:21Z,"From the right: Blame the Hostage-Takers
In a morally sane world, the rescue of civilian hostages should have been widely celebrated as a heroic operation, yet Israels recent mission met with intern… [+3757 chars]",politics
"{'id': None, 'name': '[Removed]'}",,[Removed],[Removed],https://removed.com,,1970-01-01T00:00:00Z,[Removed],politics
"{'id': None, 'name': 'Japan Today'}",,France's Macron asks rivals to join electoral pact against far right,French President Emmanuel Macron on Wednesday urged rival parties on both sides of the political centre to join him in forging a democratic alliance against Marine Le Pen's far-right National Rally (RN) in an upcoming snap legislative election. In what amount…,https://japantoday.com/category/world/france%27s-macron-asks-rivals-to-join-electoral-pact-against-far-right,,2024-06-12T21:53:06Z,French President Emmanuel Macron on Wednesday urged rival parties on both sides of the political centre to join him in forging a democratic alliance against Marine Le Pen's far-right National Rally (… [+3031 chars],politics
"{'id': None, 'name': 'The Boston Globe'}",Rachel Siegel,"Fed holds interest rates steady, as officials eye one cut this year","The move, which was widely expected, came on the heels of fresh data showing inflation cooled in May.",https://www.bostonglobe.com/2024/06/12/business/fed-holds-interest-rates-steady-officials-eye-one-cut-this-year/,https://www.bostonglobe.com/pf/resources/images/logo-bg.jpg?d=476,2024-06-12T21:52:55Z,"Policymakers were also slightly more pessimistic than they had been on inflation and now expect their preferred inflation gauge to end the year at 2.6 percent, up from 2.4 percent. They held forecast… [+5833 chars]",politics
"{'id': None, 'name': 'Marketscreener.com'}",,Bank of Mexico says it could act to restore 'order' in markets,"(marketscreener.com) The Bank of Mexico is monitoring recent volatility in domestic financial markets, including foreign exchange markets, and could act to restore order in the event of ""atypical"" or ""extreme"" behavior, the bank's governor Victoria Rodriguez …",https://www.marketscreener.com/news/latest/Bank-of-Mexico-says-it-could-act-to-restore-order-in-markets-46961495/,https://www.marketscreener.com/images/reuters/2024-06/2024-06-12T215150Z_1_LYNXMPEK5B0XP_RTROPTP_3_MEXICO-ECONOMY-CENBANK.JPG,2024-06-12T21:51:50Z,"MEXICO CITY (Reuters) - The Bank of Mexico is monitoring recent volatility in domestic financial markets, including foreign exchange markets, and could act to restore order in the event of ""atypical""… [+2791 chars]",politics
"{'id': 'msnbc', 'name': 'MSNBC'}",James Downie,The Fed’s interest rate mistake is a gift for Trump,"On Wednesday, the Federal Reserve announced it is leaving interest rates unchanged at around 5.3%, their highest level since 2001.",https://www.msnbc.com/opinion/msnbc-opinion/federal-reserve-interest-rates-inflation-trump-rcna156357,"https://media-cldnry.s-nbcnews.com/image/upload/t_nbcnews-fp-1200-630,f_auto,q_auto:best/rockcms/2024-02/240202-donald-trump-jerome-powell-mn-1225-5b7292.jpg",2024-06-12T21:49:30Z,"On Wednesday, the Federal Reserve announced it is leaving interest rates unchanged at around 5.3%, their highest level since 2001. Federal Reserve Chair Jerome Powell suggested that one or two rate c… [+5117 chars]",politics
"{'id': None, 'name': 'Hyperallergic'}",Rhea Nayyar,Su Friedrich’s Life in Moving Images,"“I always had the feeling that there isn't just a single thing to do,” the artist told Hyperallergic. “I enjoy mixing text and images, real life and invented scenarios.”",http://hyperallergic.com/925298/su-friedrich-life-in-moving-images/,https://hyperallergic-newspack.s3.amazonaws.com/uploads/2024/06/su-at-cliffs-2023.jpg,2024-06-12T21:47:09Z,"Support Independent Arts Journalism
As an independent publication, we rely on readers like you to fund our journalism and keep our reporting and criticism free and accessible to all. If you value ou… [+7744 chars]",politics
"{'id': 'nbc-news', 'name': 'NBC News'}",The Politics Desk,What comes next for the Bidens after Hunter’s verdict: From the Politics Desk,President Joe Biden and first lady Jill Biden head to an international summit and on a campaign swing following Hunter's guilty verdict.,https://www.nbcnews.com/politics/what-comes-next-hunter-biden-guilty-verdict-politics-desk-rcna156862,"https://media-cldnry.s-nbcnews.com/image/upload/t_nbcnews-fp-1200-630,f_auto,q_auto:best/rockcms/2024-06/240612-joe-hunter-biden-newsletter-se-425p-34e4d8.jpg",2024-06-12T21:39:29Z,"Welcome to the online version of From the Politics Desk, an evening newsletter that brings you the NBC News Politics teams latest reporting and analysis from the campaign trail, the White House and C… [+5583 chars]",politics
"{'id': None, 'name': 'Freerepublic.com'}",The American Spectator,The Doppio Standard on the Alito and Pelosi Recordings: The standard is rigged.,"People recorded Nancy Pelosi and Samuel Alito. The circumstances behind the recordings of the two most prominent Italian-Americans in U.S. public life diverge from that point. “We have responsibility, Terri,” then-Speaker Pelosi told her chief of staff on Jan…",https://freerepublic.com/focus/f-news/4243928/posts,,2024-06-12T21:37:05Z,"Skip to comments.
 The Doppio Standard on the Alito and Pelosi Recordings: The standard is rigged. The American Spectator ^
 | June 11, 2024, 10:05 PM
 | Daniel J. Flynn
Posted on 06/12/2024 2:37… [+3292 chars]",politics
"{'id': None, 'name': 'Patheos'}",Fred Clark,An artifact from the Before Time,"Revisiting the 1981 white evangelical manifesto on ""Christianity and Democracy"" that never mentions abortion, ""the family"" or Teh Gay.",https://www.patheos.com/blogs/slacktivist/2024/06/12/an-artifact-from-the-before-time/,https://wp-media.patheos.com/blogs/sites/52/2024/06/ReaganBear-300x223-1.jpeg,2024-06-12T21:35:57Z,"As we mentioned on Saturday, theres a generation gap between white evangelicals whose earliest memories are the 1990s and those of us a bit older who can remember the 1970s and early 1980s. Millennia… [+8695 chars]",politics
"{'id': None, 'name': 'Foreign Policy'}",Michael Kugelman,How Will Modi Rule in Coalition?,"The Indian leader’s new administration looks much the same, but he could face challenges to his Hindu nationalist agenda.",https://foreignpolicy.com/2024/06/12/modi-india-bjp-coalition-government-election-politics/,https://foreignpolicy.com/wp-content/uploads/2024/06/modi-sworn-in-cabinet-india-GettyImages-2156861222.jpg?w=1000,2024-06-12T21:35:11Z,"Welcome to Foreign Policys South Asia Brief.Welcome to Foreign Policys South Asia Brief.
The highlights this week: Indian Prime Minister Narendra Modi begins his first term leading a coalition gover… [+9990 chars]",politics
"{'id': None, 'name': 'IndieWire'}",Ryan Lattanzio,"Robert Pattinson and Parker Finn Remaking ‘Possession,’ the 1981 Isabelle Adjani Cult Horror Classic","But confirmed producer Pattinson is not yet attached to star in the ""Smile"" writer/director's remake of Andrzej Żuławski's body horror divorce nightmare from 1981.",https://www.indiewire.com/news/breaking-news/possession-remake-robert-pattinson-parker-finn-1235015662/,https://www.indiewire.com/wp-content/uploads/2024/06/isabelle-adjani-robert-pattinson3.jpg?w=650,2024-06-12T21:31:38Z,"“Because you say ‘I’ for me…” and, apparently, because Hollywood said, “Here’s yet another cult classic we can now remake for profit.” It was inevitable that in the recent years since Andrzej Żuławsk… [+3531 chars]",politics
"{'id': 'the-jerusalem-post', 'name': 'The Jerusalem Post'}",BY ORI WERTMAN,Benny Gantz again in a political dilemma following resignation from gov't,"Waving the flag of nationality and unity, Gantz’s party managed to rise in the polls, mainly at the expense of Likud and Yesh Atid voters.",https://www.jpost.com/opinion/article-805971,"https://images.jpost.com/image/upload/f_auto,fl_lossy/c_fill,g_faces:center,h_407,w_690/603448",2024-06-12T21:30:53Z,"As the first politician in the history of the State of Israel to resign from the government during a war, perhaps the most important for the Jewish state since the War of Independence, Benny Gantz is… [+4380 chars]",politics
"{'id': None, 'name': 'Freerepublic.com'}",AP News,Entrapment in play as appeals court looks at plot to kidnap Michigan governor,DETROIT (AP) — An appeals court is raising major questions about the trial of two key figures in a plot to kidnap Michigan’s governor — and putting federal prosecutors on the defensive as the government tries to preserve the extraordinary guilty verdicts.Afte…,https://freerepublic.com/focus/f-news/4243923/posts,,2024-06-12T21:28:46Z,"Skip to comments.
Entrapment in play as appeals court looks at plot to kidnap Michigan governorAP News ^
 | Updated 10:41 AM CDT, June 12, 2024 
 | ED WHITE
Posted on 06/12/2024 2:28:46 PM PDT by… [+2456 chars]",politics
"{'id': None, 'name': 'Foreign Policy'}",Robert Zaretsky,What Was Macron Thinking?,France’s president is forcing voters to decide if they really want the National Rally in power—and betting that governing could dent the far-right's popularity before 2027.,https://foreignpolicy.com/2024/06/12/france-elections-macron-le-pen-national-rally/,https://foreignpolicy.com/wp-content/uploads/2024/06/macron-far-right-parliament-GettyImages-2157274719.jpg?w=1000,2024-06-12T21:26:39Z,Two seismic events rocked France last Sunday. Politicians are only now pulling themselves from the rubble and scrambling to make sense of their upended world.Two seismic events rocked France last Sun… [+12481 chars],politics
"{'id': None, 'name': 'UN News'}",United Nations,"Democratic People’s Republic of Korea Should Develop Economy, Not Missiles, Civil Society Representative Tells Security Council, Highlighting Population’s Plight","The Democratic People’s Republic of Korea invests most of its efforts into developing its military power, ignoring the State’s responsibility to allow its people to live full lives, a defector from that country told the Security Council today, stating that he…",https://press.un.org/en/2024/sc15726.doc.htm,,2024-06-12T21:23:54Z,"The Democratic Peoples Republic of Korea invests most of its efforts into developing its military power, ignoring the States responsibility to allow its people to live full lives, a defector from tha… [+36620 chars]",politics
"{'id': None, 'name': '[Removed]'}",,[Removed],[Removed],https://removed.com,,1970-01-01T00:00:00Z,[Removed],politics
"{'id': 'the-washington-post', 'name': 'The Washington Post'}",Aaron Blake,The incredible low-information voter,How much are Americans paying attention to politics? This little.,https://www.washingtonpost.com/politics/2024/06/12/campaign-moment/,https://www.washingtonpost.com/wp-apps/imrs.php?src=https://arc-anglerfish-washpost-prod-washpost.s3.amazonaws.com/public/YTBGVQV6EQI6TKFQP3MKBVO4LU.jpg&w=1440,2024-06-12T21:18:07Z,"Welcome to The Campaign Moment, your guide to the biggest developments in a 2024 election where convictions matter voters convictions, at least.
(Did a friend forward this to you? If so, sign up her… [+6866 chars]",politics
"{'id': None, 'name': 'Minneapolis Star Tribune'}",Katie Robertson,"Hunter Biden's laptop, revealed by New York Post, comes back to haunt him","Many claims about the laptop's contents have not been proved, but it played a role in Hunter Biden's prosecution over a firearm purchase.",https://www.startribune.com/hunter-bidens-laptop-revealed-by-new-york-post-comes-back-to-haunt-him/600373089/,https://arc.stimg.co/startribunemedia/GBY7BQKCKJFCNOXOOKC2YBYJ5U.JPG?h=630&w=1200&fit=crop&bg=999&crop=faces,2024-06-12T21:17:45Z,"When the New York Post first reported in 2020 about a laptop once used by Hunter Biden which the paper said contained incriminating evidence against him and his father, Joe Biden, who was running for… [+4403 chars]",politics
"{'id': 'cnn', 'name': 'CNN'}",Priscilla Alvarez,ACLU sues to stop Biden’s border executive action | CNN Politics,The American Civil Liberties Union sued the Biden administration Wednesday over a sweeping executive action that largely shuts off asylum to migrants crossing the US southern border illegally.,https://www.cnn.com/2024/06/12/politics/aclu-bidens-border-executive-action/index.html,"https://media.cnn.com/api/v1/images/stellar/prod/2024-06-06t143713z-1398298003-rc2au7ao82kv-rtrmadp-3-migration-usa-border-california-copy.jpg?c=16x9&q=w_800,c_fill",2024-06-12T21:16:07Z,"The American Civil Liberties Union sued the Biden administration Wednesday over a sweeping executive action that largely shuts off asylum to migrants crossing the US southern border illegally.
The e… [+2340 chars]",politics
