source,author,title,description,url,urlToImage,publishedAt,content,topic
"{'id': None, 'name': 'menshealth.com'}",Milan Polk,House of the Dragon Season 2 Will Be 10 Episodes of Bloodshed and Politics,"HBO's biggest show, House of the Dragon, is finally back. Here's when the newest episode premieres.",https://www.menshealth.com/entertainment/a61074710/house-of-the-dragon-season-2-release-schedule-hbo/,"https://hips.hearstapps.com/hmg-prod/images/hotd-season-2-6669e6dbb7de4.jpeg?crop=0.702xw:0.526xh;0.151xw,0.0913xh&resize=1200:*",2024-06-16T21:00:00Z,"FIVE YEARS OUT from the final episode of Game of Thrones, and we're once again spending time in Westeros. 
House of the Dragon is back for Season 2. If you thought Season 1 was intense, Season 2 is … [+2136 chars]",politics
"{'id': None, 'name': 'Freerepublic.com'}",West Virginia Record,W.Va. leads group asking U.S. Supreme Court to strike down order federalizing voter registration process,CHARLESTON – West Virginia Secretary of State Mac Warner and chief election officers in eight other states have joined to bring legal action to try to stop an executive order issued by President Joe Biden they say would federalize state elections. Warner – al…,https://freerepublic.com/focus/f-news/4244714/posts,,2024-06-16T20:50:22Z,"Skip to comments.
W.Va. leads group asking U.S. Supreme Court to strike down order federalizing voter registration processWest Virginia Record ^
 | Jun 6, 2024
 | Chris Dickerson
Posted on 06/16/… [+3182 chars]",politics
"{'id': None, 'name': 'Seclists.org'}",,Risks Digest 34.31,"Posted by RISKS List Owner on Jun 16RISKS-LIST: Risks-Forum Digest Sunday 16 Jun 2024 Volume 34 : Issue 31

ACM FORUM ON RISKS TO THE PUBLIC IN COMPUTERS AND RELATED SYSTEMS (comp.risks)
Peter G. Neumann, founder and still moderator

***** See last item for f…",https://seclists.org/risks/2024/q2/20,https://seclists.org/images/risks-img.png,2024-06-16T20:40:25Z,"From: RISKS List Owner &lt;risko () csl sri com&gt;Date: Sun, 16 Jun 2024 13:31:11 PDT
RISKS-LIST: Risks-Forum Digest Sunday 16 Jun 2024 Volume 34 : Issue 31
ACM FORUM ON RISKS TO THE PUBLIC IN COM… [+29186 chars]",politics
"{'id': None, 'name': 'Freerepublic.com'}",New Jersey Globe,AFL-CIO takes a pass on Kean vs. Altman in key national House race,"The New Jersey AFL-CIO will not take sides in the hotly contested race for Congress in New Jersey’s 7th district between Republican incumbent Tom Kean, Jr. and Democrat Sue Altman. That means national Democrats head into one of the races that could determine …",https://freerepublic.com/focus/f-news/4244711/posts,,2024-06-16T20:38:40Z,"Skip to comments.
AFL-CIO takes a pass on Kean vs. Altman in key national House raceNew Jersey Globe ^
 | June 11 2024
 | David Wildstein
Posted on 06/16/2024 1:38:40 PM PDT by T Ruth
The New Je… [+2703 chars]",politics
"{'id': None, 'name': 'STAT'}",Jason Mast,Inside Anthony Fauci’s ‘On Call’: 9 takeaways from the new memoir,"Inside Anthony Fauci’s ""On Call"": 9 health and science takeaways from the memoir of America’s most famous doctor.",https://www.statnews.com/2024/06/16/anthony-fauci-on-call-health-science-takeaways/,https://www.statnews.com/wp-content/uploads/2020/09/AP_20114010345681-1024x576.jpg,2024-06-16T20:34:53Z,"Anthony Fauci spent 40 years in the top echelons of government. It was no accident.
To read the forthcoming memoir by the countrys former top infectious disease expert, On Call: A Doctors Journey in… [+11768 chars]",politics
"{'id': None, 'name': 'Freerepublic.com'}",The Holy Bible (KJV),Revelation Ch. 17 and 2 Corinthians Ch. 13,"""So he carried me away in the spirit into the wilderness: and I saw a woman sit upon a scarlet coloured beast, full of names of blasphemy, having seven heads and ten horns. ""And the woman was arrayed in purple and scarlet colour, and decked with gold and prec…",https://freerepublic.com/focus/f-religion/4244710/posts,,2024-06-16T20:29:13Z,"Skip to comments.
Revelation Ch. 17 and 2 Corinthians Ch. 13The Holy Bible (KJV) ^Posted on 06/16/2024 1:29:13 PM PDT by Faith Presses On
""So he carried me away in the spirit into the wilderness: a… [+6068 chars]",politics
"{'id': None, 'name': 'Freerepublic.com'}",Bangor Daily News,Austin Theriault wins Maine GOP primary for chance to unseat Jared Golden,"AUGUSTA, Maine — Former NASCAR driver Austin Theriault easily defeated fellow state lawmaker Mike Soboleski in Tuesday’s Republican primary for Maine’s 2nd Congressional District, setting up a showdown with U.S. Rep. Jared Golden in November. *** While Sobole…",https://freerepublic.com/focus/f-news/4244709/posts,,2024-06-16T20:25:50Z,"Skip to comments.
Austin Theriault wins Maine GOP primary for chance to unseat Jared Golden Bangor Daily News ^
 | June 11, 2024 Updated June 12, 2024
 | Billy Kobin
Posted on 06/16/2024 1:25:50 … [+2902 chars]",politics
"{'id': None, 'name': 'Statetimes.in'}",statetimes_editor,"No need to teach about riots, demolition in schools; no attempts to saffronise textbooks: NCERT Chief","STATE TIMES NEWS NEW DELHI: Rejecting accusations of saffronisation of school curriculum, NCERT’s Director has said that references to Gujarat riots and Babri masjid demolition were modified in school textbooks because teaching about riots “can create violent…",https://statetimes.in/no-need-to-teach-about-riots-demolition-in-schools-no-attempts-to-saffronise-textbooks-ncert-chief/,https://statetimes.in/wp-content/uploads/2024/06/Screenshot-2024-06-17-014049.png,2024-06-16T20:23:41Z,"STATE TIMES NEWS
NEW DELHI: Rejecting accusations of saffronisation of school curriculum, NCERT’s Director has said that references to Gujarat riots and Babri masjid demolition were modified in scho… [+5903 chars]",politics
"{'id': None, 'name': 'The Boston Globe'}",Niki Griswold,Is ranked-choice voting a good idea for Boston elections? City Council President Louijeune thinks so.,"Though a ballot measure to implement ranked-choice voting in Massachusetts failed statewide in 2020, more than 60 percent of Boston voters supported the idea.",https://www.bostonglobe.com/2024/06/16/metro/ranked-choice-voting-boston-elections/,https://bostonglobe-prod.cdn.arcpublishing.com/resizer/s7ahgGHbZL5mazsgc8k0VVtiNfw=/506x0/cloudfront-us-east-1.images.arcpublishing.com/bostonglobe/BAWSENROJLOLRFS4NYRJ2QV6UM.jpg,2024-06-16T20:01:13Z,"Now, proponents are reviving the effort to implement the electoral change, seeking to let Boston voters have a direct say on ranked-choice voting in city elections.
Boston City Council President Rut… [+5897 chars]",politics
"{'id': 'the-jerusalem-post', 'name': 'The Jerusalem Post'}",BY ANDREW SILOW-CARROLL/JTA,Pulitzer Prize finalist tells story of the Jewish lawyer who tried to keep Emma Goldman out of jail,Michael Willrich's latest book 'American Anarchy: The Epic Struggle between Immigrant Radicals and the US Government at the Dawn of the Twentieth Century' explores themes of anarchy and censorship.,https://www.jpost.com/j-spot/article-806510,"https://images.jpost.com/image/upload/f_auto,fl_lossy/c_fill,g_faces:center,h_407,w_690/604278",2024-06-16T19:54:46Z,"(JTA) — In his 2012 book, “Pox,” historian Michael Willrich looked at the politics of vaccination during the last great waves of smallpox in the United States. That’s when he discovered the case file… [+16064 chars]",politics
"{'id': 'the-irish-times', 'name': 'The Irish Times'}",Mark Hennessy,"Reconciliation and reunification should be pursued in parallel, conference told","Leo Varadkar, Mary Lou McDonald and former UDA member David Adams among speakers at Ireland’s Future conference in Belfast",https://www.irishtimes.com/ireland/2024/06/16/reconciliation-and-reunification-should-be-pursued-in-parallel-conference-told/,https://www.irishtimes.com/resizer/G0pa2XNzqMK-kMdEvFNRBXKiFQg=/1200x630/filters:format(jpg):quality(70)/cloudfront-eu-central-1.images.arcpublishing.com/irishtimes/LQMZ2MF44ORVT7QXELLIJOYKEQ.jpg,2024-06-16T19:46:31Z,Sometimes a moment that later appears significant can happen when the world is busy looking at other things - especially on a Saturday afternoon in Belfasts Titanic Quarter when most people were taki… [+13204 chars],politics
"{'id': None, 'name': 'Freerepublic.com'}",NY Post,Texas Dem pol and ex-Biden appointee arrested for allegedly posting fake racist social comments about himself,"An ex-Biden White House appointee and current Democratic candidate for a county commissioner seat in Texas allegedly created a dummy social media account to post bogus racist comments about himself. Taral Patel, 30, the challenger running for county commissio…",https://freerepublic.com/focus/f-news/4244708/posts,,2024-06-16T19:45:28Z,"Skip to comments.
Texas Dem pol and ex-Biden appointee arrested for allegedly posting fake racist social comments about himselfNY Post ^
 | June 16, 2024
 | Chris Nesi
Posted on 06/16/2024 12:45:… [+3113 chars]",politics
"{'id': None, 'name': 'New Zealand Herald'}",,Four young Māori earn scholarships for ivy league education,"This year’s winners come from Rotorua, Whangārei and Inglewood in Taranaki.",https://www.nzherald.co.nz/kahu/four-young-maori-earn-scholarships-for-ivy-league-education/KRLFEJMDLRBN3M64KYCYHOXYGA/,https://www.nzherald.co.nz/resizer/v2/NWZ2ZYH54WWT3JGLZYPJ4U4HJY.jpg?auth=1d42e2a87d85765815da1de682d09600c03b25b2fda2bb0dc8f07ebfc40517b5&width=1200&height=675&quality=70&smart=true,2024-06-16T19:44:14Z,Harvard University. Photo / Jacob RusThe academic dreams of four extraordinary Mori students from across the country have taken a giant leap forward with the naming of this years Te Ara a Kupe Beaton… [+5136 chars],politics
"{'id': None, 'name': 'Sputnikglobe.com'}",Sputnik International,Russia Urges International Organizations to Condemn Murder of Media Worker in DPR – Moscow,"MOSCOW (Sputnik) - Russia is demanding that the relevant international organizations, primarily UNESCO, immediately condemn the murder of Nikita Tsitsagi, a military correspondent for the News.ru portal, in the Donetsk People's Republic (DPR), Russian Foreign…",https://sputnikglobe.com/20240616/russia-urges-international-organizations-to-condemn-murder-of-media-worker-in-dpr--moscow-1118990748.html,https://cdn1.img.sputnikglobe.com/images/sharing/article/eng/1118990748.jpg?11160068221718566769,2024-06-16T19:39:29Z,"The latest news and stories from Russia. Stay tuned for updates and breaking news on defense, politics, economy and more.
https://sputnikglobe.com/20240616/russia-urges-international-organizations-t… [+2827 chars]",politics
"{'id': None, 'name': 'TheJournal.ie'}",Eoghan Dalton,Here's What Happened Today: Sunday,Here’s your evening round-up of today’s headlines.,https://www.thejournal.ie/evening-headlines-23-6411136-Jun2024/,https://img2.thejournal.ie/article/6411136/river/?height=400&version=6411152,2024-06-16T19:27:03Z,"NEED TO CATCH up? The Journal brings you a round-up of todays headlines.
IRELAND
James Joyce lookalike John Shevlin attends the Bloomsday Breakfast at Belvedere College in Dublin. Bloomsday is a ce… [+1507 chars]",politics
"{'id': None, 'name': 'Mediaite'}",Phillip Nieto,Texas Democrat Charged With Sending Fake Racist Online Messages to Himself,"A local Texas political candidate has been arrested for fabricating fake online racist messages to himself, posing as supporters of his rival.
The post Texas Democrat Charged With Sending Fake Racist Online Messages to Himself first appeared on Mediaite.",https://www.mediaite.com/politics/texas-democrat-charged-with-sending-fake-racist-online-messages-to-himself/,https://www.mediaite.com/wp-content/uploads/2024/06/mugshot-patel.jpg,2024-06-16T19:23:54Z,"A local Texas political candidate has been arrested for fabricating fake online racist messages to himself, posing as supporters of his rival.
Texas Rangers arrested Taral Patel on charges of Online… [+2302 chars]",politics
"{'id': 'football-italia', 'name': 'Football Italia'}",Lorenzo Bettoni,Mbappé backs Inter star Thuram in France’s political row,Kylian Mbappé shares the same view as his teammate Marcus Thuram regarding the political situation in France: 'Extremists are close to taking over.',https://football-italia.net/mbappe-backs-thuram-in-france-political-row/,https://icdn.football-italia.net/wp-content/uploads/2024/02/Marcus-Thuram-Inter-grin.jpg,2024-06-16T19:20:15Z,"Kylian Mbappé shares the same view as his teammate Marcus Thuram regarding the political situation in France: Extremists are close to taking over.
France are about to make their EURO 2024 debut, but… [+1912 chars]",politics
"{'id': None, 'name': 'Thehillstimes.in'}",The Hills Times,Held discussions with stakeholders: LS speaker on relocation of statues in Parl complex,"NEW DELHI, June 16: Statues of freedom fighters and national icons spread across the Parliament complex have been relocated to a new enclosure on its premises, Prerna Sthal, following discussions with different stakeholders, Lok Sabha Speaker Om Birla said on…",https://thehillstimes.in/national/held-discussions-with-stakeholders-ls-speaker-on-relocation-of-statues-in-parl-complex,,2024-06-16T19:10:32Z,"NEW DELHI, June 16: Statues of freedom fighters and national icons spread across the Parliament complex have been relocated to a new enclosure on its premises, Prerna Sthal, following discussions wit… [+3307 chars]",politics
"{'id': 'cbs-news', 'name': 'CBS News'}",Kaia Hubbard,"Turner says Johnson will ""assert leadership"" if any ""improper"" behavior by in committee","Rep. Mike Turner, the chairman of the House Intelligence Committee, said that he expects Speaker Mike Johnson to intervene if ""improper"" behavior occurs from new appointees Reps. Ronny Jackson and Scott Perry.",https://www.cbsnews.com/news/mike-turner-house-intelligence-committee-scott-perry-ronny-jackson-face-the-nation/,https://assets1.cbsnewsstatic.com/hub/i/r/2024/06/16/5d93952d-87bd-45dc-aae3-889513af2b0e/thumbnail/1200x630/46549b02fed5e82bcb86a19e81f153eb/1718554356986.png?v=5842509bb796a146f9b20d3e8b03dac6,2024-06-16T19:05:10Z,"Washington — Rep. Mike Turner, the chairman of the House Intelligence Committee, said on Sunday that he expects Speaker Mike Johnson to intervene should any ""improper"" behavior occur after the speake… [+3208 chars]",politics
"{'id': 'cbs-news', 'name': 'CBS News'}",Kaia Hubbard,Schumer to bring up vote on gun bump stocks ban after Supreme Court decision,"Senate Majority Leader Chuck Schumer said he plans to bring up a vote on restoring the bump stock ban under unanimous consent, which could be halted by opposition from just a single lawmaker.",https://www.cbsnews.com/news/bump-stocks-chuck-schumer-senate-unanimous-consent-vote/,https://assets2.cbsnewsstatic.com/hub/i/r/2024/03/23/dc1d9907-24c1-4923-90ef-fc8d7b141b28/thumbnail/1200x630/a510c77bbd5bd2e0067bb961cb7a62a6/gettyimages-2099930742.jpg?v=5842509bb796a146f9b20d3e8b03dac6,2024-06-16T19:03:01Z,"Washington — Senate Majority Leader Chuck Schumer announced on Sunday that he plans to bring up a vote this week on restoring a ban on bump stocks, devices that greatly increase the rate of fire of s… [+1645 chars]",politics
"{'id': 'abc-news-au', 'name': 'ABC News (AU)'}",Patricia Karvelas,We've seen it in US politics and now it's happening in Australia: What is the rise of the 'double hater'?,The past week has given us a taste of the degustation of political messages we are about to be bombarded with ahead of the next election. And it isn't pretty.,https://www.abc.net.au/news/2024-06-17/dutton-and-albanese-unpopular-survey-shows-rise-of-double-haters/103984330,https://live-production.wcms.abc-cdn.net.au/e82805cbce172f38b1703e40a80a332e?impolicy=wcms_watermark_news&cropH=2520&cropW=4480&xPos=0&yPos=0&width=862&height=485&imformat=generic,2024-06-16T19:00:00Z,"The elites in Paris versus the battlers in Australia.
Climate action and emissions reduction targets crashing the economy.
Three-eyed fish and a nuclear dystopia.
A secret slash-and-burn agenda.
… [+9230 chars]",politics
"{'id': None, 'name': 'Freerepublic.com'}",New York Post,"Biden appears to freeze up, has to be led off stage by Obama at mega-bucks LA fundraiser",President Biden appeared to freeze up on stage and had to be led off by Barack Obama at the conclusion of a star-studded campaign fundraiser in Los Angeles Saturday night.The awkward moment took place after Biden and his predecessor sat for a 45-minute interv…,https://freerepublic.com/focus/f-news/4244701/posts,,2024-06-16T18:59:19Z,"Skip to comments.
Biden appears to freeze up, has to be led off stage by Obama at mega-bucks LA fundraiserNew York Post ^
 | Jun 16, 2024 05:57 PM
 | Chris Nesi
Posted on 06/16/2024 11:59:19 AM P… [+3644 chars]",politics
"{'id': 'abc-news-au', 'name': 'ABC News (AU)'}","Avani Dias, Dylan Welch, Mayeta Clark, Mridula Amin, and Nick Wiggins",The call came at midnight with a veiled threat in Punjabi: Stop 'or the result will be bad',"The long arm of the Indian state is reaching Australians with threats against members of the Indian diaspora, the amassing of political power, and never-before-reported details of a ""nest of spies"".",https://www.abc.net.au/news/2024-06-17/modis-indian-government-accused-of-spying-silencing-critics/103974414,https://live-production.wcms.abc-cdn.net.au/8f1e8ea60adfec817bd2f14fc19cf69c?impolicy=wcms_watermark_news&cropH=2813&cropW=5000&xPos=0&yPos=260&width=862&height=485&imformat=generic,2024-06-16T18:52:28Z,"The long arm of the Indian state is reaching Australians and threatening national security.
Late one night in January 2023, Harjinder Singh's phone rang while he drove his taxi around Melbourne. It … [+20158 chars]",politics
"{'id': None, 'name': 'The Daily Caller'}",Hailey Gomez,"Dem Gov Blames ‘Broken Immigration Policy’ For Mother’s Murder By Illegal Alien, Says Biden Executive Action Not ’Enough’","Dem Gov. Wes Moore blamed ""broken immigration policy"" for the death of a mother allegedly killed by an illegal immigrant, calling out Biden's as not ""enough.""",https://dailycaller.com/2024/06/16/wes-moore-maryland-broken-immigration-policy-joe-biden-executive-action-not-enough-margaret-brennan-rachel-morin/,https://cdn01.dailycaller.com/wp-content/uploads/2024/06/Screenshot-2024-06-16-at-10.08.13%e2%80%afAM-e1718557921585.png,2024-06-16T18:38:46Z,"Democratic Maryland Gov. Wes Moore blamed “broken immigration policy” for the death of a mother allegedly killed by a Salvadorian illegal immigrant Sunday on CBS, stating that President Joe Biden’s r… [+2961 chars]",politics
"{'id': None, 'name': 'Freerepublic.com'}",The New American,"Prediction of Regional Polar Bear Extinction Is ""Useless Fearmongering""","A recent study is predicting a dire future for the polar bear population on Canada’s Hudson Bay due to the effects of global warming, which climate zealots claim is caused primarily by mankind’s emissions from using fossil fuels to power civilization. But at …",https://freerepublic.com/focus/f-news/4244698/posts,,2024-06-16T18:38:17Z,"Skip to comments.
Prediction of Regional Polar Bear Extinction Is ""Useless Fearmongering""The New American ^
 | June 16, 2024
 | By James Murphy
Posted on 06/16/2024 11:38:17 AM PDT by E. Pluribus… [+3458 chars]",politics
"{'id': None, 'name': 'Sky.com'}",Alexandra Rogers,Nigel Farage to launch 'contract with the people' in Wales following poll boosts,"Nigel Farage will kick off Reform UK's policies in South Wales on Monday, where he is poised to put pressure on the Tories over immigration and tax.",https://news.sky.com/story/nigel-farage-to-launch-contract-with-the-people-in-wales-following-poll-boosts-13154079,https://e3.365dm.com/24/06/1600x900/skynews-nigel-farage-reform_6581420.jpg?20240614130506,2024-06-16T18:34:00Z,"Nigel Farage will kick off Reform UK's policies in South Wales on Monday, where he is poised to put pressure on the Tories over immigration and tax.
The Reform leader will launch his party's ""contra… [+5106 chars]",politics
"{'id': None, 'name': 'TheJournal.ie'}",AFP,Mbappe warns French politics faces 'crucial moment' with 'extremists very close to power',"‘People often say we shouldn’t mix football and politics but when it is situations like this it is very important,” he told reporters.",https://www.thejournal.ie/mbappe-france-election-6411112-Jun2024/,https://img2.thejournal.ie/article/6411112/river/?height=400&version=6411127,2024-06-16T18:33:45Z,"FRANCE SUPERSTAR AND captain Kylian Mbappe has warned that extremists are very close to winning power in his country, ahead of the country going to the polls.
The footballer also said that players a… [+3766 chars]",politics
"{'id': None, 'name': 'Forbes'}","Nives Dolsak and Aseem Prakash, Contributor, 
 Nives Dolsak and Aseem Prakash, Contributor
 https://www.forbes.com/sites/prakashdolsak/",Climate Betrayal Or Climate Leadership? New York’s Congestion Pricing And Congressional Politics,Might the pause in the New York congestion pricing help Democrats win back suburban New York Congressional seats and retake the House in 2024 elections?,https://www.forbes.com/sites/prakashdolsak/2024/06/16/climate-betrayal-or-climate-leadership-new-yorks-congestion-pricing-and-congressional-politics/,https://imageio.forbes.com/specials-images/imageserve/666f239c101ae6a166b1fd56/0x0.jpg?format=jpg&height=900&width=1600&fit=bounds,2024-06-16T18:30:42Z,"NEW YORK, NEW YORK - MARCH 6: New York Governor Kathy Hochul speaks during a press conference to ... [+] announce new subway safety measures at NYCTA Rail Control Center on March 6, 2024 in New York … [+6436 chars]",politics
"{'id': None, 'name': 'Farooqkperogi.com'}",Farooq A. Kperogi,Japanese Words and Names Sound African. Why?,"A blog by Professor Farooq Kperogi about Nigeria, America, politics, education, culture, identity, media, language, English grammar, and much more.",https://www.farooqkperogi.com/2022/10/japanese-words-and-names-sound-african.html,https://blogger.googleusercontent.com/img/b/R29vZ2xl/AVvXsEgKGPHxg2vWy_cisaKH6ry9hPwULEtZsaqTseBZKfXidmXOCmczY4FhHYhBB4f3SsDiS_W8EM8IQH2qg_toA94ez_WmAjh69UqBLReN2PKz6nh2y75l3YLZZ0VueHnz0YURpn5NaREe4v-8ol88tML1L1ob6Xk-d025Ja5ImTrpasCFXpq5eODfrRfA/w1200-h630-p-k-no-nu/Japanese%20and%20Africans.jpg,2024-06-16T18:20:38Z,"By Farooq Kperogi
Twitter: @farooqkperogi
Most Japanese words and names sound like—and actually appear in—most languages in west, central, east, and even southern African. The reverse is also true:… [+4670 chars]",politics
"{'id': None, 'name': 'Thegatewaypundit.com'}",Cassandra MacDonald,British TV Host Issues Groveling Apology After ‘Misgendering’ Actress Who Identifies as ‘They/Them’,A British TV host has issued a groveling apology after “misgendering” a female actress who identifies as “they/them.” Host Sue Perkins had referred to actress Emma D’Arcy as “she” during an interview with Matt Smith promoting the second season of HBO’s Game o…,https://www.thegatewaypundit.com/2024/06/british-tv-host-issues-groveling-apology-after-misgendering/,https://www.thegatewaypundit.com/wp-content/uploads/2024/06/untitled-18.jpg,2024-06-16T18:20:23Z,"A British TV host has issued a groveling apology after “misgendering” a female actress who identifies as “they/them.”
Host Sue Perkins had referred to actress Emma DArcy as she during an interview w… [+1543 chars]",politics
"{'id': None, 'name': 'Daily Beast'}",Rachel Olding,Jerry Seinfeld Goes to Town on Anti-Israel Heckler Who Interrupted His Set,"David Swanson/Reuters
Jerry Seinfeld’s performance in Australia on Sunday was briefly derailed by an anti-Israel heckler who was mercilessly mocked by the comedian. “We have a genius ladies and gentlemen, he solved the Middle East,” Seinfeld joked as the cro…",https://www.thedailybeast.com/jerry-seinfeld-goes-to-town-after-being-interrupted-by-anti-israel-heckler,"https://img.thedailybeast.com/image/upload/c_crop,d_placeholder_euli9k,h_4608,w_8192,x_0,y_635/dpr_2.0/c_limit,w_740/fl_lossy,q_auto/v1718561036/2024-05-01T044631Z_1218312103_RC2EH7A2J4IY_RTRMADP_3_FILM-UNFROSTED-PREMIERE_g21hxs",2024-06-16T18:17:23Z,"Jerry Seinfelds performance in Australia on Sunday was briefly derailed by an anti-Israel heckler who was mercilessly mocked by the comedian. 
We have a genius ladies and gentlemen, he solved the Mi… [+1501 chars]",politics
"{'id': None, 'name': 'Freerepublic.com'}",Rumble,VIDEO: Embarrassing Uranium Fact AVOIDED by Margaret Brennan during Bill Gates Interview,"VIDEO Bill Gates was interviewed on ""Face The Nation"" by host Margaret Brennan on the topic of developing the newest generation of nuclear reactors. During the interview Brennan broached the topic of something that could have been very very revealing about th…",https://freerepublic.com/focus/f-bloggers/4244694/posts,,2024-06-16T18:17:01Z,"Skip to comments.
VIDEO: Embarrassing Uranium Fact AVOIDED by Margaret Brennan during Bill Gates InterviewRumble ^
 | June 16, 2024
 | DUmmie FUnnies
Posted on 06/16/2024 11:17:01 AM PDT by PJ-Co… [+1586 chars]",politics
